paper_id,doi,title,route,route_confidence,endpoint_carrier,formulation_carrier,anchor_evidence,notes,raw_labels
paper_0a6d64ed678d,,Subcellular actions of non-steroidal anti-inflammatory drugs : lysosome and prostaglandin studies,unresolved,0.0,unknown,unknown,[],missing_structured_and_pdf_router_source,"{'title': 'Subcellular actions of non-steroidal anti-inflammatory drugs : lysosome and prostaglandin studies', 'router_source_backend': 'missing', 'router_source_ref': '', 'router_source_diagnostics': []}"
paper_3978d47b3a2c,10.1002/(sici)1520-636x(1997)9:3<313::aid-chir19>3.0.co;2-q,Topical administration of racemic ibuprofen.,unresolved,0.0,unknown,unknown,[],missing_structured_and_pdf_router_source,"{'title': 'Topical administration of racemic ibuprofen.', 'router_source_backend': 'missing', 'router_source_ref': '', 'router_source_diagnostics': []}"
paper_6d7ce6948405,10.1002/14651858.cd001177.pub2,Topical agents or dressings for pain in venous leg ulcers.,table,0.69,table_text,table_text,"[{'field_name': 'endpoint', 'modality': 'table', 'locator': 'Analysis 2.1, Analysis 2.2, Analysis 2.3, Analysis 3.1, Results section', 'page': None, 'bbox': None, 'snippet': 'Analysis 2.1 compares ibuprofen foam dressing with foam dressing alone, detailing outcomes such as pain relief and wound healing.', 'source_ref': '10.1002/14651858.cd001177.pub2', 'confidence': 0.8}, {'field_name': 'formulation', 'modality': 'table', 'locator': 'table_text', 'page': None, 'bbox': None, 'snippet': 'References the composition and application of ibuprofen foam dressings in trials, found in Analysis sections and Results.', 'source_ref': '10.1002/14651858.cd001177.pub2', 'confidence': 0.7}]","The review synthesizes evidence related to topical agents including ibuprofen dressings in the context of venous leg ulcers, addressing pain relief outcomes.","{'paper_type': 'review', 'mentions_ibuprofen': 'yes', 'mentions_diffusion_cell': 'no', 'franz_confirmed': 'no', 'where_diffusion_cell': '', 'where_franz': '', 'study_type': 'both', 'barrier_category': 'both', 'barrier_name_raw': 'venous leg ulcers', 'endpoint_found': 'yes', 'endpoint_time_found': 'yes', 'where_endpoint': 'Analysis 2.1, Analysis 2.2, Analysis 2.3, Analysis 3.1, Results section', 'endpoint_carrier': 'table_text', 'endpoint_carrier_snippet': 'Analysis 2.1 compares ibuprofen foam dressing with foam dressing alone, detailing outcomes such as pain relief and wound healing.', 'formulation_carrier': 'table_text', 'formulation_carrier_snippet': 'References the composition and application of ibuprofen foam dressings in trials, found in Analysis sections and Results.', 'endpoint_likely_in_supp': 'no', 'formulation_table_missing': 'no', 'notes': 'The review synthesizes evidence related to topical agents including ibuprofen dressings in the context of venous leg ulcers, addressing pain relief outcomes.', 'router_source_backend': 'pdf_local', 'router_source_ref': 'papers\\pdf\\10.1002_14651858.cd001177.pub2__f1d6f61f65.pdf', 'router_source_diagnostics': [], 'router_heuristic_signals': {}}"
paper_92afc39ccd63,10.1002/14651858.cd001177.pub3,Topical agents or dressings for pain in venous leg ulcers.,unresolved,0.2,unknown,unknown,"[{'field_name': 'device', 'modality': 'text', 'locator': 'unknown', 'page': None, 'bbox': None, 'snippet': 'unknown', 'source_ref': '10.1002/14651858.cd001177.pub3', 'confidence': 0.7}, {'field_name': 'endpoint', 'modality': 'metadata', 'locator': 'unknown', 'page': None, 'bbox': None, 'snippet': 'unknown', 'source_ref': '10.1002/14651858.cd001177.pub3', 'confidence': 0.8}, {'field_name': 'formulation', 'modality': 'metadata', 'locator': 'unknown', 'page': None, 'bbox': None, 'snippet': 'unknown', 'source_ref': '10.1002/14651858.cd001177.pub3', 'confidence': 0.7}]",No relevant extraction information available.,"{'paper_type': 'uncertain', 'mentions_ibuprofen': 'no', 'mentions_diffusion_cell': 'no', 'franz_confirmed': 'no', 'where_diffusion_cell': 'unknown', 'where_franz': 'unknown', 'study_type': 'uncertain', 'barrier_category': 'uncertain', 'barrier_name_raw': 'unknown', 'endpoint_found': 'no', 'endpoint_time_found': 'no', 'where_endpoint': 'unknown', 'endpoint_carrier': 'unknown', 'endpoint_carrier_snippet': 'unknown', 'formulation_carrier': 'unknown', 'formulation_carrier_snippet': 'unknown', 'endpoint_likely_in_supp': 'no', 'formulation_table_missing': 'no', 'notes': 'No relevant extraction information available.', 'router_source_backend': 'pdf_local', 'router_source_ref': 'papers\\pdf\\10.1002_14651858.cd001177.pub3__a6c5e430fc.pdf', 'router_source_diagnostics': ['blocked:html_remote:captcha'], 'router_heuristic_signals': {'table_hits': 0, 'figure_hits': 0, 'endpoint_hits': 0, 'formulation_hits': 0}}"
paper_244198a8d171,10.1002/adhm.201600591,Magnetically Controlled Drug Release System through Magnetomechanical Actuation.,unresolved,0.0,unknown,unknown,[],missing_structured_and_pdf_router_source,"{'title': 'Magnetically Controlled Drug Release System through Magnetomechanical Actuation.', 'router_source_backend': 'missing', 'router_source_ref': '', 'router_source_diagnostics': []}"
paper_b0c15dc016b9,10.1002/advs.202510976,Nanogel Integrated Zwitterionic Injectable Hydrogel with Sequential Drug-Releasing Capability for the Programmable Repair of Spinal Cord Injury.,unresolved,0.0,unknown,unknown,[],,"{'paper_type': 'other', 'mentions_ibuprofen': 'no', 'mentions_diffusion_cell': 'no', 'franz_confirmed': 'no', 'where_diffusion_cell': '', 'where_franz': '', 'study_type': 'uncertain', 'barrier_category': 'uncertain', 'barrier_name_raw': '', 'endpoint_found': 'no', 'endpoint_time_found': 'no', 'where_endpoint': '', 'endpoint_carrier': 'unknown', 'endpoint_carrier_snippet': '', 'formulation_carrier': 'unknown', 'formulation_carrier_snippet': '', 'endpoint_likely_in_supp': 'no', 'formulation_table_missing': 'no', 'notes': '', 'router_source_backend': 'pdf_local', 'router_source_ref': 'papers\\pdf\\10.1002_advs.202510976__9e81eb0534.pdf', 'router_source_diagnostics': ['blocked:html_remote:captcha'], 'router_heuristic_signals': {'table_hits': 0, 'figure_hits': 0, 'endpoint_hits': 0, 'formulation_hits': 0}}"
paper_e35b9fb3e6b5,10.1002/ams2.457,A rare case of Reye's syndrome induced by influenza A virus with use of ibuprofen in an adult.,unresolved,0.0,unknown,unknown,[],missing_structured_and_pdf_router_source:blocked:html_remote:captcha,"{'title': ""A rare case of Reye's syndrome induced by influenza A virus with use of ibuprofen in an adult."", 'router_source_backend': 'missing', 'router_source_ref': '', 'router_source_diagnostics': ['blocked:html_remote:captcha']}"
paper_fd72d2eca67a,10.1002/ardp.201300279,Synthesis and evaluation of 2-(2-arylmorpholino)ethyl esters of ibuprofen hydrochlorides as COX-2 and serotonin reuptake inhibitors.,unresolved,0.0,unknown,unknown,[],missing_structured_and_pdf_router_source,"{'title': 'Synthesis and evaluation of 2-(2-arylmorpholino)ethyl esters of ibuprofen hydrochlorides as COX-2 and serotonin reuptake inhibitors.', 'router_source_backend': 'missing', 'router_source_ref': '', 'router_source_diagnostics': []}"
paper_5bf9e3e37e6c,10.1002/bdd.631,Skin disposition of menthol after its application in the presence of drug substances.,unresolved,0.0,unknown,unknown,[],missing_structured_and_pdf_router_source,"{'title': 'Skin disposition of menthol after its application in the presence of drug substances.', 'router_source_backend': 'missing', 'router_source_ref': '', 'router_source_diagnostics': []}"
paper_69ea1a42d71b,10.1002/bmc.1365,Enantiomeric separation of 2-arylpropionic acid nonsteroidal anti-inflammatory drugs by HPLC with hydroxypropyl-beta-cyclodextrin as chiral mobile phase additive.,unresolved,0.0,unknown,unknown,[],missing_structured_and_pdf_router_source,"{'title': 'Enantiomeric separation of 2-arylpropionic acid nonsteroidal anti-inflammatory drugs by HPLC with hydroxypropyl-beta-cyclodextrin as chiral mobile phase additive.', 'router_source_backend': 'missing', 'router_source_ref': '', 'router_source_diagnostics': []}"
paper_58f3f695a704,10.1002/chem.201600105,Supramolecular Gels by Design: Towards the Development of Topical Gels for Self-Delivery Application.,unresolved,0.0,unknown,unknown,[],missing_structured_and_pdf_router_source,"{'title': 'Supramolecular Gels by Design: Towards the Development of Topical Gels for Self-Delivery Application.', 'router_source_backend': 'missing', 'router_source_ref': '', 'router_source_diagnostics': []}"
paper_46aa27000d85,10.1002/cpdd.297,Analgesic Efficacy of a New Immediate-Release/Extended-Release Formulation of Ibuprofen: Results From Single- and Multiple-Dose Postsurgical Dental Pain Studies.,text,0.81,narrative,unknown,"[{'field_name': 'device', 'modality': 'text', 'locator': 'uncertain', 'page': None, 'bbox': None, 'snippet': 'uncertain', 'source_ref': '10.1002/cpdd.297', 'confidence': 0.7}, {'field_name': 'endpoint', 'modality': 'text', 'locator': 'text', 'page': None, 'bbox': None, 'snippet': 'Results From Single- and Multiple-Dose Postsurgical Dental Pain Studies', 'source_ref': '10.1002/cpdd.297', 'confidence': 0.8}, {'field_name': 'formulation', 'modality': 'metadata', 'locator': 'unknown', 'page': None, 'bbox': None, 'snippet': 'uncertain', 'source_ref': '10.1002/cpdd.297', 'confidence': 0.7}]",Data extraction needs specific endpoint details from the text.,"{'paper_type': 'primary_experiment', 'mentions_ibuprofen': 'yes', 'mentions_diffusion_cell': 'no', 'franz_confirmed': 'no', 'where_diffusion_cell': 'uncertain', 'where_franz': 'uncertain', 'study_type': 'both', 'barrier_category': 'uncertain', 'barrier_name_raw': 'uncertain', 'endpoint_found': 'yes', 'endpoint_time_found': 'no', 'where_endpoint': 'text', 'endpoint_carrier': 'narrative', 'endpoint_carrier_snippet': 'Results From Single- and Multiple-Dose Postsurgical Dental Pain Studies', 'formulation_carrier': 'unknown', 'formulation_carrier_snippet': 'uncertain', 'endpoint_likely_in_supp': 'uncertain', 'formulation_table_missing': 'yes', 'notes': 'Data extraction needs specific endpoint details from the text.', 'router_source_backend': 'pdf_local', 'router_source_ref': 'papers\\pdf\\10.1002_cpdd.297__8614015a51.pdf', 'router_source_diagnostics': ['blocked:html_remote:captcha'], 'router_heuristic_signals': {}}"
paper_89ec992d2cac,10.1002/etc.4302,Effects of skin region and relative lipophilicity on percutaneous absorption in the toad Rhinella marina.,text,0.81,narrative,unknown,"[{'field_name': 'device', 'modality': 'text', 'locator': 'unknown', 'page': None, 'bbox': None, 'snippet': 'unknown', 'source_ref': '10.1002/etc.4302', 'confidence': 0.7}, {'field_name': 'endpoint', 'modality': 'text', 'locator': 'text', 'page': None, 'bbox': None, 'snippet': 'effects of relative lipophilicity on absorption', 'source_ref': '10.1002/etc.4302', 'confidence': 0.8}, {'field_name': 'formulation', 'modality': 'metadata', 'locator': 'unknown', 'page': None, 'bbox': None, 'snippet': 'unknown', 'source_ref': '10.1002/etc.4302', 'confidence': 0.7}]",Research on percutaneous absorption using toad skin.,"{'paper_type': 'primary_experiment', 'mentions_ibuprofen': 'no', 'mentions_diffusion_cell': 'no', 'franz_confirmed': 'no', 'where_diffusion_cell': 'unknown', 'where_franz': 'unknown', 'study_type': 'IVPT', 'barrier_category': 'skin', 'barrier_name_raw': 'toad skin', 'endpoint_found': 'yes', 'endpoint_time_found': 'uncertain', 'where_endpoint': 'text', 'endpoint_carrier': 'narrative', 'endpoint_carrier_snippet': 'effects of relative lipophilicity on absorption', 'formulation_carrier': 'unknown', 'formulation_carrier_snippet': 'unknown', 'endpoint_likely_in_supp': 'no', 'formulation_table_missing': 'yes', 'notes': 'Research on percutaneous absorption using toad skin.', 'router_source_backend': 'pdf_local', 'router_source_ref': 'papers\\pdf\\10.1002_etc.4302__6928b548af.pdf', 'router_source_diagnostics': [], 'router_heuristic_signals': {}}"
paper_79890f9d9026,10.1002/jbm.a.34095,Polyaspartamide-polylactide electrospun scaffolds for potential topical release of Ibuprofen.,unresolved,0.0,unknown,unknown,[],missing_structured_and_pdf_router_source,"{'title': 'Polyaspartamide-polylactide electrospun scaffolds for potential topical release of Ibuprofen.', 'router_source_backend': 'missing', 'router_source_ref': '', 'router_source_diagnostics': []}"
paper_df3972501fd6,10.1002/jbm.a.34292,Modeling of drug release from biodegradable triple-layered microparticles.,unresolved,0.0,unknown,unknown,[],missing_structured_and_pdf_router_source,"{'title': 'Modeling of drug release from biodegradable triple-layered microparticles.', 'router_source_backend': 'missing', 'router_source_ref': '', 'router_source_diagnostics': []}"
paper_1e2fb1658151,10.1002/jmr.3089,"Synthesis, molecular dynamics simulation, and evaluation of biological activity of novel flurbiprofen and ibuprofen-like compounds.",unresolved,0.0,unknown,unknown,[],missing_structured_and_pdf_router_source,"{'title': 'Synthesis, molecular dynamics simulation, and evaluation of biological activity of novel flurbiprofen and ibuprofen-like compounds.', 'router_source_backend': 'missing', 'router_source_ref': '', 'router_source_diagnostics': []}"
paper_78ec4fb95c70,10.1002/jps.20623,Penetration of crystalline powder particles into excised human skin membranes and model gels from a supersonic powder injector.,unresolved,0.0,unknown,unknown,[],missing_structured_and_pdf_router_source,"{'title': 'Penetration of crystalline powder particles into excised human skin membranes and model gels from a supersonic powder injector.', 'router_source_backend': 'missing', 'router_source_ref': '', 'router_source_diagnostics': []}"
paper_e23ccfcf23e7,10.1002/jps.23548,"Influence of physicochemical properties on the in vitro skin permeation of the enantiomers, racemate, and eutectics of ibuprofen for enhanced transdermal drug delivery.",unresolved,0.0,unknown,unknown,[],missing_structured_and_pdf_router_source,"{'title': 'Influence of physicochemical properties on the in vitro skin permeation of the enantiomers, racemate, and eutectics of ibuprofen for enhanced transdermal drug delivery.', 'router_source_backend': 'missing', 'router_source_ref': '', 'router_source_diagnostics': []}"
paper_0ea81ef2fdf2,10.1002/jps.24052,Numerical modelling of transdermal delivery from matrix systems: parametric study and experimental validation with silicone matrices.,unresolved,0.0,unknown,unknown,[],missing_structured_and_pdf_router_source,"{'title': 'Numerical modelling of transdermal delivery from matrix systems: parametric study and experimental validation with silicone matrices.', 'router_source_backend': 'missing', 'router_source_ref': '', 'router_source_diagnostics': []}"
paper_18f9f1c31ac6,10.1002/jps.24556,Investigation of pH Influence on Skin Permeation Behavior of Weak Acids Using Nonsteroidal Anti-Inflammatory Drugs.,unresolved,0.0,unknown,unknown,[],missing_structured_and_pdf_router_source,"{'title': 'Investigation of pH Influence on Skin Permeation Behavior of Weak Acids Using Nonsteroidal Anti-Inflammatory Drugs.', 'router_source_backend': 'missing', 'router_source_ref': '', 'router_source_diagnostics': []}"
paper_561abc239285,10.1002/jps.2600841208,Transdermal delivery of drugs with differing lipophilicities using azone analogs as dermal penetration enhancers.,unresolved,0.0,unknown,unknown,[],missing_structured_and_pdf_router_source,"{'title': 'Transdermal delivery of drugs with differing lipophilicities using azone analogs as dermal penetration enhancers.', 'router_source_backend': 'missing', 'router_source_ref': '', 'router_source_diagnostics': []}"
paper_d264824515e7,10.1002/mabi.201900412,Stimuli Responsive Scaffolds Based on Carboxymethyl Starch and Poly(2-Dimethylaminoethyl Methacrylate) for Anti-Inflammatory Drug Delivery.,unresolved,0.0,unknown,unknown,[],missing_structured_and_pdf_router_source,"{'title': 'Stimuli Responsive Scaffolds Based on Carboxymethyl Starch and Poly(2-Dimethylaminoethyl Methacrylate) for Anti-Inflammatory Drug Delivery.', 'router_source_backend': 'missing', 'router_source_ref': '', 'router_source_diagnostics': []}"
paper_f259de4127b5,10.1002/mrc.1329,Multi-dimensional pulsed field gradient magic angle spinning NMR experiments on membranes.,unresolved,0.0,unknown,unknown,[],missing_structured_and_pdf_router_source,"{'title': 'Multi-dimensional pulsed field gradient magic angle spinning NMR experiments on membranes.', 'router_source_backend': 'missing', 'router_source_ref': '', 'router_source_diagnostics': []}"
paper_24932e7765c5,10.1002/open.202400206,New Ibuprofen Cystamine Salts With Improved Solubility and Anti-Inflammatory Effect.,unresolved,0.2,unknown,unknown,"[{'field_name': 'device', 'modality': 'text', 'locator': 'unknown', 'page': None, 'bbox': None, 'snippet': 'unknown', 'source_ref': '10.1002/open.202400206', 'confidence': 0.7}, {'field_name': 'endpoint', 'modality': 'metadata', 'locator': 'unknown', 'page': None, 'bbox': None, 'snippet': 'unknown', 'source_ref': '10.1002/open.202400206', 'confidence': 0.8}, {'field_name': 'formulation', 'modality': 'metadata', 'locator': 'unknown', 'page': None, 'bbox': None, 'snippet': 'unknown', 'source_ref': '10.1002/open.202400206', 'confidence': 0.7}]",This document consists of only the frontend and introductory content without substantive data extractable.,"{'paper_type': 'uncertain', 'mentions_ibuprofen': 'yes', 'mentions_diffusion_cell': 'uncertain', 'franz_confirmed': 'uncertain', 'where_diffusion_cell': 'unknown', 'where_franz': 'unknown', 'study_type': 'uncertain', 'barrier_category': 'uncertain', 'barrier_name_raw': 'unknown', 'endpoint_found': 'uncertain', 'endpoint_time_found': 'uncertain', 'where_endpoint': 'unknown', 'endpoint_carrier': 'unknown', 'endpoint_carrier_snippet': 'unknown', 'formulation_carrier': 'unknown', 'formulation_carrier_snippet': 'unknown', 'endpoint_likely_in_supp': 'uncertain', 'formulation_table_missing': 'uncertain', 'notes': 'This document consists of only the frontend and introductory content without substantive data extractable.', 'router_source_backend': 'pdf_local', 'router_source_ref': 'papers\\pdf\\10.1002_open.202400206__efc74ebbd7.pdf', 'router_source_diagnostics': ['blocked:html_remote:captcha'], 'router_heuristic_signals': {'table_hits': 0, 'figure_hits': 0, 'endpoint_hits': 0, 'formulation_hits': 0}}"
paper_18833a391396,10.1002/open.202500038,Ibuprofen-Functionalized Alkyl α-hydroxy Methacrylate-Based Polymers.,unresolved,0.0,unknown,unknown,[],Document structure primarily consists of navigation elements and does not provide relevant scientific content.,"{'paper_type': 'uncertain', 'mentions_ibuprofen': 'yes', 'mentions_diffusion_cell': 'no', 'franz_confirmed': 'no', 'where_diffusion_cell': '', 'where_franz': '', 'study_type': 'uncertain', 'barrier_category': 'uncertain', 'barrier_name_raw': '', 'endpoint_found': 'uncertain', 'endpoint_time_found': 'uncertain', 'where_endpoint': '', 'endpoint_carrier': 'unknown', 'endpoint_carrier_snippet': '', 'formulation_carrier': 'unknown', 'formulation_carrier_snippet': '', 'endpoint_likely_in_supp': 'uncertain', 'formulation_table_missing': 'uncertain', 'notes': 'Document structure primarily consists of navigation elements and does not provide relevant scientific content.', 'router_source_backend': 'pdf_local', 'router_source_ref': 'papers\\pdf\\10.1002_open.202500038__ca478fccf0.pdf', 'router_source_diagnostics': ['blocked:html_remote:captcha'], 'router_heuristic_signals': {'table_hits': 0, 'figure_hits': 0, 'endpoint_hits': 0, 'formulation_hits': 0}}"
paper_72169dbdfd13,10.1006/abio.1998.2842,Analysis of prostaglandin G/H synthase-2 inhibition using peroxidase-induced luminol luminescence.,unresolved,0.0,unknown,unknown,[],missing_structured_and_pdf_router_source,"{'title': 'Analysis of prostaglandin G/H synthase-2 inhibition using peroxidase-induced luminol luminescence.', 'router_source_backend': 'missing', 'router_source_ref': '', 'router_source_diagnostics': []}"
paper_1f3c544b574c,10.1007/978-1-4939-0363-4_7,Microneedle-iontophoresis combinations for enhanced transdermal drug delivery.,unresolved,0.0,unknown,unknown,[],"The document does not clearly mention ibuprofen or diffusion cells, and specific endpoints or formulations were not identified.","{'paper_type': 'primary_experiment', 'mentions_ibuprofen': 'no', 'mentions_diffusion_cell': 'no', 'franz_confirmed': 'no', 'where_diffusion_cell': '', 'where_franz': '', 'study_type': 'uncertain', 'barrier_category': 'uncertain', 'barrier_name_raw': '', 'endpoint_found': 'uncertain', 'endpoint_time_found': 'uncertain', 'where_endpoint': '', 'endpoint_carrier': 'unknown', 'endpoint_carrier_snippet': '', 'formulation_carrier': 'unknown', 'formulation_carrier_snippet': '', 'endpoint_likely_in_supp': 'no', 'formulation_table_missing': 'uncertain', 'notes': 'The document does not clearly mention ibuprofen or diffusion cells, and specific endpoints or formulations were not identified.', 'router_source_backend': 'pdf_local', 'router_source_ref': 'papers\\pdf\\10.1007_978-1-4939-0363-4_7__6fa5f5aae3.pdf', 'router_source_diagnostics': [], 'router_heuristic_signals': {'table_hits': 1, 'figure_hits': 0, 'endpoint_hits': 0, 'formulation_hits': 2}}"
paper_2e81c7f1dcab,10.1007/bf00914030,"Steroids decrease granulocyte membrane fluidity, while phorbol ester increases membrane fluidity. Studies using electron paramagnetic resonance.",unresolved,0.0,unknown,unknown,[],missing_structured_and_pdf_router_source,"{'title': 'Steroids decrease granulocyte membrane fluidity, while phorbol ester increases membrane fluidity. Studies using electron paramagnetic resonance.', 'router_source_backend': 'missing', 'router_source_ref': '', 'router_source_diagnostics': []}"
paper_f2544d473fc0,10.1007/bf02912445,Benzydamine inhibits the release of tumor necrosis factor-alpha and monocyte chemotactic protein-1 by Candida albicans-stimulated human peripheral blood cells.,unresolved,0.0,unknown,unknown,[],missing_structured_and_pdf_router_source,"{'title': 'Benzydamine inhibits the release of tumor necrosis factor-alpha and monocyte chemotactic protein-1 by Candida albicans-stimulated human peripheral blood cells.', 'router_source_backend': 'missing', 'router_source_ref': '', 'router_source_diagnostics': []}"
paper_921c326a6663,10.1007/s000110300009,CD40 ligation triggers COX-2 expression in endothelial cells: evidence that CD40-mediated IL-6 synthesis is COX-2-dependent.,unresolved,0.0,unknown,unknown,[],missing_structured_and_pdf_router_source,"{'title': 'CD40 ligation triggers COX-2 expression in endothelial cells: evidence that CD40-mediated IL-6 synthesis is COX-2-dependent.', 'router_source_backend': 'missing', 'router_source_ref': '', 'router_source_diagnostics': []}"
paper_bd923af22ffb,10.1007/s002100100434,Human umbilical vein: involvement of cyclooxygenase-2 pathway in bradykinin B1 receptor-sensitized responses.,unresolved,0.0,unknown,unknown,[],missing_structured_and_pdf_router_source,"{'title': 'Human umbilical vein: involvement of cyclooxygenase-2 pathway in bradykinin B1 receptor-sensitized responses.', 'router_source_backend': 'missing', 'router_source_ref': '', 'router_source_diagnostics': []}"
paper_4afdb849a51d,10.1007/s00216-005-3296-z,Ultrafiltration behavior of selected pharmaceuticals on natural and synthetic membranes in the presence of humic-rich hydrocolloids.,unresolved,0.0,unknown,unknown,[],missing_structured_and_pdf_router_source,"{'title': 'Ultrafiltration behavior of selected pharmaceuticals on natural and synthetic membranes in the presence of humic-rich hydrocolloids.', 'router_source_backend': 'missing', 'router_source_ref': '', 'router_source_diagnostics': []}"
paper_583d7d25201d,10.1007/s00232-002-1032-6,Effect of ibuprofen and rofecoxib transport parameters in the frog corneal epithelium.,unresolved,0.0,unknown,unknown,[],missing_structured_and_pdf_router_source,"{'title': 'Effect of ibuprofen and rofecoxib transport parameters in the frog corneal epithelium.', 'router_source_backend': 'missing', 'router_source_ref': '', 'router_source_diagnostics': []}"
paper_63ae0f53cf40,10.1007/s00431-021-03930-6,Pediatric procedural sedation and analgesia in the emergency department: surveying the current European practice.,unresolved,0.0,unknown,unknown,[],No relevant information about ibuprofen or related dermal formulations extracted.,"{'paper_type': 'other', 'mentions_ibuprofen': 'no', 'mentions_diffusion_cell': 'no', 'franz_confirmed': 'no', 'where_diffusion_cell': '', 'where_franz': '', 'study_type': 'uncertain', 'barrier_category': 'uncertain', 'barrier_name_raw': '', 'endpoint_found': 'no', 'endpoint_time_found': 'no', 'where_endpoint': '', 'endpoint_carrier': 'unknown', 'endpoint_carrier_snippet': '', 'formulation_carrier': 'unknown', 'formulation_carrier_snippet': '', 'endpoint_likely_in_supp': 'no', 'formulation_table_missing': 'uncertain', 'notes': 'No relevant information about ibuprofen or related dermal formulations extracted.', 'router_source_backend': 'pdf_local', 'router_source_ref': 'papers\\pdf\\10.1007_s00431-021-03930-6__f741d12388.pdf', 'router_source_diagnostics': ['blocked:html_remote:captcha'], 'router_heuristic_signals': {'table_hits': 0, 'figure_hits': 0, 'endpoint_hits': 0, 'formulation_hits': 0}}"
