paper_id,doi,title,route,route_confidence,endpoint_carrier,formulation_carrier,anchor_evidence,notes,raw_labels
paper_0564594b6c9a,10.1111/j.1365-2133.2009.09220.x,Ibuprofen and hydrogel-released ibuprofen in the reduction of inflammation-induced migration in melanoma cells.,unresolved,0.0,unknown,unknown,[],missing_structured_and_pdf_router_source,"{'title': 'Ibuprofen and hydrogel-released ibuprofen in the reduction of inflammation-induced migration in melanoma cells.', 'router_source_backend': 'missing', 'router_source_ref': '', 'router_source_diagnostics': []}"
paper_64393ed9fb46,10.1111/j.1398-9995.1990.tb00946.x,Effect of a single dose of a topical glucocorticoid and a cyclo-oxygenase inhibitor on allergen-induced changes in nasal reactivity.,unresolved,0.0,unknown,unknown,[],missing_structured_and_pdf_router_source,"{'title': 'Effect of a single dose of a topical glucocorticoid and a cyclo-oxygenase inhibitor on allergen-induced changes in nasal reactivity.', 'router_source_backend': 'missing', 'router_source_ref': '', 'router_source_diagnostics': []}"
paper_37598504bae5,10.1111/j.1398-9995.2011.02684.x,Response to a selective COX-2 inhibitor in patients with urticaria/angioedema induced by nonsteroidal anti-inflammatory drugs.,unresolved,0.0,unknown,unknown,[],missing_structured_and_pdf_router_source,"{'title': 'Response to a selective COX-2 inhibitor in patients with urticaria/angioedema induced by nonsteroidal anti-inflammatory drugs.', 'router_source_backend': 'missing', 'router_source_ref': '', 'router_source_diagnostics': []}"
paper_a8a8cc73a986,10.1111/j.1472-765x.1995.tb01291.x,Antibacterial activity of the anti-inflammatory compound ibuprofen.,unresolved,0.0,unknown,unknown,[],missing_structured_and_pdf_router_source,"{'title': 'Antibacterial activity of the anti-inflammatory compound ibuprofen.', 'router_source_backend': 'missing', 'router_source_ref': '', 'router_source_diagnostics': []}"
paper_db3312a1b052,10.1111/j.1476-5381.1988.tb11640.x,"Protection of rat atrial myocardium against electrical, mechanical and structural aspects of injury caused by exposure in vitro to conditions of simulated ischaemia.",unresolved,0.0,unknown,unknown,[],missing_structured_and_pdf_router_source:blocked:html_remote:captcha,"{'title': 'Protection of rat atrial myocardium against electrical, mechanical and structural aspects of injury caused by exposure in vitro to conditions of simulated ischaemia.', 'router_source_backend': 'missing', 'router_source_ref': '', 'router_source_diagnostics': ['blocked:html_remote:captcha']}"
paper_6343051e7ec7,10.1111/j.1476-5381.1991.tb09844.x,Excretion of metabolites of prostacyclin and thromboxane by rats with nephrotoxic nephritis: effects of interleukin-1.,unresolved,0.0,unknown,unknown,[],The document does not appear to cover relevant details regarding ibuprofen or diffusion cells.,"{'paper_type': 'other', 'mentions_ibuprofen': 'no', 'mentions_diffusion_cell': 'no', 'franz_confirmed': 'no', 'where_diffusion_cell': '', 'where_franz': '', 'study_type': 'uncertain', 'barrier_category': 'uncertain', 'barrier_name_raw': '', 'endpoint_found': 'no', 'endpoint_time_found': 'no', 'where_endpoint': '', 'endpoint_carrier': 'unknown', 'endpoint_carrier_snippet': '', 'formulation_carrier': 'unknown', 'formulation_carrier_snippet': '', 'endpoint_likely_in_supp': 'no', 'formulation_table_missing': 'no', 'notes': 'The document does not appear to cover relevant details regarding ibuprofen or diffusion cells.', 'router_source_backend': 'pdf_local', 'router_source_ref': 'papers\\pdf\\10.1111_j.1476-5381.1991.tb09844.x__d9d0a07b3e.pdf', 'router_source_diagnostics': ['blocked:html_remote:captcha'], 'router_heuristic_signals': {'table_hits': 0, 'figure_hits': 0, 'endpoint_hits': 0, 'formulation_hits': 0}}"
paper_36f8311c4b00,10.1111/j.1476-5381.1995.tb14938.x,Mechanisms of bradykinin-induced contraction of the guinea-pig gallbladder in vitro.,unresolved,0.0,unknown,unknown,[],No relevant content found in the provided document.,"{'paper_type': 'other', 'mentions_ibuprofen': 'no', 'mentions_diffusion_cell': 'no', 'franz_confirmed': 'no', 'where_diffusion_cell': '', 'where_franz': '', 'study_type': 'uncertain', 'barrier_category': 'uncertain', 'barrier_name_raw': '', 'endpoint_found': 'no', 'endpoint_time_found': 'uncertain', 'where_endpoint': '', 'endpoint_carrier': 'unknown', 'endpoint_carrier_snippet': '', 'formulation_carrier': 'unknown', 'formulation_carrier_snippet': '', 'endpoint_likely_in_supp': 'no', 'formulation_table_missing': 'no', 'notes': 'No relevant content found in the provided document.', 'router_source_backend': 'pdf_local', 'router_source_ref': 'papers\\pdf\\10.1111_j.1476-5381.1995.tb14938.x__1a7d2c4806.pdf', 'router_source_diagnostics': ['blocked:html_remote:captcha'], 'router_heuristic_signals': {'table_hits': 0, 'figure_hits': 0, 'endpoint_hits': 0, 'formulation_hits': 0}}"
paper_f13847b25cdb,10.1111/j.1567-1364.2009.00504.x,Ibuprofen reverts antifungal resistance on Candida albicans showing overexpression of CDR genes.,unresolved,0.0,unknown,unknown,[],missing_structured_and_pdf_router_source,"{'title': 'Ibuprofen reverts antifungal resistance on Candida albicans showing overexpression of CDR genes.', 'router_source_backend': 'missing', 'router_source_ref': '', 'router_source_diagnostics': []}"
paper_b1d6bef6a409,10.1111/j.1742-481x.2007.00308.x,A pilot (real-life) randomised clinical evaluation of a pain-relieving foam dressing: (ibuprofen-foam versus local best practice).,unresolved,0.0,unknown,unknown,[],missing_structured_and_pdf_router_source:blocked:html_remote:captcha,"{'title': 'A pilot (real-life) randomised clinical evaluation of a pain-relieving foam dressing: (ibuprofen-foam versus local best practice).', 'router_source_backend': 'missing', 'router_source_ref': '', 'router_source_diagnostics': ['blocked:html_remote:captcha']}"
paper_c7a4cc7e17d6,10.1111/j.1742-481x.2007.00312.x,"Less pain with Biatain-Ibu: initial findings from a randomised, controlled, double-blind clinical investigation on painful venous leg ulcers.",unresolved,0.0,unknown,unknown,[],"Extractable evidence is likely to be found in the clinical study outcomes or findings, but specific details are currently not visible in the supplied text.","{'paper_type': 'clinical', 'mentions_ibuprofen': 'yes', 'mentions_diffusion_cell': 'no', 'franz_confirmed': 'no', 'where_diffusion_cell': '', 'where_franz': '', 'study_type': 'uncertain', 'barrier_category': 'uncertain', 'barrier_name_raw': '', 'endpoint_found': 'uncertain', 'endpoint_time_found': 'uncertain', 'where_endpoint': '', 'endpoint_carrier': 'unknown', 'endpoint_carrier_snippet': '', 'formulation_carrier': 'unknown', 'formulation_carrier_snippet': '', 'endpoint_likely_in_supp': 'no', 'formulation_table_missing': 'uncertain', 'notes': 'Extractable evidence is likely to be found in the clinical study outcomes or findings, but specific details are currently not visible in the supplied text.', 'router_source_backend': 'pdf_local', 'router_source_ref': 'papers\\pdf\\10.1111_j.1742-481x.2007.00312.x__9aff95be6a.pdf', 'router_source_diagnostics': ['blocked:html_remote:captcha'], 'router_heuristic_signals': {'table_hits': 0, 'figure_hits': 0, 'endpoint_hits': 0, 'formulation_hits': 0}}"
paper_b32454acf5e0,10.1111/j.2042-7158.1985.tb04926.x,"Absorption through human skin of ibuprofen and flurbiprofen; effect of dose variation, deposited drug films, occlusion and the penetration enhancer N-methyl-2-pyrrolidone.",unresolved,0.0,unknown,unknown,[],missing_structured_and_pdf_router_source,"{'title': 'Absorption through human skin of ibuprofen and flurbiprofen; effect of dose variation, deposited drug films, occlusion and the penetration enhancer N-methyl-2-pyrrolidone.', 'router_source_backend': 'missing', 'router_source_ref': '', 'router_source_diagnostics': []}"
paper_5728a1abee10,10.1111/j.2042-7158.2010.01090.x,Solubilisation of drugs within liposomal bilayers: alternatives to cholesterol as a membrane stabilising agent.,unresolved,0.0,unknown,unknown,[],missing_structured_and_pdf_router_source,"{'title': 'Solubilisation of drugs within liposomal bilayers: alternatives to cholesterol as a membrane stabilising agent.', 'router_source_backend': 'missing', 'router_source_ref': '', 'router_source_diagnostics': []}"
paper_c614a40d430f,10.1123/ijspp.2016-0382,The Impact of Central and Peripheral Cyclooxygenase Enzyme Inhibition on Exercise-Induced Elevations in Core Body Temperature.,mixed,0.69,table_text,narrative,"[{'field_name': 'endpoint', 'modality': 'table', 'locator': 'Results', 'page': None, 'bbox': None, 'snippet': 'Table 2 shows RPE and average thermal comfort among conditions.', 'source_ref': '10.1123/ijspp.2016-0382', 'confidence': 0.8}, {'field_name': 'formulation', 'modality': 'text', 'locator': 'narrative', 'page': None, 'bbox': None, 'snippet': 'Subjects administered ibuprofen 400mg and acetaminophen 1000mg before exercise.', 'source_ref': '10.1123/ijspp.2016-0382', 'confidence': 0.7}]",,"{'paper_type': 'primary_experiment', 'mentions_ibuprofen': 'yes', 'mentions_diffusion_cell': 'no', 'franz_confirmed': 'no', 'where_diffusion_cell': '', 'where_franz': '', 'study_type': 'uncertain', 'barrier_category': 'uncertain', 'barrier_name_raw': '', 'endpoint_found': 'yes', 'endpoint_time_found': 'yes', 'where_endpoint': 'Results', 'endpoint_carrier': 'table_text', 'endpoint_carrier_snippet': 'Table 2 shows RPE and average thermal comfort among conditions.', 'formulation_carrier': 'narrative', 'formulation_carrier_snippet': 'Subjects administered ibuprofen 400mg and acetaminophen 1000mg before exercise.', 'endpoint_likely_in_supp': 'no', 'formulation_table_missing': 'no', 'notes': '', 'router_source_backend': 'pdf_local', 'router_source_ref': 'papers\\pdf\\10.1123_ijspp.2016-0382__60e1a4e580.pdf', 'router_source_diagnostics': [], 'router_heuristic_signals': {}}"
paper_b8248b40a8c1,10.1124/jpet.108.145797,Kinetics of cellular retention during Caco-2 permeation experiments: role of lysosomal sequestration and impact on permeability estimates.,unresolved,0.0,unknown,unknown,[],missing_structured_and_pdf_router_source:html_remote:HTTPError,"{'title': 'Kinetics of cellular retention during Caco-2 permeation experiments: role of lysosomal sequestration and impact on permeability estimates.', 'router_source_backend': 'missing', 'router_source_ref': '', 'router_source_diagnostics': ['html_remote:HTTPError']}"
paper_5c4c70848128,10.1128/aac.39.12.2615,"Use of decimal assay for additivity to demonstrate synergy in pair combinations of econazole, nikkomycin Z, and ibuprofen against Candida albicans in vitro.",unresolved,0.2,unknown,unknown,"[{'field_name': 'device', 'modality': 'text', 'locator': 'unknown', 'page': None, 'bbox': None, 'snippet': 'unknown', 'source_ref': '10.1128/aac.39.12.2615', 'confidence': 0.7}, {'field_name': 'endpoint', 'modality': 'metadata', 'locator': 'unknown', 'page': None, 'bbox': None, 'snippet': 'unknown', 'source_ref': '10.1128/aac.39.12.2615', 'confidence': 0.8}, {'field_name': 'formulation', 'modality': 'metadata', 'locator': 'unknown', 'page': None, 'bbox': None, 'snippet': 'unknown', 'source_ref': '10.1128/aac.39.12.2615', 'confidence': 0.7}]",The document does not provide specific details on endpoints or formulations.,"{'paper_type': 'other', 'mentions_ibuprofen': 'yes', 'mentions_diffusion_cell': 'no', 'franz_confirmed': 'no', 'where_diffusion_cell': 'unknown', 'where_franz': 'unknown', 'study_type': 'uncertain', 'barrier_category': 'uncertain', 'barrier_name_raw': 'unknown', 'endpoint_found': 'no', 'endpoint_time_found': 'no', 'where_endpoint': 'unknown', 'endpoint_carrier': 'unknown', 'endpoint_carrier_snippet': 'unknown', 'formulation_carrier': 'unknown', 'formulation_carrier_snippet': 'unknown', 'endpoint_likely_in_supp': 'no', 'formulation_table_missing': 'yes', 'notes': 'The document does not provide specific details on endpoints or formulations.', 'router_source_backend': 'pdf_local', 'router_source_ref': 'papers\\pdf\\10.1128_aac.39.12.2615__4a05fdc1ea.pdf', 'router_source_diagnostics': ['blocked:html_remote:captcha'], 'router_heuristic_signals': {'table_hits': 0, 'figure_hits': 0, 'endpoint_hits': 0, 'formulation_hits': 0}}"
paper_34659ff1ae7a,10.1128/iai.67.10.5076-5082.1999,Pseudomonas aeruginosa quorum-sensing signal molecule N-(3-oxododecanoyl)-L-homoserine lactone inhibits expression of P2Y receptors in cystic fibrosis tracheal gland cells.,unresolved,0.0,unknown,unknown,[],missing_structured_and_pdf_router_source:html_remote:HTTPError,"{'title': 'Pseudomonas aeruginosa quorum-sensing signal molecule N-(3-oxododecanoyl)-L-homoserine lactone inhibits expression of P2Y receptors in cystic fibrosis tracheal gland cells.', 'router_source_backend': 'missing', 'router_source_ref': '', 'router_source_diagnostics': ['html_remote:HTTPError']}"
paper_451c75edf732,10.1136/bmjopen-2011-000076,Non-steroidal anti-inflammatory drug (NSAID) related inhibition of aldosterone glucuronidation and arterial dysfunction in patients with rheumatoid arthritis: a cross-sectional clinical study.,unresolved,0.0,unknown,unknown,[],,"{'paper_type': 'clinical', 'mentions_ibuprofen': 'yes', 'mentions_diffusion_cell': 'no', 'franz_confirmed': 'no', 'where_diffusion_cell': '', 'where_franz': '', 'study_type': 'uncertain', 'barrier_category': 'uncertain', 'barrier_name_raw': '', 'endpoint_found': 'no', 'endpoint_time_found': 'no', 'where_endpoint': '', 'endpoint_carrier': 'unknown', 'endpoint_carrier_snippet': '', 'formulation_carrier': 'unknown', 'formulation_carrier_snippet': '', 'endpoint_likely_in_supp': 'uncertain', 'formulation_table_missing': 'yes', 'notes': '', 'router_source_backend': 'pdf_local', 'router_source_ref': 'papers\\pdf\\10.1136_bmjopen-2011-000076__7fdc9eb4cf.pdf', 'router_source_diagnostics': ['blocked:html_remote:captcha'], 'router_heuristic_signals': {'table_hits': 0, 'figure_hits': 0, 'endpoint_hits': 0, 'formulation_hits': 0}}"
paper_ab2b8ac752ec,10.1152/ajpcell.2001.281.1.c147,Contrasting effects of cPLA2 on epithelial Na+ transport.,unresolved,0.0,unknown,unknown,[],missing_structured_and_pdf_router_source:html_remote:ConnectionError,"{'title': 'Contrasting effects of cPLA2 on epithelial Na+ transport.', 'router_source_backend': 'missing', 'router_source_ref': '', 'router_source_diagnostics': ['html_remote:ConnectionError']}"
paper_5ca3bb9f21b7,10.1152/ajplung.1997.272.5.l879,Ozone inactivates cyclooxygenase in human tracheal epithelial cells without altering PGHS-2 mRNA or protein.,unresolved,0.0,unknown,unknown,[],missing_structured_and_pdf_router_source,"{'title': 'Ozone inactivates cyclooxygenase in human tracheal epithelial cells without altering PGHS-2 mRNA or protein.', 'router_source_backend': 'missing', 'router_source_ref': '', 'router_source_diagnostics': []}"
paper_e4cd80d62070,10.1155/2012/393681,Interleukin-1α Induction in Human Keratinocytes (HaCaT): An In Vitro Model for Chemoprevention in Skin.,unresolved,0.0,unknown,unknown,[],missing_structured_and_pdf_router_source:blocked:html_remote:captcha,"{'title': 'Interleukin-1α Induction in Human Keratinocytes (HaCaT): An In Vitro Model for Chemoprevention in Skin.', 'router_source_backend': 'missing', 'router_source_ref': '', 'router_source_diagnostics': ['blocked:html_remote:captcha']}"
paper_6412a6a4ef9e,10.1155/2012/505842,"A synoviocyte model for osteoarthritis and rheumatoid arthritis: response to Ibuprofen, betamethasone, and ginger extract-a cross-sectional in vitro study.",unresolved,0.0,unknown,unknown,[],No explicit evidence extraction routes available in the supplied text.,"{'paper_type': 'uncertain', 'mentions_ibuprofen': 'yes', 'mentions_diffusion_cell': 'no', 'franz_confirmed': 'no', 'where_diffusion_cell': '', 'where_franz': '', 'study_type': 'uncertain', 'barrier_category': 'uncertain', 'barrier_name_raw': '', 'endpoint_found': 'uncertain', 'endpoint_time_found': 'uncertain', 'where_endpoint': '', 'endpoint_carrier': 'unknown', 'endpoint_carrier_snippet': '', 'formulation_carrier': 'unknown', 'formulation_carrier_snippet': '', 'endpoint_likely_in_supp': 'uncertain', 'formulation_table_missing': 'uncertain', 'notes': 'No explicit evidence extraction routes available in the supplied text.', 'router_source_backend': 'pdf_local', 'router_source_ref': 'papers\\pdf\\10.1155_2012_505842__b13c1be23d.pdf', 'router_source_diagnostics': ['blocked:html_remote:captcha'], 'router_heuristic_signals': {'table_hits': 0, 'figure_hits': 0, 'endpoint_hits': 0, 'formulation_hits': 0}}"
paper_9b42388c1069,10.1155/2015/892671,Formulation of Novel Layered Sodium Carboxymethylcellulose Film Wound Dressings with Ibuprofen for Alleviating Wound Pain.,unresolved,0.2,unknown,unknown,"[{'field_name': 'device', 'modality': 'text', 'locator': 'unknown', 'page': None, 'bbox': None, 'snippet': 'unknown', 'source_ref': '10.1155/2015/892671', 'confidence': 0.7}, {'field_name': 'endpoint', 'modality': 'metadata', 'locator': 'unknown', 'page': None, 'bbox': None, 'snippet': 'unknown', 'source_ref': '10.1155/2015/892671', 'confidence': 0.8}, {'field_name': 'formulation', 'modality': 'metadata', 'locator': 'unknown', 'page': None, 'bbox': None, 'snippet': 'unknown', 'source_ref': '10.1155/2015/892671', 'confidence': 0.7}]",Extractable evidence is unclear from the document.,"{'paper_type': 'other', 'mentions_ibuprofen': 'yes', 'mentions_diffusion_cell': 'no', 'franz_confirmed': 'no', 'where_diffusion_cell': 'unknown', 'where_franz': 'unknown', 'study_type': 'uncertain', 'barrier_category': 'uncertain', 'barrier_name_raw': 'unknown', 'endpoint_found': 'uncertain', 'endpoint_time_found': 'uncertain', 'where_endpoint': 'unknown', 'endpoint_carrier': 'unknown', 'endpoint_carrier_snippet': 'unknown', 'formulation_carrier': 'unknown', 'formulation_carrier_snippet': 'unknown', 'endpoint_likely_in_supp': 'no', 'formulation_table_missing': 'yes', 'notes': 'Extractable evidence is unclear from the document.', 'router_source_backend': 'pdf_local', 'router_source_ref': 'papers\\pdf\\10.1155_2015_892671__24c19ba2c6.pdf', 'router_source_diagnostics': ['blocked:html_remote:captcha'], 'router_heuristic_signals': {'table_hits': 0, 'figure_hits': 0, 'endpoint_hits': 0, 'formulation_hits': 0}}"
paper_8f2dbfa00626,10.1155/2022/1020504,The Healing Effects of Piano Practice-Induced Hand Muscle Injury.,unresolved,0.0,unknown,unknown,[],missing_structured_and_pdf_router_source:blocked:html_remote:captcha,"{'title': 'The Healing Effects of Piano Practice-Induced Hand Muscle Injury.', 'router_source_backend': 'missing', 'router_source_ref': '', 'router_source_diagnostics': ['blocked:html_remote:captcha']}"
paper_058ccb52408f,10.1155/2023/5535344,"Extraction, Characterization, and Evaluation of <i>Lepidium sativum</i> Linn. Mucilage as a Mucoadhesive Polymer.",unresolved,0.0,unknown,unknown,[],The document does not contain relevant evidence regarding ibuprofen or dermal formulations.,"{'paper_type': 'other', 'mentions_ibuprofen': 'no', 'mentions_diffusion_cell': 'no', 'franz_confirmed': 'no', 'where_diffusion_cell': '', 'where_franz': '', 'study_type': 'uncertain', 'barrier_category': 'uncertain', 'barrier_name_raw': '', 'endpoint_found': 'no', 'endpoint_time_found': 'no', 'where_endpoint': '', 'endpoint_carrier': 'unknown', 'endpoint_carrier_snippet': '', 'formulation_carrier': 'unknown', 'formulation_carrier_snippet': '', 'endpoint_likely_in_supp': 'no', 'formulation_table_missing': 'uncertain', 'notes': 'The document does not contain relevant evidence regarding ibuprofen or dermal formulations.', 'router_source_backend': 'pdf_local', 'router_source_ref': 'papers\\pdf\\10.1155_2023_5535344__25cc46ec42.pdf', 'router_source_diagnostics': ['blocked:html_remote:captcha'], 'router_heuristic_signals': {'table_hits': 0, 'figure_hits': 0, 'endpoint_hits': 0, 'formulation_hits': 0}}"
paper_eb92a7599df5,10.1158/1541-7786.mcr-10-0342,NSAID inhibition of prostate cancer cell migration is mediated by Nag-1 Induction via the p38 MAPK-p75(NTR) pathway.,unresolved,0.0,unknown,unknown,[],missing_structured_and_pdf_router_source:html_remote:HTTPError,"{'title': 'NSAID inhibition of prostate cancer cell migration is mediated by Nag-1 Induction via the p38 MAPK-p75(NTR) pathway.', 'router_source_backend': 'missing', 'router_source_ref': '', 'router_source_diagnostics': ['html_remote:HTTPError']}"
paper_543a1580a37d,10.1159/000076018,Lateral diffusion of ibuprofen in human skin during permeation studies.,unresolved,0.0,unknown,unknown,[],missing_structured_and_pdf_router_source,"{'title': 'Lateral diffusion of ibuprofen in human skin during permeation studies.', 'router_source_backend': 'missing', 'router_source_ref': '', 'router_source_diagnostics': []}"
paper_de978dfa4371,10.1159/000183922,"Influence of ethanol on the solubility, ionization and permeation characteristics of ibuprofen in silicone and human skin.",unresolved,0.0,unknown,unknown,[],missing_structured_and_pdf_router_source,"{'title': 'Influence of ethanol on the solubility, ionization and permeation characteristics of ibuprofen in silicone and human skin.', 'router_source_backend': 'missing', 'router_source_ref': '', 'router_source_diagnostics': []}"
paper_a147e8c5cba7,10.1159/000231528,Optimisation of cosolvent concentration for topical drug delivery - II: influence of propylene glycol on ibuprofen permeation.,unresolved,0.0,unknown,unknown,[],missing_structured_and_pdf_router_source,"{'title': 'Optimisation of cosolvent concentration for topical drug delivery - II: influence of propylene glycol on ibuprofen permeation.', 'router_source_backend': 'missing', 'router_source_ref': '', 'router_source_diagnostics': []}"
paper_067e8b4e5b8c,10.1159/000315139,Optimisation of cosolvent concentration for topical drug delivery III--influence of lipophilic vehicles on ibuprofen permeation.,unresolved,0.0,unknown,unknown,[],missing_structured_and_pdf_router_source,"{'title': 'Optimisation of cosolvent concentration for topical drug delivery III--influence of lipophilic vehicles on ibuprofen permeation.', 'router_source_backend': 'missing', 'router_source_ref': '', 'router_source_diagnostics': []}"
paper_7896b1cb107a,10.1166/jnn.2013.7157,Electrospinning of ibuprofen-loaded composite nanofibers for improving the performances of transdermal patches.,unresolved,0.0,unknown,unknown,[],missing_structured_and_pdf_router_source,"{'title': 'Electrospinning of ibuprofen-loaded composite nanofibers for improving the performances of transdermal patches.', 'router_source_backend': 'missing', 'router_source_ref': '', 'router_source_diagnostics': []}"
paper_28be43d7b80d,10.1166/jnn.2018.15182,"Scaffolds Based on Collagen, Hyaluronan and Sericin with Potential Applications as Controlled Drug Delivery System.",unresolved,0.0,unknown,unknown,[],missing_structured_and_pdf_router_source,"{'title': 'Scaffolds Based on Collagen, Hyaluronan and Sericin with Potential Applications as Controlled Drug Delivery System.', 'router_source_backend': 'missing', 'router_source_ref': '', 'router_source_diagnostics': []}"
paper_7fb33aad5434,10.1172/jci2614,Ibuprofen inhibits cystic fibrosis transmembrane conductance regulator-mediated Cl- secretion.,figure,0.69,figure,narrative,"[{'field_name': 'endpoint', 'modality': 'figure', 'locator': 'PAGE 4, footnote of Figure 1', 'page': 4, 'bbox': None, 'snippet': 'Average concentration–response curve for inhibition of the forskolin-stimulated Isc by ibuprofen (circles; n 5 5) and salicylic acid (triangles; n 5 5).', 'source_ref': '10.1172/jci2614', 'confidence': 0.8}, {'field_name': 'formulation', 'modality': 'text', 'locator': 'narrative', 'page': None, 'bbox': None, 'snippet': 'Ibuprofen (500 mM) inhibited the forskolin-induced Isc in MTEs and HBEs by 59 6 4% ( n 5 11) and 39 6 6% ( n 5 8), respectively.', 'source_ref': '10.1172/jci2614', 'confidence': 0.7}]",,"{'paper_type': 'primary_experiment', 'mentions_ibuprofen': 'yes', 'mentions_diffusion_cell': 'no', 'franz_confirmed': 'no', 'where_diffusion_cell': '', 'where_franz': '', 'study_type': 'IVRT', 'barrier_category': 'both', 'barrier_name_raw': '', 'endpoint_found': 'yes', 'endpoint_time_found': 'no', 'where_endpoint': 'PAGE 4, footnote of Figure 1', 'endpoint_carrier': 'figure', 'endpoint_carrier_snippet': 'Average concentration–response curve for inhibition of the forskolin-stimulated Isc by ibuprofen (circles; n 5 5) and salicylic acid (triangles; n 5 5).', 'formulation_carrier': 'narrative', 'formulation_carrier_snippet': 'Ibuprofen (500 mM) inhibited the forskolin-induced Isc in MTEs and HBEs by 59 6 4% ( n 5 11) and 39 6 6% ( n 5 8), respectively.', 'endpoint_likely_in_supp': 'no', 'formulation_table_missing': 'no', 'notes': '', 'router_source_backend': 'pdf_local', 'router_source_ref': 'papers\\pdf\\10.1172_jci2614__a57d87216e.pdf', 'router_source_diagnostics': ['blocked:html_remote:captcha'], 'router_heuristic_signals': {}}"
paper_65c2a1e1b7c1,10.1177/17562864231156674,Microglia as a cellular target of diclofenac therapy in Alzheimer's disease.,unresolved,0.0,unknown,unknown,[],missing_structured_and_pdf_router_source:blocked:html_remote:captcha,"{'title': ""Microglia as a cellular target of diclofenac therapy in Alzheimer's disease."", 'router_source_backend': 'missing', 'router_source_ref': '', 'router_source_diagnostics': ['blocked:html_remote:captcha']}"
paper_c76316fa34aa,10.1177/22808000211005383,Ibuprofen-loaded biocompatible latex membrane for drug release: Characterization and molecular modeling.,unresolved,0.0,unknown,unknown,[],missing_structured_and_pdf_router_source,"{'title': 'Ibuprofen-loaded biocompatible latex membrane for drug release: Characterization and molecular modeling.', 'router_source_backend': 'missing', 'router_source_ref': '', 'router_source_diagnostics': []}"
