paper_id,doi,title,route,route_confidence,endpoint_carrier,formulation_carrier,anchor_evidence,notes,raw_labels
paper_85c8b41cca98,10.2147/oarrr.s59564,Use of ibuprofen sustained release for treating osteoarthritic pain: findings from 15 general medical practices in Egypt.,unresolved,0.2,unknown,unknown,"[{'field_name': 'device', 'modality': 'text', 'locator': 'unknown', 'page': None, 'bbox': None, 'snippet': 'unknown', 'source_ref': '10.2147/oarrr.s59564', 'confidence': 0.7}, {'field_name': 'endpoint', 'modality': 'metadata', 'locator': 'unknown', 'page': None, 'bbox': None, 'snippet': 'unknown', 'source_ref': '10.2147/oarrr.s59564', 'confidence': 0.8}, {'field_name': 'formulation', 'modality': 'metadata', 'locator': 'unknown', 'page': None, 'bbox': None, 'snippet': 'unknown', 'source_ref': '10.2147/oarrr.s59564', 'confidence': 0.7}]",No clear endpoints or formulations found in the provided pages.,"{'paper_type': 'clinical', 'mentions_ibuprofen': 'yes', 'mentions_diffusion_cell': 'no', 'franz_confirmed': 'no', 'where_diffusion_cell': 'unknown', 'where_franz': 'unknown', 'study_type': 'uncertain', 'barrier_category': 'uncertain', 'barrier_name_raw': 'unknown', 'endpoint_found': 'uncertain', 'endpoint_time_found': 'uncertain', 'where_endpoint': 'unknown', 'endpoint_carrier': 'unknown', 'endpoint_carrier_snippet': 'unknown', 'formulation_carrier': 'unknown', 'formulation_carrier_snippet': 'unknown', 'endpoint_likely_in_supp': 'no', 'formulation_table_missing': 'uncertain', 'notes': 'No clear endpoints or formulations found in the provided pages.', 'router_source_backend': 'pdf_local', 'router_source_ref': 'papers\\pdf\\10.2147_oarrr.s59564__b131ee7506.pdf', 'router_source_diagnostics': ['blocked:html_remote:captcha'], 'router_heuristic_signals': {'table_hits': 0, 'figure_hits': 0, 'endpoint_hits': 0, 'formulation_hits': 0}}"
paper_35759b69eed4,10.2166/wst.2004.0305,Comparison of the behaviour of selected micropollutants in a membrane bioreactor and a conventional wastewater treatment plant.,unresolved,0.0,unknown,unknown,[],missing_structured_and_pdf_router_source,"{'title': 'Comparison of the behaviour of selected micropollutants in a membrane bioreactor and a conventional wastewater treatment plant.', 'router_source_backend': 'missing', 'router_source_ref': '', 'router_source_diagnostics': []}"
paper_a7327aa84d6a,10.2166/wst.2008.667,Treatment of yellow water by membrane separations and advanced oxidation methods.,unresolved,0.0,unknown,unknown,[],missing_structured_and_pdf_router_source,"{'title': 'Treatment of yellow water by membrane separations and advanced oxidation methods.', 'router_source_backend': 'missing', 'router_source_ref': '', 'router_source_diagnostics': []}"
paper_1dc2b8c3a028,10.2174/1381612053764878,The effects of non-steroidal anti-inflammatory drugs (selective and non-selective) on the treatment of periodontal diseases.,unresolved,0.0,unknown,unknown,[],missing_structured_and_pdf_router_source,"{'title': 'The effects of non-steroidal anti-inflammatory drugs (selective and non-selective) on the treatment of periodontal diseases.', 'router_source_backend': 'missing', 'router_source_ref': '', 'router_source_diagnostics': []}"
paper_d8004ae520cd,10.2174/1389450111314090015,Niosomes encapsulating Ibuprofen-cyclodextrin complexes: preparation and characterization.,unresolved,0.0,unknown,unknown,[],missing_structured_and_pdf_router_source,"{'title': 'Niosomes encapsulating Ibuprofen-cyclodextrin complexes: preparation and characterization.', 'router_source_backend': 'missing', 'router_source_ref': '', 'router_source_diagnostics': []}"
paper_094a092750ca,10.2174/15672018113109990056,"Influence of drug incorporation, temperature and storage time on the pH, textural and rheological properties of different poloxamer hydrogels.",unresolved,0.0,unknown,unknown,[],missing_structured_and_pdf_router_source,"{'title': 'Influence of drug incorporation, temperature and storage time on the pH, textural and rheological properties of different poloxamer hydrogels.', 'router_source_backend': 'missing', 'router_source_ref': '', 'router_source_diagnostics': []}"
paper_801c3bb02123,10.22037/ijpr.2019.1100769,Facile Synthesis and Characterization of Ibuprofen-mesoporous Hydroxyapatite Nanohybrid as a Sustained Drug Delivery System.,unresolved,0.2,unknown,unknown,"[{'field_name': 'device', 'modality': 'text', 'locator': 'unknown', 'page': None, 'bbox': None, 'snippet': 'unknown', 'source_ref': '10.22037/ijpr.2019.1100769', 'confidence': 0.7}, {'field_name': 'endpoint', 'modality': 'metadata', 'locator': 'unknown', 'page': None, 'bbox': None, 'snippet': 'unknown', 'source_ref': '10.22037/ijpr.2019.1100769', 'confidence': 0.8}, {'field_name': 'formulation', 'modality': 'metadata', 'locator': 'unknown', 'page': None, 'bbox': None, 'snippet': 'unknown', 'source_ref': '10.22037/ijpr.2019.1100769', 'confidence': 0.7}]",Evidence extraction from this document is limited due to the lack of accessible content.,"{'paper_type': 'uncertain', 'mentions_ibuprofen': 'yes', 'mentions_diffusion_cell': 'no', 'franz_confirmed': 'no', 'where_diffusion_cell': 'unknown', 'where_franz': 'unknown', 'study_type': 'uncertain', 'barrier_category': 'uncertain', 'barrier_name_raw': 'unknown', 'endpoint_found': 'uncertain', 'endpoint_time_found': 'uncertain', 'where_endpoint': 'unknown', 'endpoint_carrier': 'unknown', 'endpoint_carrier_snippet': 'unknown', 'formulation_carrier': 'unknown', 'formulation_carrier_snippet': 'unknown', 'endpoint_likely_in_supp': 'no', 'formulation_table_missing': 'no', 'notes': 'Evidence extraction from this document is limited due to the lack of accessible content.', 'router_source_backend': 'pdf_local', 'router_source_ref': 'papers\\pdf\\10.22037_ijpr.2019.1100769__7ab51b8a1c.pdf', 'router_source_diagnostics': ['blocked:html_remote:captcha'], 'router_heuristic_signals': {'table_hits': 0, 'figure_hits': 0, 'endpoint_hits': 0, 'formulation_hits': 0}}"
paper_d40fecc1d71c,10.22037/ijpr.2020.112887.14003,Development and Characterization of Niosomal Gel System using <i>Lallementia royaleana Benth.</i> mucilage for the treatment of Rheumatoid Arthritis.,unresolved,0.0,unknown,unknown,[],No extractable evidence found in the provided document.,"{'paper_type': 'review', 'mentions_ibuprofen': 'no', 'mentions_diffusion_cell': 'no', 'franz_confirmed': 'no', 'where_diffusion_cell': '', 'where_franz': '', 'study_type': 'uncertain', 'barrier_category': 'uncertain', 'barrier_name_raw': '', 'endpoint_found': 'no', 'endpoint_time_found': 'no', 'where_endpoint': '', 'endpoint_carrier': 'unknown', 'endpoint_carrier_snippet': '', 'formulation_carrier': 'unknown', 'formulation_carrier_snippet': '', 'endpoint_likely_in_supp': 'no', 'formulation_table_missing': 'yes', 'notes': 'No extractable evidence found in the provided document.', 'router_source_backend': 'pdf_local', 'router_source_ref': 'papers\\pdf\\10.22037_ijpr.2020.112887.14003__d027ba353e.pdf', 'router_source_diagnostics': ['blocked:html_remote:captcha'], 'router_heuristic_signals': {'table_hits': 0, 'figure_hits': 0, 'endpoint_hits': 0, 'formulation_hits': 0}}"
paper_183c78d24024,10.3109/02652048.2015.1028495,Mass transport model through the skin by microencapsulation system.,unresolved,0.0,unknown,unknown,[],missing_structured_and_pdf_router_source,"{'title': 'Mass transport model through the skin by microencapsulation system.', 'router_source_backend': 'missing', 'router_source_ref': '', 'router_source_diagnostics': []}"
paper_7f07515730fe,10.3109/03639041003695071,Physicochemical studies of binary eutectic of ibuprofen and ketoprofen for enhanced transdermal drug delivery.,unresolved,0.0,unknown,unknown,[],missing_structured_and_pdf_router_source,"{'title': 'Physicochemical studies of binary eutectic of ibuprofen and ketoprofen for enhanced transdermal drug delivery.', 'router_source_backend': 'missing', 'router_source_ref': '', 'router_source_diagnostics': []}"
paper_b730088c71ee,10.3109/03639045.2011.653363,A comparative study of vitamin E TPGS/HPMC supersaturated system and other solubilizer/polymer combinations to enhance the permeability of a poorly soluble drug through the skin.,unresolved,0.0,unknown,unknown,[],missing_structured_and_pdf_router_source,"{'title': 'A comparative study of vitamin E TPGS/HPMC supersaturated system and other solubilizer/polymer combinations to enhance the permeability of a poorly soluble drug through the skin.', 'router_source_backend': 'missing', 'router_source_ref': '', 'router_source_diagnostics': []}"
paper_ce25f0ff5437,10.3109/03639045.2015.1107095,Effect of borneol on the transdermal permeation of drugs with differing lipophilicity and molecular organization of stratum corneum lipids.,unresolved,0.0,unknown,unknown,[],missing_structured_and_pdf_router_source,"{'title': 'Effect of borneol on the transdermal permeation of drugs with differing lipophilicity and molecular organization of stratum corneum lipids.', 'router_source_backend': 'missing', 'router_source_ref': '', 'router_source_diagnostics': []}"
paper_752460399665,10.3109/08982100903014994,Span and Tween neutral and pH-sensitive vesicles: characterization and in vitro skin permeation.,unresolved,0.0,unknown,unknown,[],missing_structured_and_pdf_router_source,"{'title': 'Span and Tween neutral and pH-sensitive vesicles: characterization and in vitro skin permeation.', 'router_source_backend': 'missing', 'router_source_ref': '', 'router_source_diagnostics': []}"
paper_4344128a5b90,10.3109/10717544.2013.873837,Nonionic surfactant-based vesicular system for transdermal drug delivery.,unresolved,0.0,unknown,unknown,[],missing_structured_and_pdf_router_source,"{'title': 'Nonionic surfactant-based vesicular system for transdermal drug delivery.', 'router_source_backend': 'missing', 'router_source_ref': '', 'router_source_diagnostics': []}"
paper_837b9f34dbe4,10.3109/10837450.2010.513987,Transdermal permeation of novel n-acetyl-glucosamine/NSAIDs mutual prodrugs.,unresolved,0.0,unknown,unknown,[],missing_structured_and_pdf_router_source,"{'title': 'Transdermal permeation of novel n-acetyl-glucosamine/NSAIDs mutual prodrugs.', 'router_source_backend': 'missing', 'router_source_ref': '', 'router_source_diagnostics': []}"
paper_01a7568de553,10.3109/10837450.2013.860548,Quality by design approach to prepare oleoyl alginate derivative and its use in transdermal delivery.,unresolved,0.0,unknown,unknown,[],missing_structured_and_pdf_router_source,"{'title': 'Quality by design approach to prepare oleoyl alginate derivative and its use in transdermal delivery.', 'router_source_backend': 'missing', 'router_source_ref': '', 'router_source_diagnostics': []}"
paper_d9ee953557df,10.3389/fbioe.2020.00708,Thermosensitive Micellar Hydrogels as Vehicles to Deliver Drugs With Different Wettability.,unresolved,0.0,unknown,unknown,[],No relevant extraction data found in provided text.,"{'paper_type': 'uncertain', 'mentions_ibuprofen': 'no', 'mentions_diffusion_cell': 'no', 'franz_confirmed': 'no', 'where_diffusion_cell': '', 'where_franz': '', 'study_type': 'uncertain', 'barrier_category': 'uncertain', 'barrier_name_raw': '', 'endpoint_found': 'no', 'endpoint_time_found': 'no', 'where_endpoint': '', 'endpoint_carrier': 'unknown', 'endpoint_carrier_snippet': '', 'formulation_carrier': 'unknown', 'formulation_carrier_snippet': '', 'endpoint_likely_in_supp': 'uncertain', 'formulation_table_missing': 'uncertain', 'notes': 'No relevant extraction data found in provided text.', 'router_source_backend': 'pdf_local', 'router_source_ref': 'papers\\pdf\\10.3389_fbioe.2020.00708__37713f8569.pdf', 'router_source_diagnostics': ['blocked:html_remote:captcha'], 'router_heuristic_signals': {'table_hits': 0, 'figure_hits': 0, 'endpoint_hits': 0, 'formulation_hits': 0}}"
paper_f03f8905410c,10.3389/fchem.2021.767923,Green Fabrication and Release Mechanisms of pH-Sensitive Chitosan-Ibuprofen Aerogels for Controlled Transdermal Delivery of Ibuprofen.,figure,0.81,figure,narrative,"[{'field_name': 'device', 'modality': 'text', 'locator': '2.8 In Vitro Evaluation of Skin Permeation', 'page': None, 'bbox': None, 'snippet': '2.8 In Vitro Evaluation of Skin Permeation', 'source_ref': '10.3389/fchem.2021.767923', 'confidence': 0.7}, {'field_name': 'endpoint', 'modality': 'figure', 'locator': 'Figure 7C and Table 1', 'page': None, 'bbox': None, 'snippet': 'Figure 7C', 'source_ref': '10.3389/fchem.2021.767923', 'confidence': 0.8}, {'field_name': 'formulation', 'modality': 'text', 'locator': 'narrative', 'page': None, 'bbox': None, 'snippet': 'The chitosan–ibuprofen aerogels were synthesized by a two-step procedure...', 'source_ref': '10.3389/fchem.2021.767923', 'confidence': 0.7}]",The study thoroughly investigates the controlled release of ibuprofen using chitosan aerogels and includes in vitro skin permeation and drug release mechanism.,"{'paper_type': 'primary_experiment', 'mentions_ibuprofen': 'yes', 'mentions_diffusion_cell': 'yes', 'franz_confirmed': 'yes', 'where_diffusion_cell': '2.8 In Vitro Evaluation of Skin Permeation', 'where_franz': '2.8 In Vitro Evaluation of Skin Permeation', 'study_type': 'IVPT', 'barrier_category': 'skin', 'barrier_name_raw': 'porcine skin', 'endpoint_found': 'yes', 'endpoint_time_found': 'yes', 'where_endpoint': 'Figure 7C and Table 1', 'endpoint_carrier': 'figure', 'endpoint_carrier_snippet': 'Figure 7C', 'formulation_carrier': 'narrative', 'formulation_carrier_snippet': 'The chitosan–ibuprofen aerogels were synthesized by a two-step procedure...', 'endpoint_likely_in_supp': 'no', 'formulation_table_missing': 'no', 'notes': 'The study thoroughly investigates the controlled release of ibuprofen using chitosan aerogels and includes in vitro skin permeation and drug release mechanism.', 'router_source_backend': 'pdf_local', 'router_source_ref': 'papers\\pdf\\10.3389_fchem.2021.767923__210f2ad6ad.pdf', 'router_source_diagnostics': ['blocked:html_remote:captcha'], 'router_heuristic_signals': {}}"
paper_fb74094c5234,10.3389/fchem.2024.1369542,"Investigation of the synthesis, gelation potential, and drug-loading capacities of two novel amides.",unresolved,0.0,unknown,unknown,[],No extractable evidence found in the provided content.,"{'paper_type': 'uncertain', 'mentions_ibuprofen': 'no', 'mentions_diffusion_cell': 'no', 'franz_confirmed': 'no', 'where_diffusion_cell': '', 'where_franz': '', 'study_type': 'uncertain', 'barrier_category': 'uncertain', 'barrier_name_raw': '', 'endpoint_found': 'uncertain', 'endpoint_time_found': 'uncertain', 'where_endpoint': '', 'endpoint_carrier': 'unknown', 'endpoint_carrier_snippet': '', 'formulation_carrier': 'unknown', 'formulation_carrier_snippet': '', 'endpoint_likely_in_supp': 'uncertain', 'formulation_table_missing': 'uncertain', 'notes': 'No extractable evidence found in the provided content.', 'router_source_backend': 'pdf_local', 'router_source_ref': 'papers\\pdf\\10.3389_fchem.2024.1369542__c616ea706a.pdf', 'router_source_diagnostics': ['blocked:html_remote:captcha'], 'router_heuristic_signals': {'table_hits': 0, 'figure_hits': 0, 'endpoint_hits': 0, 'formulation_hits': 0}}"
paper_052bd99fa67b,10.3389/fendo.2026.1728199,Efficacy and safety of Dysmenorrhea Patch acupoint application in women with primary dysmenorrhea: a randomized double-blind controlled trial.,unresolved,0.2,unknown,unknown,"[{'field_name': 'device', 'modality': 'text', 'locator': 'unknown', 'page': None, 'bbox': None, 'snippet': 'unknown', 'source_ref': '10.3389/fendo.2026.1728199', 'confidence': 0.7}, {'field_name': 'endpoint', 'modality': 'metadata', 'locator': 'unknown', 'page': None, 'bbox': None, 'snippet': 'unknown', 'source_ref': '10.3389/fendo.2026.1728199', 'confidence': 0.8}]",No relevant content regarding ibuprofen or dermal formulations was found.,"{'paper_type': 'uncertain', 'mentions_ibuprofen': 'no', 'mentions_diffusion_cell': 'no', 'franz_confirmed': 'no', 'where_diffusion_cell': 'unknown', 'where_franz': 'unknown', 'study_type': 'uncertain', 'barrier_category': 'uncertain', 'barrier_name_raw': 'unknown', 'endpoint_found': 'no', 'endpoint_time_found': 'no', 'where_endpoint': 'unknown', 'endpoint_carrier': 'unknown', 'endpoint_carrier_snippet': '', 'formulation_carrier': 'unknown', 'formulation_carrier_snippet': '', 'endpoint_likely_in_supp': 'no', 'formulation_table_missing': 'no', 'notes': 'No relevant content regarding ibuprofen or dermal formulations was found.', 'router_source_backend': 'pdf_local', 'router_source_ref': 'papers\\pdf\\10.3389_fendo.2026.1728199__0289e0e317.pdf', 'router_source_diagnostics': ['blocked:html_remote:captcha'], 'router_heuristic_signals': {'table_hits': 0, 'figure_hits': 0, 'endpoint_hits': 0, 'formulation_hits': 0}}"
paper_bd68b5a85224,10.3389/fmolb.2016.00050,DNA Damage in Healthy Individuals and Respiratory Patients after Treating Whole Blood <i>In vitro</i> with the Bulk and Nano Forms of NSAIDs.,unresolved,0.2,unknown,unknown,"[{'field_name': 'device', 'modality': 'text', 'locator': 'unknown', 'page': None, 'bbox': None, 'snippet': 'unknown', 'source_ref': '10.3389/fmolb.2016.00050', 'confidence': 0.7}, {'field_name': 'endpoint', 'modality': 'metadata', 'locator': 'unknown', 'page': None, 'bbox': None, 'snippet': 'unknown', 'source_ref': '10.3389/fmolb.2016.00050', 'confidence': 0.8}, {'field_name': 'formulation', 'modality': 'metadata', 'locator': 'unknown', 'page': None, 'bbox': None, 'snippet': 'unknown', 'source_ref': '10.3389/fmolb.2016.00050', 'confidence': 0.7}]",The document appears to be primarily about DNA damage and does not specifically mention ibuprofen or related formulations.,"{'paper_type': 'uncertain', 'mentions_ibuprofen': 'no', 'mentions_diffusion_cell': 'no', 'franz_confirmed': 'no', 'where_diffusion_cell': 'unknown', 'where_franz': 'unknown', 'study_type': 'uncertain', 'barrier_category': 'uncertain', 'barrier_name_raw': 'unknown', 'endpoint_found': 'no', 'endpoint_time_found': 'no', 'where_endpoint': 'unknown', 'endpoint_carrier': 'unknown', 'endpoint_carrier_snippet': 'unknown', 'formulation_carrier': 'unknown', 'formulation_carrier_snippet': 'unknown', 'endpoint_likely_in_supp': 'no', 'formulation_table_missing': 'uncertain', 'notes': 'The document appears to be primarily about DNA damage and does not specifically mention ibuprofen or related formulations.', 'router_source_backend': 'pdf_local', 'router_source_ref': 'papers\\pdf\\10.3389_fmolb.2016.00050__1df6aad75a.pdf', 'router_source_diagnostics': ['blocked:html_remote:captcha'], 'router_heuristic_signals': {'table_hits': 0, 'figure_hits': 0, 'endpoint_hits': 0, 'formulation_hits': 0}}"
paper_7e2886d60162,10.3389/fpain.2026.1727963,Integrated multi-omics elucidates the dual anti-inflammatory and neuroendocrine mechanisms of novel TCM plasters against primary dysmenorrhea.,unresolved,0.0,unknown,unknown,[],No relevant information extractable regarding ibuprofen or dermal formulations.,"{'paper_type': 'uncertain', 'mentions_ibuprofen': 'no', 'mentions_diffusion_cell': 'no', 'franz_confirmed': 'no', 'where_diffusion_cell': '', 'where_franz': '', 'study_type': 'uncertain', 'barrier_category': 'uncertain', 'barrier_name_raw': '', 'endpoint_found': 'no', 'endpoint_time_found': 'no', 'where_endpoint': '', 'endpoint_carrier': 'unknown', 'endpoint_carrier_snippet': '', 'formulation_carrier': 'unknown', 'formulation_carrier_snippet': '', 'endpoint_likely_in_supp': 'no', 'formulation_table_missing': 'uncertain', 'notes': 'No relevant information extractable regarding ibuprofen or dermal formulations.', 'router_source_backend': 'pdf_local', 'router_source_ref': 'papers\\pdf\\10.3389_fpain.2026.1727963__35079607e4.pdf', 'router_source_diagnostics': ['blocked:html_remote:captcha'], 'router_heuristic_signals': {'table_hits': 0, 'figure_hits': 0, 'endpoint_hits': 0, 'formulation_hits': 0}}"
paper_d3e3b20e276b,10.3389/fphar.2024.1355283,Hyaluronic acid-ibuprofen conjugation: a novel ototherapeutic approach protecting inner ear cells from inflammation-mediated damage.,figure,0.81,figure,table_text,"[{'field_name': 'device', 'modality': 'text', 'locator': 'unknown', 'page': None, 'bbox': None, 'snippet': 'unknown', 'source_ref': '10.3389/fphar.2024.1355283', 'confidence': 0.7}, {'field_name': 'endpoint', 'modality': 'figure', 'locator': 'section 3.3.2 Cytocompatibility', 'page': None, 'bbox': None, 'snippet': 'Figure 3 Normalized cytokine release in LPS-stressed macrophages treated with HACs, or the respective unconjugated anti-inflammatory drugs.', 'source_ref': '10.3389/fphar.2024.1355283', 'confidence': 0.8}, {'field_name': 'formulation', 'modality': 'table', 'locator': 'table_text', 'page': None, 'bbox': None, 'snippet': 'Table summarizing the physicochemical properties of I-HA and other HACs.', 'source_ref': '10.3389/fphar.2024.1355283', 'confidence': 0.7}]","Conjugation of ibuprofen to HA enhanced therapeutic properties, with clear in vitro anti-inflammatory effects demonstrated in the study.","{'paper_type': 'primary_experiment', 'mentions_ibuprofen': 'yes', 'mentions_diffusion_cell': 'yes', 'franz_confirmed': 'uncertain', 'where_diffusion_cell': 'section 3.3.2 Cytocompatibility', 'where_franz': 'unknown', 'study_type': 'both', 'barrier_category': 'uncertain', 'barrier_name_raw': 'tympanic and round window membranes', 'endpoint_found': 'yes', 'endpoint_time_found': 'yes', 'where_endpoint': 'section 3.3.2 Cytocompatibility', 'endpoint_carrier': 'figure', 'endpoint_carrier_snippet': 'Figure 3 Normalized cytokine release in LPS-stressed macrophages treated with HACs, or the respective unconjugated anti-inflammatory drugs.', 'formulation_carrier': 'table_text', 'formulation_carrier_snippet': 'Table summarizing the physicochemical properties of I-HA and other HACs.', 'endpoint_likely_in_supp': 'no', 'formulation_table_missing': 'no', 'notes': 'Conjugation of ibuprofen to HA enhanced therapeutic properties, with clear in vitro anti-inflammatory effects demonstrated in the study.', 'router_source_backend': 'pdf_local', 'router_source_ref': 'papers\\pdf\\10.3389_fphar.2024.1355283__481e1260de.pdf', 'router_source_diagnostics': ['blocked:html_remote:captcha'], 'router_heuristic_signals': {}}"
paper_8e4e3d8dfab3,10.3389/fphar.2024.1488722,A sulfonimide derivative of bezafibrate as a dual inhibitor of cyclooxygenase-2 and PPARα.,unresolved,0.2,unknown,unknown,"[{'field_name': 'device', 'modality': 'text', 'locator': 'unknown', 'page': None, 'bbox': None, 'snippet': 'unknown', 'source_ref': '10.3389/fphar.2024.1488722', 'confidence': 0.7}, {'field_name': 'endpoint', 'modality': 'metadata', 'locator': 'unknown', 'page': None, 'bbox': None, 'snippet': 'unknown', 'source_ref': '10.3389/fphar.2024.1488722', 'confidence': 0.8}, {'field_name': 'formulation', 'modality': 'metadata', 'locator': 'unknown', 'page': None, 'bbox': None, 'snippet': 'unknown', 'source_ref': '10.3389/fphar.2024.1488722', 'confidence': 0.7}]",Not enough information available to extract relevant evidence.,"{'paper_type': 'uncertain', 'mentions_ibuprofen': 'no', 'mentions_diffusion_cell': 'no', 'franz_confirmed': 'no', 'where_diffusion_cell': 'unknown', 'where_franz': 'unknown', 'study_type': 'uncertain', 'barrier_category': 'uncertain', 'barrier_name_raw': 'unknown', 'endpoint_found': 'no', 'endpoint_time_found': 'no', 'where_endpoint': 'unknown', 'endpoint_carrier': 'unknown', 'endpoint_carrier_snippet': 'unknown', 'formulation_carrier': 'unknown', 'formulation_carrier_snippet': 'unknown', 'endpoint_likely_in_supp': 'uncertain', 'formulation_table_missing': 'uncertain', 'notes': 'Not enough information available to extract relevant evidence.', 'router_source_backend': 'pdf_local', 'router_source_ref': 'papers\\pdf\\10.3389_fphar.2024.1488722__33d480f38a.pdf', 'router_source_diagnostics': ['blocked:html_remote:captcha'], 'router_heuristic_signals': {'table_hits': 0, 'figure_hits': 0, 'endpoint_hits': 0, 'formulation_hits': 0}}"
paper_2504736aaaae,10.3389/fphys.2016.00263,Inflammatory Role of ROS-Sensitive AMP-Activated Protein Kinase in the Hypersensitivity of Lung Vagal C Fibers Induced by Intermittent Hypoxia in Rats.,text,0.81,narrative,unknown,"[{'field_name': 'device', 'modality': 'text', 'locator': 'unknown', 'page': None, 'bbox': None, 'snippet': 'unknown', 'source_ref': '10.3389/fphys.2016.00263', 'confidence': 0.7}, {'field_name': 'endpoint', 'modality': 'text', 'locator': 'results section', 'page': None, 'bbox': None, 'snippet': 'The potentiating effect of IH on LVCF responses decreased at 6 h after and vanished at 12 h after the termination of IH exposure.', 'source_ref': '10.3389/fphys.2016.00263', 'confidence': 0.8}, {'field_name': 'formulation', 'modality': 'metadata', 'locator': 'unknown', 'page': None, 'bbox': None, 'snippet': 'unknown', 'source_ref': '10.3389/fphys.2016.00263', 'confidence': 0.7}]",The study investigates the inflammatory role of ibuprofen in the context of IH-induced airway hypersensitivity.,"{'paper_type': 'primary_experiment', 'mentions_ibuprofen': 'yes', 'mentions_diffusion_cell': 'no', 'franz_confirmed': 'no', 'where_diffusion_cell': 'unknown', 'where_franz': 'unknown', 'study_type': 'IVPT', 'barrier_category': 'uncertain', 'barrier_name_raw': 'lung tissue', 'endpoint_found': 'yes', 'endpoint_time_found': 'yes', 'where_endpoint': 'results section', 'endpoint_carrier': 'narrative', 'endpoint_carrier_snippet': 'The potentiating effect of IH on LVCF responses decreased at 6 h after and vanished at 12 h after the termination of IH exposure.', 'formulation_carrier': 'unknown', 'formulation_carrier_snippet': 'unknown', 'endpoint_likely_in_supp': 'no', 'formulation_table_missing': 'no', 'notes': 'The study investigates the inflammatory role of ibuprofen in the context of IH-induced airway hypersensitivity.', 'router_source_backend': 'pdf_local', 'router_source_ref': 'papers\\pdf\\10.3389_fphys.2016.00263__ba834bfcf5.pdf', 'router_source_diagnostics': ['blocked:html_remote:captcha'], 'router_heuristic_signals': {}}"
