record_id,paper_id,doi,route,route_confidence,extractor_confidence,mapping_confidence,study_type,device,barrier,formulation_label,api_name,api_concentration_value,api_concentration_unit,api_basis,api_concentration_raw,dosage_form,components_json,endpoint_field_name,endpoint_kind,endpoint_value,endpoint_unit,endpoint_time_value,endpoint_time_unit,endpoint_normalized_value,endpoint_normalized_unit,diffusion_area_cm2,receptor_volume_ml,duration_h,verification_status,scope_bucket,scope_tags_json,verification_support_rate,failure_reason,failure_reasons_json,evidence_count,patch_count,extractor_name,source_format,source_path,artifact_paths_json,provenance_json,evidence_json,patches_json,source_notes_json
record_03ac6dbd81c3,paper_7b671a04bd51,10.1038/s41598-020-74885-1,figure,0.81,0.9,,IVRT,,Polycaprolactone fibrous mats,12% PCL-IBU,Ibuprofen,4.0,mg/ml,Ibuprofen,4 mg/ml,fibrous mat,"[{""name"": ""Ibuprofen"", ""concentration_value"": 4.0, ""concentration_unit"": ""mg/ml"", ""basis"": ""Ibuprofen"", ""raw"": """", ""note"": ""Loaded in PCL""}]",amount,percent,86.08,%,62.0,days,,,,,1488.0,pending,unknown,[],,,[],2,0,table,pdf,papers\pdf\10.1038_s41598-020-74885-1__cc5880def9.pdf,[],"{""extractor_name"": ""table"", ""source_format"": ""pdf"", ""source_path"": ""papers\\pdf\\10.1038_s41598-020-74885-1__cc5880def9.pdf"", ""source_pages"": [2, 4, 7, 10, 11], ""route_label"": ""figure"", ""route_notes"": ""The study explores the fabrication of tri-layered PCL mats with ibuprofen for sustained release, detailing changes in drug release kinetics related to layer composition and structure."", ""artifact_paths"": [], ""metadata"": {""source_backend"": ""pdf_local"", ""locator_mode"": ""page"", ""selected_locators"": [""page 2"", ""page 4"", ""page 7"", ""page 10"", ""page 11""], ""table_id"": ""Table 2"", ""row_source_pages"": [7], ""row_source_locators"": [""page 10""], ""score_debug"": {""page 2"": 1, ""page 4"": 1, ""page 7"": 1, ""page 10"": 1, ""page 11"": 1}, ""route_anchor_evidence"": [{""field_name"": ""device"", ""modality"": ""text"", ""locator"": ""unknown"", ""page"": null, ""bbox"": null, ""snippet"": ""unknown"", ""source_ref"": ""10.1038/s41598-020-74885-1"", ""confidence"": 0.7}, {""field_name"": ""endpoint"", ""modality"": ""figure"", ""locator"": ""Figure 7"", ""page"": null, ""bbox"": null, ""snippet"": ""Cumulative (%) IBU release for 62 days. Cumulative (%) release comparison for all groups."", ""source_ref"": ""10.1038/s41598-020-74885-1"", ""confidence"": 0.8}, {""field_name"": ""formulation"", ""modality"": ""table"", ""locator"": ""table_text"", ""page"": null, ""bbox"": null, ""snippet"": ""Table 1. Composition of sandwich and non sandwich mats. Groups Bottom layer Middle layer Top layer 10% PCLSW- 1 10%PCL, 1 ml coat 12% PCL-IBU Loaded, 2 ml coat 10% PCL, 1 ml coat..."", ""source_ref"": ""10.1038/s41598-020-74885-1"", ""confidence"": 0.7}], ""route_raw_labels"": {""paper_type"": ""primary_experiment"", ""mentions_ibuprofen"": ""yes"", ""mentions_diffusion_cell"": ""no"", ""franz_confirmed"": ""no"", ""where_diffusion_cell"": ""unknown"", ""where_franz"": ""unknown"", ""study_type"": ""IVRT"", ""barrier_category"": ""skin"", ""barrier_name_raw"": ""Polycaprolactone fibrous mats"", ""endpoint_found"": ""yes"", ""endpoint_time_found"": ""yes"", ""where_endpoint"": ""Figure 7"", ""endpoint_carrier"": ""figure"", ""endpoint_carrier_snippet"": ""Cumulative (%) IBU release for 62 days. Cumulative (%) release comparison for all groups."", ""formulation_carrier"": ""table_text"", ""formulation_carrier_snippet"": ""Table 1. Composition of sandwich and non sandwich mats. Groups Bottom layer Middle layer Top layer 10% PCLSW- 1 10%PCL, 1 ml coat 12% PCL-IBU Loaded, 2 ml coat 10% PCL, 1 ml coat..."", ""endpoint_likely_in_supp"": ""no"", ""formulation_table_missing"": ""no"", ""notes"": ""The study explores the fabrication of tri-layered PCL mats with ibuprofen for sustained release, detailing changes in drug release kinetics related to layer composition and structure."", ""router_source_backend"": ""pdf_local"", ""router_source_ref"": ""papers\\pdf\\10.1038_s41598-020-74885-1__cc5880def9.pdf"", ""router_source_diagnostics"": [""blocked:html_remote:captcha""], ""router_heuristic_signals"": {}}}}","[{""field_name"": ""formulation"", ""modality"": ""table"", ""locator"": ""Table 2"", ""page"": 7, ""bbox"": null, ""snippet"": ""The cumulative % of IBU released were 86.08%, for 12% PCL-IBU at 62 days."", ""source_ref"": ""papers\\pdf\\10.1038_s41598-020-74885-1__cc5880def9.pdf"", ""confidence"": 0.9}, {""field_name"": ""endpoint"", ""modality"": ""table"", ""locator"": ""Table 2"", ""page"": 7, ""bbox"": null, ""snippet"": ""The cumulative % of IBU released were 86.08%, for 12% PCL-IBU at 62 days."", ""source_ref"": ""papers\\pdf\\10.1038_s41598-020-74885-1__cc5880def9.pdf"", ""confidence"": 0.9}]",[],"[""Cumulative release of IBU""]"
record_cecdb7645542,paper_112cba50495d,10.1038/s41598-024-57883-5,table,0.69,0.9,,both,,cotton fabric,Sample C,Ibuprofen,1.0,mg/cm²,Drug loading,1 mg/cm²,Cotton Fabric with PLA-PEG,"[{""name"": ""Ibuprofen"", ""concentration_value"": 64.0, ""concentration_unit"": ""μg"", ""basis"": ""0-2 min release"", ""raw"": """", ""note"": ""Burst release""}, {""name"": ""Ibuprofen"", ""concentration_value"": 97.0, ""concentration_unit"": ""μg"", ""basis"": ""120 min release"", ""raw"": """", ""note"": ""After initial burst""}]",amount,amount_total,209.0,μg/g,14.0,days,,,,,336.0,pending,unknown,[],,,[],2,0,table,pdf,papers\pdf\10.1038_s41598-024-57883-5__8b907f605e.pdf,[],"{""extractor_name"": ""table"", ""source_format"": ""pdf"", ""source_path"": ""papers\\pdf\\10.1038_s41598-024-57883-5__8b907f605e.pdf"", ""source_pages"": [2, 3, 8, 9, 11], ""route_label"": ""table"", ""route_notes"": ""The paper includes extensive detailed methodologies and results regarding ibuprofen-loaded cotton fabric, indicating practical implications for topical delivery."", ""artifact_paths"": [], ""metadata"": {""source_backend"": ""pdf_local"", ""locator_mode"": ""page"", ""selected_locators"": [""page 2"", ""page 3"", ""page 8"", ""page 9"", ""page 11""], ""table_id"": ""Table 4"", ""row_source_pages"": [8], ""row_source_locators"": [""page 8""], ""score_debug"": {""page 2"": 1, ""page 3"": 1, ""page 8"": 1, ""page 9"": 1, ""page 11"": 1}, ""route_anchor_evidence"": [{""field_name"": ""endpoint"", ""modality"": ""table"", ""locator"": ""methods"", ""page"": null, ""bbox"": null, ""snippet"": ""Table 1. Detailed schedule of modification steps for cotton samples."", ""source_ref"": ""10.1038/s41598-024-57883-5"", ""confidence"": 0.8}, {""field_name"": ""formulation"", ""modality"": ""table"", ""locator"": ""table_text"", ""page"": null, ""bbox"": null, ""snippet"": ""Table 1. Detailed schedule of modification steps for cotton samples."", ""source_ref"": ""10.1038/s41598-024-57883-5"", ""confidence"": 0.7}], ""route_raw_labels"": {""paper_type"": ""primary_experiment"", ""mentions_ibuprofen"": ""yes"", ""mentions_diffusion_cell"": ""no"", ""franz_confirmed"": ""no"", ""where_diffusion_cell"": """", ""where_franz"": """", ""study_type"": ""both"", ""barrier_category"": ""skin"", ""barrier_name_raw"": ""cotton fabric"", ""endpoint_found"": ""yes"", ""endpoint_time_found"": ""yes"", ""where_endpoint"": ""methods"", ""endpoint_carrier"": ""table_text"", ""endpoint_carrier_snippet"": ""Table 1. Detailed schedule of modification steps for cotton samples."", ""formulation_carrier"": ""table_text"", ""formulation_carrier_snippet"": ""Table 1. Detailed schedule of modification steps for cotton samples."", ""endpoint_likely_in_supp"": ""yes"", ""formulation_table_missing"": ""no"", ""notes"": ""The paper includes extensive detailed methodologies and results regarding ibuprofen-loaded cotton fabric, indicating practical implications for topical delivery."", ""router_source_backend"": ""pdf_local"", ""router_source_ref"": ""papers\\pdf\\10.1038_s41598-024-57883-5__8b907f605e.pdf"", ""router_source_diagnostics"": [""blocked:html_remote:captcha""], ""router_heuristic_signals"": {}}}}","[{""field_name"": ""formulation"", ""modality"": ""table"", ""locator"": ""Table 4"", ""page"": 8, ""bbox"": null, ""snippet"": ""percentage and absolute values of IBU release in 14 days with standard deviation (SD)"", ""source_ref"": ""papers\\pdf\\10.1038_s41598-024-57883-5__8b907f605e.pdf"", ""confidence"": 0.9}, {""field_name"": ""endpoint"", ""modality"": ""table"", ""locator"": ""Table 4"", ""page"": 8, ""bbox"": null, ""snippet"": ""percentage and absolute values of IBU release in 14 days with standard deviation (SD)"", ""source_ref"": ""papers\\pdf\\10.1038_s41598-024-57883-5__8b907f605e.pdf"", ""confidence"": 0.9}]",[],"[""Release data after 2 min and 120 min.""]"
record_9dde44c7b3b2,paper_112cba50495d,10.1038/s41598-024-57883-5,table,0.69,0.9,,both,,cotton fabric,Sample E,Ibuprofen,1.0,mg/cm²,Drug loading,1 mg/cm²,Cotton Fabric with Star-PLA,"[{""name"": ""Ibuprofen"", ""concentration_value"": 64.0, ""concentration_unit"": ""μg"", ""basis"": ""0-2 min release"", ""raw"": """", ""note"": ""Burst release""}, {""name"": ""Ibuprofen"", ""concentration_value"": 106.0, ""concentration_unit"": ""μg"", ""basis"": ""120 min release"", ""raw"": """", ""note"": ""After initial burst""}]",amount,amount_total,239.0,μg/g,14.0,days,,,,,336.0,pending,unknown,[],,,[],2,0,table,pdf,papers\pdf\10.1038_s41598-024-57883-5__8b907f605e.pdf,[],"{""extractor_name"": ""table"", ""source_format"": ""pdf"", ""source_path"": ""papers\\pdf\\10.1038_s41598-024-57883-5__8b907f605e.pdf"", ""source_pages"": [2, 3, 8, 9, 11], ""route_label"": ""table"", ""route_notes"": ""The paper includes extensive detailed methodologies and results regarding ibuprofen-loaded cotton fabric, indicating practical implications for topical delivery."", ""artifact_paths"": [], ""metadata"": {""source_backend"": ""pdf_local"", ""locator_mode"": ""page"", ""selected_locators"": [""page 2"", ""page 3"", ""page 8"", ""page 9"", ""page 11""], ""table_id"": ""Table 4"", ""row_source_pages"": [8], ""row_source_locators"": [""page 8""], ""score_debug"": {""page 2"": 1, ""page 3"": 1, ""page 8"": 1, ""page 9"": 1, ""page 11"": 1}, ""route_anchor_evidence"": [{""field_name"": ""endpoint"", ""modality"": ""table"", ""locator"": ""methods"", ""page"": null, ""bbox"": null, ""snippet"": ""Table 1. Detailed schedule of modification steps for cotton samples."", ""source_ref"": ""10.1038/s41598-024-57883-5"", ""confidence"": 0.8}, {""field_name"": ""formulation"", ""modality"": ""table"", ""locator"": ""table_text"", ""page"": null, ""bbox"": null, ""snippet"": ""Table 1. Detailed schedule of modification steps for cotton samples."", ""source_ref"": ""10.1038/s41598-024-57883-5"", ""confidence"": 0.7}], ""route_raw_labels"": {""paper_type"": ""primary_experiment"", ""mentions_ibuprofen"": ""yes"", ""mentions_diffusion_cell"": ""no"", ""franz_confirmed"": ""no"", ""where_diffusion_cell"": """", ""where_franz"": """", ""study_type"": ""both"", ""barrier_category"": ""skin"", ""barrier_name_raw"": ""cotton fabric"", ""endpoint_found"": ""yes"", ""endpoint_time_found"": ""yes"", ""where_endpoint"": ""methods"", ""endpoint_carrier"": ""table_text"", ""endpoint_carrier_snippet"": ""Table 1. Detailed schedule of modification steps for cotton samples."", ""formulation_carrier"": ""table_text"", ""formulation_carrier_snippet"": ""Table 1. Detailed schedule of modification steps for cotton samples."", ""endpoint_likely_in_supp"": ""yes"", ""formulation_table_missing"": ""no"", ""notes"": ""The paper includes extensive detailed methodologies and results regarding ibuprofen-loaded cotton fabric, indicating practical implications for topical delivery."", ""router_source_backend"": ""pdf_local"", ""router_source_ref"": ""papers\\pdf\\10.1038_s41598-024-57883-5__8b907f605e.pdf"", ""router_source_diagnostics"": [""blocked:html_remote:captcha""], ""router_heuristic_signals"": {}}}}","[{""field_name"": ""formulation"", ""modality"": ""table"", ""locator"": ""Table 4"", ""page"": 8, ""bbox"": null, ""snippet"": ""percentage and absolute values of IBU release in 14 days with standard deviation (SD)"", ""source_ref"": ""papers\\pdf\\10.1038_s41598-024-57883-5__8b907f605e.pdf"", ""confidence"": 0.9}, {""field_name"": ""endpoint"", ""modality"": ""table"", ""locator"": ""Table 4"", ""page"": 8, ""bbox"": null, ""snippet"": ""percentage and absolute values of IBU release in 14 days with standard deviation (SD)"", ""source_ref"": ""papers\\pdf\\10.1038_s41598-024-57883-5__8b907f605e.pdf"", ""confidence"": 0.9}]",[],"[""Release data after 2 min and 120 min.""]"
record_79f7655bea48,paper_a0517498c977,10.1039/d0ra00100g,table,0.81,0.95,,IVPT,Franz diffusion cell,porcine skin,Ibu- profen Derivatives with L-Valine,Ibuprofen,,,,Cumulative mass of IBU and % applied dose of IBU,Topical solution,"[{""name"": ""rac-IBU"", ""concentration_value"": 302.84, ""concentration_unit"": ""mg/cm²"", ""basis"": ""Cumulative mass in acceptor phase after 24h"", ""raw"": """", ""note"": """"}, {""name"": ""[ValOEt][IBU]"", ""concentration_value"": 215.19, ""concentration_unit"": ""mg/cm²"", ""basis"": ""Cumulative mass in acceptor phase after 24h"", ""raw"": """", ""note"": ""Significantly different from control (ibuprofen) (P < 0.05)""}, {""name"": ""[ValOiPr][IBU]"", ""concentration_value"": 341.2, ""concentration_unit"": ""mg/cm²"", ""basis"": ""Cumulative mass in acceptor phase after 24h"", ""raw"": """", ""note"": ""Significantly different from control (ibuprofen) (P < 0.001)""}, {""name"": ""[ValOPr][IBU]"", ""concentration_value"": 382.35, ""concentration_unit"": ""mg/cm²"", ""basis"": ""Cumulative mass in acceptor phase after 24h"", ""raw"": """", ""note"": ""Significantly different from control (ibuprofen) (P < 0.001)""}, {""name"": ""[ValOBu][IBU]"", ""concentration_value"": 289.74, ""concentration_unit"": ""mg/cm²"", ""basis"": ""Cumulative mass in acceptor phase after 24h"", ""raw"": """", ""note"": ""Significantly different from control (ibuprofen) (P < 0.001)""}, {""name"": ""[ValOAm][IBU]"", ""concentration_value"": 308.96, ""concentration_unit"": ""mg/cm²"", ""basis"": ""Cumulative mass in acceptor phase after 24h"", ""raw"": """", ""note"": ""Significantly different from control (ibuprofen) (P < 0.001)""}, {""name"": ""[ValOHex][IBU]"", ""concentration_value"": 249.46, ""concentration_unit"": ""mg/cm²"", ""basis"": ""Cumulative mass in acceptor phase after 24h"", ""raw"": """", ""note"": ""Significantly different from control (ibuprofen) (P < 0.001)""}]",amount,amount_total,,mg IBU/cm²,24.0,h,,,,,24.0,pending,unknown,[],,,[],1,0,table,pdf,papers\pdf\10.1039_d0ra00100g__3cae185957.pdf,[],"{""extractor_name"": ""table"", ""source_format"": ""pdf"", ""source_path"": ""papers\\pdf\\10.1039_d0ra00100g__3cae185957.pdf"", ""source_pages"": [8, 10, 11, 13, 14], ""route_label"": ""table"", ""route_notes"": ""The paper details the synthesis and characterization of ibuprofen derivatives and investigates their solubility and skin permeation through Franz diffusion cells."", ""artifact_paths"": [], ""metadata"": {""source_backend"": ""pdf_local"", ""locator_mode"": ""page"", ""selected_locators"": [""page 8"", ""page 10"", ""page 11"", ""page 13"", ""page 14""], ""table_id"": ""Table 5"", ""row_source_pages"": [10], ""row_source_locators"": [""Table 5""], ""score_debug"": {""page 8"": 1, ""page 10"": 1, ""page 11"": 1, ""page 13"": 1, ""page 14"": 1}, ""route_anchor_evidence"": [{""field_name"": ""device"", ""modality"": ""text"", ""locator"": ""page 6, section on Skin permeation studies"", ""page"": 6, ""bbox"": null, ""snippet"": ""page 6, section on Skin permeation studies"", ""source_ref"": ""10.1039/d0ra00100g"", ""confidence"": 0.7}, {""field_name"": ""endpoint"", ""modality"": ""table"", ""locator"": ""page 6, section on Skin permeation studies"", ""page"": 6, ""bbox"": null, ""snippet"": ""The drug concentration in the acceptor fluid was determined using HPLC method. The cumulative mass (mg cm2) was calculated based on this concentration."", ""source_ref"": ""10.1039/d0ra00100g"", ""confidence"": 0.8}, {""field_name"": ""formulation"", ""modality"": ""table"", ""locator"": ""table_text"", ""page"": null, ""bbox"": null, ""snippet"": ""The solubility was established and summarised in Table 2."", ""source_ref"": ""10.1039/d0ra00100g"", ""confidence"": 0.7}], ""route_raw_labels"": {""paper_type"": ""primary_experiment"", ""mentions_ibuprofen"": ""yes"", ""mentions_diffusion_cell"": ""yes"", ""franz_confirmed"": ""yes"", ""where_diffusion_cell"": ""page 6, section on Skin permeation studies"", ""where_franz"": ""page 6, section on Skin permeation studies"", ""study_type"": ""IVPT"", ""barrier_category"": ""skin"", ""barrier_name_raw"": ""porcine skin"", ""endpoint_found"": ""yes"", ""endpoint_time_found"": ""yes"", ""where_endpoint"": ""page 6, section on Skin permeation studies"", ""endpoint_carrier"": ""table_text"", ""endpoint_carrier_snippet"": ""The drug concentration in the acceptor fluid was determined using HPLC method. The cumulative mass (mg cm2) was calculated based on this concentration."", ""formulation_carrier"": ""table_text"", ""formulation_carrier_snippet"": ""The solubility was established and summarised in Table 2."", ""endpoint_likely_in_supp"": ""yes"", ""formulation_table_missing"": ""no"", ""notes"": ""The paper details the synthesis and characterization of ibuprofen derivatives and investigates their solubility and skin permeation through Franz diffusion cells."", ""router_source_backend"": ""pdf_local"", ""router_source_ref"": ""papers\\pdf\\10.1039_d0ra00100g__3cae185957.pdf"", ""router_source_diagnostics"": [""blocked:html_remote:captcha""], ""router_heuristic_signals"": {}}}}","[{""field_name"": ""formulation"", ""modality"": ""table"", ""locator"": ""Table 5"", ""page"": 10, ""bbox"": null, ""snippet"": ""Cumulative mass of ibuprofen in acceptor phase after 24 h of permeation."", ""source_ref"": ""papers\\pdf\\10.1039_d0ra00100g__3cae185957.pdf"", ""confidence"": 0.95}]",[],[]
record_236a55de76ca,paper_c614a40d430f,10.1123/ijspp.2016-0382,mixed,0.69,1.0,,IVPT,,,IBU/APAP,Ibuprofen,400.0,mg,combined with Acetaminophen,400 mg,not specified,[],amount,unknown,0.3,°C,1.0,hour,,,,,1.0,pending,unknown,[],,,[],2,0,table,pdf,papers\pdf\10.1123_ijspp.2016-0382__60e1a4e580.pdf,[],"{""extractor_name"": ""table"", ""source_format"": ""pdf"", ""source_path"": ""papers\\pdf\\10.1123_ijspp.2016-0382__60e1a4e580.pdf"", ""source_pages"": [3, 5, 8, 13, 14], ""route_label"": ""mixed"", ""route_notes"": ""Study design includes randomization of conditions; specific formulations administered 45 minutes pre-exercise."", ""artifact_paths"": [], ""metadata"": {""source_backend"": ""pdf_local"", ""locator_mode"": ""page"", ""selected_locators"": [""page 3"", ""page 5"", ""page 8"", ""page 13"", ""page 14""], ""table_id"": ""Table 2"", ""row_source_pages"": [13], ""row_source_locators"": [""page 14""], ""score_debug"": {""page 3"": 1, ""page 5"": 1, ""page 8"": 1, ""page 13"": 1, ""page 14"": 1}, ""route_anchor_evidence"": [{""field_name"": ""endpoint"", ""modality"": ""table"", ""locator"": ""RESULTS"", ""page"": null, ""bbox"": null, ""snippet"": ""Table 1 presents the characteristics of the study participants, including baseline body temperature data across conditions."", ""source_ref"": ""10.1123/ijspp.2016-0382"", ""confidence"": 0.8}, {""field_name"": ""formulation"", ""modality"": ""text"", ""locator"": ""narrative"", ""page"": null, ""bbox"": null, ""snippet"": ""Participants received ibuprofen (400mg) and acetaminophen (1000mg) in a combined treatment condition (IBU/APAP), along with control and single drug conditions (ABAP)."", ""source_ref"": ""10.1123/ijspp.2016-0382"", ""confidence"": 0.7}], ""route_raw_labels"": {""paper_type"": ""primary_experiment"", ""mentions_ibuprofen"": ""yes"", ""mentions_diffusion_cell"": ""no"", ""franz_confirmed"": ""no"", ""where_diffusion_cell"": """", ""where_franz"": """", ""study_type"": ""IVPT"", ""barrier_category"": ""uncertain"", ""barrier_name_raw"": """", ""endpoint_found"": ""yes"", ""endpoint_time_found"": ""yes"", ""where_endpoint"": ""RESULTS"", ""endpoint_carrier"": ""table_text"", ""endpoint_carrier_snippet"": ""Table 1 presents the characteristics of the study participants, including baseline body temperature data across conditions."", ""formulation_carrier"": ""narrative"", ""formulation_carrier_snippet"": ""Participants received ibuprofen (400mg) and acetaminophen (1000mg) in a combined treatment condition (IBU/APAP), along with control and single drug conditions (ABAP)."", ""endpoint_likely_in_supp"": ""no"", ""formulation_table_missing"": ""no"", ""notes"": ""Study design includes randomization of conditions; specific formulations administered 45 minutes pre-exercise."", ""router_source_backend"": ""pdf_local"", ""router_source_ref"": ""papers\\pdf\\10.1123_ijspp.2016-0382__60e1a4e580.pdf"", ""router_source_diagnostics"": [], ""router_heuristic_signals"": {}}}}","[{""field_name"": ""formulation"", ""modality"": ""table"", ""locator"": ""Table 2"", ""page"": 13, ""bbox"": null, ""snippet"": ""Combined blockade of prostaglandin E2 production both centrally (acetaminophen) and peripherally (ibuprofen) resulted in a slightly but significantly lower maximal core body temperature during one hour of strenuous running exercise."", ""source_ref"": ""papers\\pdf\\10.1123_ijspp.2016-0382__60e1a4e580.pdf"", ""confidence"": 1.0}, {""field_name"": ""endpoint"", ""modality"": ""table"", ""locator"": ""Table 2"", ""page"": 13, ""bbox"": null, ""snippet"": ""Combined blockade of prostaglandin E2 production both centrally (acetaminophen) and peripherally (ibuprofen) resulted in a slightly but significantly lower maximal core body temperature during one hour of strenuous running exercise."", ""source_ref"": ""papers\\pdf\\10.1123_ijspp.2016-0382__60e1a4e580.pdf"", ""confidence"": 1.0}]",[],"[""Combination with Acetaminophen.""]"
