record_id,paper_id,doi,route,route_confidence,extractor_confidence,mapping_confidence,study_type,device,barrier,formulation_label,api_name,api_concentration_value,api_concentration_unit,api_basis,api_concentration_raw,dosage_form,components_json,endpoint_field_name,endpoint_kind,endpoint_value,endpoint_unit,endpoint_time_value,endpoint_time_unit,endpoint_normalized_value,endpoint_normalized_unit,diffusion_area_cm2,receptor_volume_ml,duration_h,verification_status,scope_bucket,scope_tags_json,verification_support_rate,failure_reason,failure_reasons_json,evidence_count,patch_count,extractor_name,source_format,source_path,artifact_paths_json,provenance_json,evidence_json,patches_json,source_notes_json
record_ad27c13dbfc5,paper_6d7ce6948405,10.1002/14651858.cd001177.pub2,table,0.81,1.0,,IVPT,diffusion cell,venous leg ulcers,Ibuprofen foam dressing,Ibuprofen,0.5,mg/cm2,homogeneously dispersed,0.5 mg/cm2,Foam dressing,[],amount,unknown,93.0,participants,7.0,days,,,,,168.0,pending,unknown,[],,,[],2,0,table,pdf,papers\pdf\10.1002_14651858.cd001177.pub2__f1d6f61f65.pdf,[],"{""extractor_name"": ""table"", ""source_format"": ""pdf"", ""source_path"": ""papers\\pdf\\10.1002_14651858.cd001177.pub2__f1d6f61f65.pdf"", ""source_pages"": [3, 14, 17, 26, 47], ""route_label"": ""table"", ""route_notes"": ""Evidence shows that ibuprofen dressings may provide pain relief; further research needed to address outcomes and safety."", ""artifact_paths"": [], ""metadata"": {""source_backend"": ""pdf_local"", ""locator_mode"": ""page"", ""selected_locators"": [""page 3"", ""page 14"", ""page 17"", ""page 26"", ""page 47""], ""table_id"": ""Table 2"", ""row_source_pages"": [26], ""row_source_locators"": [""Arapoglou 2011""], ""score_debug"": {""page 3"": 1, ""page 14"": 1, ""page 17"": 1, ""page 26"": 1, ""page 47"": 1}, ""route_anchor_evidence"": [{""field_name"": ""device"", ""modality"": ""text"", ""locator"": ""N/A"", ""page"": null, ""bbox"": null, ""snippet"": ""N/A"", ""source_ref"": ""10.1002/14651858.cd001177.pub2"", ""confidence"": 0.7}, {""field_name"": ""endpoint"", ""modality"": ""table"", ""locator"": ""Analysis 2.1, Analysis 2.2, Analysis 2.3"", ""page"": null, ""bbox"": null, ""snippet"": ""Analysis 2.1. Comparison 2 Ibuprofen foam dressing compared with foam dressing alone, Outcome 1 Number participants experiencing pain relief on the ﬁrst evening of treatment."", ""source_ref"": ""10.1002/14651858.cd001177.pub2"", ""confidence"": 0.8}, {""field_name"": ""formulation"", ""modality"": ""table"", ""locator"": ""table_text"", ""page"": null, ""bbox"": null, ""snippet"": ""Analysis 2.1. Comparison 2 Ibuprofen foam dressing compared with foam dressing alone."", ""source_ref"": ""10.1002/14651858.cd001177.pub2"", ""confidence"": 0.7}], ""route_raw_labels"": {""paper_type"": ""review"", ""mentions_ibuprofen"": ""yes"", ""mentions_diffusion_cell"": ""no"", ""franz_confirmed"": ""no"", ""where_diffusion_cell"": ""N/A"", ""where_franz"": ""N/A"", ""study_type"": ""IVPT"", ""barrier_category"": ""uncertain"", ""barrier_name_raw"": ""venous leg ulcers"", ""endpoint_found"": ""yes"", ""endpoint_time_found"": ""yes"", ""where_endpoint"": ""Analysis 2.1, Analysis 2.2, Analysis 2.3"", ""endpoint_carrier"": ""table_text"", ""endpoint_carrier_snippet"": ""Analysis 2.1. Comparison 2 Ibuprofen foam dressing compared with foam dressing alone, Outcome 1 Number participants experiencing pain relief on the ﬁrst evening of treatment."", ""formulation_carrier"": ""table_text"", ""formulation_carrier_snippet"": ""Analysis 2.1. Comparison 2 Ibuprofen foam dressing compared with foam dressing alone."", ""endpoint_likely_in_supp"": ""yes"", ""formulation_table_missing"": ""no"", ""notes"": ""Evidence shows that ibuprofen dressings may provide pain relief; further research needed to address outcomes and safety."", ""router_source_backend"": ""pdf_local"", ""router_source_ref"": ""papers\\pdf\\10.1002_14651858.cd001177.pub2__f1d6f61f65.pdf"", ""router_source_diagnostics"": [], ""router_heuristic_signals"": {}}}}","[{""field_name"": ""formulation"", ""modality"": ""table"", ""locator"": ""Table 2"", ""page"": 26, ""bbox"": null, ""snippet"": ""Number participants reporting TOTPARD5>50%."", ""source_ref"": ""papers\\pdf\\10.1002_14651858.cd001177.pub2__f1d6f61f65.pdf"", ""confidence"": 1.0}, {""field_name"": ""endpoint"", ""modality"": ""table"", ""locator"": ""Table 2"", ""page"": 26, ""bbox"": null, ""snippet"": ""Number participants reporting TOTPARD5>50%."", ""source_ref"": ""papers\\pdf\\10.1002_14651858.cd001177.pub2__f1d6f61f65.pdf"", ""confidence"": 1.0}]",[],"[""Mean (SD) treatment duration was 7(±2) days.""]"
record_70ba31760ae8,paper_314ad560b37c,10.1007/s00253-023-12677-z,figure,0.5700000000000001,0.95,,uncertain,,,MBR1 Removal Efficiency,Ibuprofen,100.0,mg/L,influence on microbial communities,100 mg/L,Membrane Bioreactor,"[{""name"": ""Ibuprofen"", ""concentration_value"": 100.0, ""concentration_unit"": ""mg/L"", ""basis"": ""influence on microbial communities"", ""raw"": """", ""note"": ""removed between 35% to 100% over time""}]",amount,percent,100.0,%,10.0,weeks,,,,,,pending,unknown,[],,,[],2,0,table,pdf,papers\pdf\10.1007_s00253-023-12677-z__1200500844.pdf,[],"{""extractor_name"": ""table"", ""source_format"": ""pdf"", ""source_path"": ""papers\\pdf\\10.1007_s00253-023-12677-z__1200500844.pdf"", ""source_pages"": [3, 4, 5, 6, 8], ""route_label"": ""figure"", ""route_notes"": ""The study utilizes laboratory-scale MBRs to analyze the degradation of pharmaceuticals including ibuprofen. The endpoint findings include information on the removal efficiency of ibuprofen by microbial communities, but no formulation details are provided."", ""artifact_paths"": [], ""metadata"": {""source_backend"": ""pdf_local"", ""locator_mode"": ""page"", ""selected_locators"": [""page 3"", ""page 4"", ""page 5"", ""page 6"", ""page 8""], ""table_id"": ""Table 1"", ""row_source_pages"": [4], ""row_source_locators"": [""page 4""], ""score_debug"": {""page 3"": 1, ""page 4"": 1, ""page 5"": 1, ""page 6"": 1, ""page 8"": 1}, ""route_anchor_evidence"": [{""field_name"": ""endpoint"", ""modality"": ""figure"", ""locator"": ""PAGE 4, Figure 2"", ""page"": 4, ""bbox"": null, ""snippet"": ""Microbial communities within MBR1 and MBR2 were able to remove atenolol, caffeine, enalapril, ibuprofen, and paracetamol with varying efficiencies over time."", ""source_ref"": ""10.1007/s00253-023-12677-z"", ""confidence"": 0.8}], ""route_raw_labels"": {""paper_type"": ""primary_experiment"", ""mentions_ibuprofen"": ""yes"", ""mentions_diffusion_cell"": ""no"", ""franz_confirmed"": ""no"", ""where_diffusion_cell"": """", ""where_franz"": """", ""study_type"": ""uncertain"", ""barrier_category"": ""uncertain"", ""barrier_name_raw"": """", ""endpoint_found"": ""yes"", ""endpoint_time_found"": ""yes"", ""where_endpoint"": ""PAGE 4, Figure 2"", ""endpoint_carrier"": ""figure"", ""endpoint_carrier_snippet"": ""Microbial communities within MBR1 and MBR2 were able to remove atenolol, caffeine, enalapril, ibuprofen, and paracetamol with varying efficiencies over time."", ""formulation_carrier"": ""unknown"", ""formulation_carrier_snippet"": """", ""endpoint_likely_in_supp"": ""no"", ""formulation_table_missing"": ""yes"", ""notes"": ""The study utilizes laboratory-scale MBRs to analyze the degradation of pharmaceuticals including ibuprofen. The endpoint findings include information on the removal efficiency of ibuprofen by microbial communities, but no formulation details are provided."", ""router_source_backend"": ""pdf_local"", ""router_source_ref"": ""papers\\pdf\\10.1007_s00253-023-12677-z__1200500844.pdf"", ""router_source_diagnostics"": [""blocked:html_remote:captcha""], ""router_heuristic_signals"": {}}}}","[{""field_name"": ""formulation"", ""modality"": ""table"", ""locator"": ""Table 1"", ""page"": 4, ""bbox"": null, ""snippet"": ""The microbial community within MBR1 was able to remove ibuprofen in a range of 35–100%."", ""source_ref"": ""papers\\pdf\\10.1007_s00253-023-12677-z__1200500844.pdf"", ""confidence"": 0.95}, {""field_name"": ""endpoint"", ""modality"": ""table"", ""locator"": ""Table 1"", ""page"": 4, ""bbox"": null, ""snippet"": ""The microbial community within MBR1 was able to remove ibuprofen in a range of 35–100%."", ""source_ref"": ""papers\\pdf\\10.1007_s00253-023-12677-z__1200500844.pdf"", ""confidence"": 0.95}]",[],[]
record_f8151def8a4d,paper_314ad560b37c,10.1007/s00253-023-12677-z,figure,0.5700000000000001,0.85,,uncertain,,,MBR2 Removal Efficiency,Ibuprofen,100.0,mg/L,influence on microbial communities,100 mg/L,Membrane Bioreactor,"[{""name"": ""Ibuprofen"", ""concentration_value"": 100.0, ""concentration_unit"": ""mg/L"", ""basis"": ""influence on microbial communities"", ""raw"": """", ""note"": ""removed between 0% to 100% over time""}]",amount,percent,100.0,%,10.0,weeks,,,,,,pending,unknown,[],,,[],2,0,table,pdf,papers\pdf\10.1007_s00253-023-12677-z__1200500844.pdf,[],"{""extractor_name"": ""table"", ""source_format"": ""pdf"", ""source_path"": ""papers\\pdf\\10.1007_s00253-023-12677-z__1200500844.pdf"", ""source_pages"": [3, 4, 5, 6, 8], ""route_label"": ""figure"", ""route_notes"": ""The study utilizes laboratory-scale MBRs to analyze the degradation of pharmaceuticals including ibuprofen. The endpoint findings include information on the removal efficiency of ibuprofen by microbial communities, but no formulation details are provided."", ""artifact_paths"": [], ""metadata"": {""source_backend"": ""pdf_local"", ""locator_mode"": ""page"", ""selected_locators"": [""page 3"", ""page 4"", ""page 5"", ""page 6"", ""page 8""], ""table_id"": ""Table 2"", ""row_source_pages"": [4], ""row_source_locators"": [""page 4""], ""score_debug"": {""page 3"": 1, ""page 4"": 1, ""page 5"": 1, ""page 6"": 1, ""page 8"": 1}, ""route_anchor_evidence"": [{""field_name"": ""endpoint"", ""modality"": ""figure"", ""locator"": ""PAGE 4, Figure 2"", ""page"": 4, ""bbox"": null, ""snippet"": ""Microbial communities within MBR1 and MBR2 were able to remove atenolol, caffeine, enalapril, ibuprofen, and paracetamol with varying efficiencies over time."", ""source_ref"": ""10.1007/s00253-023-12677-z"", ""confidence"": 0.8}], ""route_raw_labels"": {""paper_type"": ""primary_experiment"", ""mentions_ibuprofen"": ""yes"", ""mentions_diffusion_cell"": ""no"", ""franz_confirmed"": ""no"", ""where_diffusion_cell"": """", ""where_franz"": """", ""study_type"": ""uncertain"", ""barrier_category"": ""uncertain"", ""barrier_name_raw"": """", ""endpoint_found"": ""yes"", ""endpoint_time_found"": ""yes"", ""where_endpoint"": ""PAGE 4, Figure 2"", ""endpoint_carrier"": ""figure"", ""endpoint_carrier_snippet"": ""Microbial communities within MBR1 and MBR2 were able to remove atenolol, caffeine, enalapril, ibuprofen, and paracetamol with varying efficiencies over time."", ""formulation_carrier"": ""unknown"", ""formulation_carrier_snippet"": """", ""endpoint_likely_in_supp"": ""no"", ""formulation_table_missing"": ""yes"", ""notes"": ""The study utilizes laboratory-scale MBRs to analyze the degradation of pharmaceuticals including ibuprofen. The endpoint findings include information on the removal efficiency of ibuprofen by microbial communities, but no formulation details are provided."", ""router_source_backend"": ""pdf_local"", ""router_source_ref"": ""papers\\pdf\\10.1007_s00253-023-12677-z__1200500844.pdf"", ""router_source_diagnostics"": [""blocked:html_remote:captcha""], ""router_heuristic_signals"": {}}}}","[{""field_name"": ""formulation"", ""modality"": ""table"", ""locator"": ""Table 2"", ""page"": 4, ""bbox"": null, ""snippet"": ""MBR2 showed strong fluctuating removal efficiencies of ibuprofen per week, ranging from 0 to 100%."", ""source_ref"": ""papers\\pdf\\10.1007_s00253-023-12677-z__1200500844.pdf"", ""confidence"": 0.85}, {""field_name"": ""endpoint"", ""modality"": ""table"", ""locator"": ""Table 2"", ""page"": 4, ""bbox"": null, ""snippet"": ""MBR2 showed strong fluctuating removal efficiencies of ibuprofen per week, ranging from 0 to 100%."", ""source_ref"": ""papers\\pdf\\10.1007_s00253-023-12677-z__1200500844.pdf"", ""confidence"": 0.85}]",[],[]
record_dc6dcd4cd00c,paper_b257621dff97,10.1007/s11095-008-9785-y,table,0.69,0.9,,both,,stratum corneum,Table II: Concentration Profiles of Ibuprofen in SC,Ibuprofen,10.0,mg/ml,Saturation in propylene glycol/water,~10 mg/ml in 75:25 propylene glycol/water,Topical application,"[{""name"": ""Propylene Glycol"", ""concentration_value"": null, ""concentration_unit"": """", ""basis"": ""Co-solvent"", ""raw"": """", ""note"": ""Used in a 75:25 (v/v) mixture with water""}]",amount,unknown,,,4.0,hours,,,,,4.0,pending,unknown,[],,,[],1,0,table,pdf,papers\pdf\10.1007_s11095-008-9785-y__4a59bd2375.pdf,[],"{""extractor_name"": ""table"", ""source_format"": ""pdf"", ""source_path"": ""papers\\pdf\\10.1007_s11095-008-9785-y__4a59bd2375.pdf"", ""source_pages"": [5, 7, 8, 12, 21], ""route_label"": ""table"", ""route_notes"": """", ""artifact_paths"": [], ""metadata"": {""source_backend"": ""pdf_local"", ""locator_mode"": ""page"", ""selected_locators"": [""page 5"", ""page 7"", ""page 8"", ""page 12"", ""page 21""], ""table_id"": ""Table II"", ""row_source_pages"": [5, 12], ""row_source_locators"": [""page 12""], ""score_debug"": {""page 5"": 1, ""page 7"": 1, ""page 8"": 1, ""page 12"": 1, ""page 21"": 1}, ""route_anchor_evidence"": [{""field_name"": ""endpoint"", ""modality"": ""table"", ""locator"": ""Table II"", ""page"": null, ""bbox"": null, ""snippet"": ""Table II: Quantity of ibuprofen (mean ± SD, n=5) in the SC following a 30-minute application of a saturated drug solution in 75:25 (v/v) propylene glycol/water under different clearance conditions as specified in the text."", ""source_ref"": ""10.1007/s11095-008-9785-y"", ""confidence"": 0.8}, {""field_name"": ""formulation"", ""modality"": ""table"", ""locator"": ""table_text"", ""page"": null, ""bbox"": null, ""snippet"": ""Table II: Quantity of ibuprofen (mean ± SD, n=5) in the SC following a 30-minute application of a saturated drug solution in 75:25 (v/v) propylene glycol/water under different clearance conditions as specified in the text."", ""source_ref"": ""10.1007/s11095-008-9785-y"", ""confidence"": 0.7}], ""route_raw_labels"": {""paper_type"": ""primary_experiment"", ""mentions_ibuprofen"": ""yes"", ""mentions_diffusion_cell"": ""no"", ""franz_confirmed"": ""no"", ""where_diffusion_cell"": """", ""where_franz"": """", ""study_type"": ""both"", ""barrier_category"": ""skin"", ""barrier_name_raw"": ""stratum corneum"", ""endpoint_found"": ""yes"", ""endpoint_time_found"": ""yes"", ""where_endpoint"": ""Table II"", ""endpoint_carrier"": ""table_text"", ""endpoint_carrier_snippet"": ""Table II: Quantity of ibuprofen (mean ± SD, n=5) in the SC following a 30-minute application of a saturated drug solution in 75:25 (v/v) propylene glycol/water under different clearance conditions as specified in the text."", ""formulation_carrier"": ""table_text"", ""formulation_carrier_snippet"": ""Table II: Quantity of ibuprofen (mean ± SD, n=5) in the SC following a 30-minute application of a saturated drug solution in 75:25 (v/v) propylene glycol/water under different clearance conditions as specified in the text."", ""endpoint_likely_in_supp"": ""no"", ""formulation_table_missing"": ""no"", ""notes"": """", ""router_source_backend"": ""pdf_local"", ""router_source_ref"": ""papers\\pdf\\10.1007_s11095-008-9785-y__4a59bd2375.pdf"", ""router_source_diagnostics"": [], ""router_heuristic_signals"": {}}}}","[{""field_name"": ""formulation"", ""modality"": ""table"", ""locator"": ""Table II"", ""page"": 5, ""bbox"": null, ""snippet"": ""The total amount of ibuprofen (in µg/cm2) within the SC hardly changed at all during the 4 hours clearance period."", ""source_ref"": ""papers\\pdf\\10.1007_s11095-008-9785-y__4a59bd2375.pdf"", ""confidence"": 0.9}]",[],"[""Data on ibuprofen clearance dynamics were analyzed.""]"
record_c774ad459207,paper_a47037272c43,10.1007/s11095-014-1318-2,mixed,0.81,1.0,,IVRT,,drug-in-adhesive films,Duro-Tak 87-900A,Ibuprofen,22.5,% w/w,nominal drug load,>22.5% w/w,Transdermal film,"[{""name"": ""Ibuprofen"", ""concentration_value"": 22.5, ""concentration_unit"": ""% w/w"", ""basis"": ""nominal drug load"", ""raw"": """", ""note"": "">22.5% w/w""}]",amount,unknown,,,,,,,,,,pending,unknown,[],,,[],1,0,table,pdf,papers\pdf\10.1007_s11095-014-1318-2__06b4139d6d.pdf,[],"{""extractor_name"": ""table"", ""source_format"": ""pdf"", ""source_path"": ""papers\\pdf\\10.1007_s11095-014-1318-2__06b4139d6d.pdf"", ""source_pages"": [8, 9, 10, 14, 15], ""route_label"": ""mixed"", ""route_notes"": ""Focus on the interaction of drug solubility parameters with adhesive properties in formulations."", ""artifact_paths"": [], ""metadata"": {""source_backend"": ""pdf_local"", ""locator_mode"": ""page"", ""selected_locators"": [""page 8"", ""page 9"", ""page 10"", ""page 14"", ""page 15""], ""table_id"": ""Table IV"", ""row_source_pages"": [9], ""row_source_locators"": [""page 14""], ""score_debug"": {""page 8"": 1, ""page 9"": 1, ""page 10"": 1, ""page 14"": 1, ""page 15"": 1}, ""route_anchor_evidence"": [{""field_name"": ""device"", ""modality"": ""text"", ""locator"": ""unknown"", ""page"": null, ""bbox"": null, ""snippet"": ""unknown"", ""source_ref"": ""10.1007/s11095-014-1318-2"", ""confidence"": 0.7}, {""field_name"": ""endpoint"", ""modality"": ""text"", ""locator"": ""summary of results in the main text"", ""page"": null, ""bbox"": null, ""snippet"": ""Drug solubility parameters and molar drug concentrations have an impact on rheological patterns and thus on the adhesive performance of tested pressure sensitive adhesives intended for use in transdermal drug delivery systems."", ""source_ref"": ""10.1007/s11095-014-1318-2"", ""confidence"": 0.8}, {""field_name"": ""formulation"", ""modality"": ""table"", ""locator"": ""table_text"", ""page"": null, ""bbox"": null, ""snippet"": ""Table I shows the physicochemical properties and calculated solubility parameter values for the model drugs."", ""source_ref"": ""10.1007/s11095-014-1318-2"", ""confidence"": 0.7}], ""route_raw_labels"": {""paper_type"": ""primary_experiment"", ""mentions_ibuprofen"": ""yes"", ""mentions_diffusion_cell"": ""no"", ""franz_confirmed"": ""no"", ""where_diffusion_cell"": ""unknown"", ""where_franz"": ""unknown"", ""study_type"": ""IVRT"", ""barrier_category"": ""uncertain"", ""barrier_name_raw"": ""drug-in-adhesive films"", ""endpoint_found"": ""yes"", ""endpoint_time_found"": ""uncertain"", ""where_endpoint"": ""summary of results in the main text"", ""endpoint_carrier"": ""narrative"", ""endpoint_carrier_snippet"": ""Drug solubility parameters and molar drug concentrations have an impact on rheological patterns and thus on the adhesive performance of tested pressure sensitive adhesives intended for use in transdermal drug delivery systems."", ""formulation_carrier"": ""table_text"", ""formulation_carrier_snippet"": ""Table I shows the physicochemical properties and calculated solubility parameter values for the model drugs."", ""endpoint_likely_in_supp"": ""no"", ""formulation_table_missing"": ""no"", ""notes"": ""Focus on the interaction of drug solubility parameters with adhesive properties in formulations."", ""router_source_backend"": ""pdf_local"", ""router_source_ref"": ""papers\\pdf\\10.1007_s11095-014-1318-2__06b4139d6d.pdf"", ""router_source_diagnostics"": [""blocked:html_remote:captcha""], ""router_heuristic_signals"": {}}}}","[{""field_name"": ""formulation"", ""modality"": ""table"", ""locator"": ""Table IV"", ""page"": 9, ""bbox"": null, ""snippet"": ""Ibuprofen solubility estimate from rheological data is > 22.5% in Duro-Tak 87-900A."", ""source_ref"": ""papers\\pdf\\10.1007_s11095-014-1318-2__06b4139d6d.pdf"", ""confidence"": 1.0}]",[],[]
record_8860fc12a6af,paper_a47037272c43,10.1007/s11095-014-1318-2,mixed,0.81,1.0,,IVRT,,drug-in-adhesive films,Duro-Tak 87-4287,Ibuprofen,22.0,% w/w,nominal drug load,<22% w/w,Transdermal film,"[{""name"": ""Ibuprofen"", ""concentration_value"": 22.0, ""concentration_unit"": ""% w/w"", ""basis"": ""nominal drug load"", ""raw"": """", ""note"": ""<22% w/w""}]",amount,unknown,,,,,,,,,,pending,unknown,[],,,[],1,0,table,pdf,papers\pdf\10.1007_s11095-014-1318-2__06b4139d6d.pdf,[],"{""extractor_name"": ""table"", ""source_format"": ""pdf"", ""source_path"": ""papers\\pdf\\10.1007_s11095-014-1318-2__06b4139d6d.pdf"", ""source_pages"": [8, 9, 10, 14, 15], ""route_label"": ""mixed"", ""route_notes"": ""Focus on the interaction of drug solubility parameters with adhesive properties in formulations."", ""artifact_paths"": [], ""metadata"": {""source_backend"": ""pdf_local"", ""locator_mode"": ""page"", ""selected_locators"": [""page 8"", ""page 9"", ""page 10"", ""page 14"", ""page 15""], ""table_id"": ""Table IV"", ""row_source_pages"": [9], ""row_source_locators"": [""page 14""], ""score_debug"": {""page 8"": 1, ""page 9"": 1, ""page 10"": 1, ""page 14"": 1, ""page 15"": 1}, ""route_anchor_evidence"": [{""field_name"": ""device"", ""modality"": ""text"", ""locator"": ""unknown"", ""page"": null, ""bbox"": null, ""snippet"": ""unknown"", ""source_ref"": ""10.1007/s11095-014-1318-2"", ""confidence"": 0.7}, {""field_name"": ""endpoint"", ""modality"": ""text"", ""locator"": ""summary of results in the main text"", ""page"": null, ""bbox"": null, ""snippet"": ""Drug solubility parameters and molar drug concentrations have an impact on rheological patterns and thus on the adhesive performance of tested pressure sensitive adhesives intended for use in transdermal drug delivery systems."", ""source_ref"": ""10.1007/s11095-014-1318-2"", ""confidence"": 0.8}, {""field_name"": ""formulation"", ""modality"": ""table"", ""locator"": ""table_text"", ""page"": null, ""bbox"": null, ""snippet"": ""Table I shows the physicochemical properties and calculated solubility parameter values for the model drugs."", ""source_ref"": ""10.1007/s11095-014-1318-2"", ""confidence"": 0.7}], ""route_raw_labels"": {""paper_type"": ""primary_experiment"", ""mentions_ibuprofen"": ""yes"", ""mentions_diffusion_cell"": ""no"", ""franz_confirmed"": ""no"", ""where_diffusion_cell"": ""unknown"", ""where_franz"": ""unknown"", ""study_type"": ""IVRT"", ""barrier_category"": ""uncertain"", ""barrier_name_raw"": ""drug-in-adhesive films"", ""endpoint_found"": ""yes"", ""endpoint_time_found"": ""uncertain"", ""where_endpoint"": ""summary of results in the main text"", ""endpoint_carrier"": ""narrative"", ""endpoint_carrier_snippet"": ""Drug solubility parameters and molar drug concentrations have an impact on rheological patterns and thus on the adhesive performance of tested pressure sensitive adhesives intended for use in transdermal drug delivery systems."", ""formulation_carrier"": ""table_text"", ""formulation_carrier_snippet"": ""Table I shows the physicochemical properties and calculated solubility parameter values for the model drugs."", ""endpoint_likely_in_supp"": ""no"", ""formulation_table_missing"": ""no"", ""notes"": ""Focus on the interaction of drug solubility parameters with adhesive properties in formulations."", ""router_source_backend"": ""pdf_local"", ""router_source_ref"": ""papers\\pdf\\10.1007_s11095-014-1318-2__06b4139d6d.pdf"", ""router_source_diagnostics"": [""blocked:html_remote:captcha""], ""router_heuristic_signals"": {}}}}","[{""field_name"": ""formulation"", ""modality"": ""table"", ""locator"": ""Table IV"", ""page"": 9, ""bbox"": null, ""snippet"": ""Ibuprofen solubility estimate from rheological data is < 22% in Duro-Tak 87-4287."", ""source_ref"": ""papers\\pdf\\10.1007_s11095-014-1318-2__06b4139d6d.pdf"", ""confidence"": 1.0}]",[],[]
