paper_id,doi,title,route,route_confidence,endpoint_carrier,formulation_carrier,anchor_evidence,notes,raw_labels
paper_5878fa191e8b,10.1016/j.rinphs.2012.10.001,Regenerated keratin membrane to match the in vitro drug diffusion through human epidermis.,figure,0.81,figure,table_text,"[{'field_name': 'device', 'modality': 'text', 'locator': 'Methods section', 'page': None, 'bbox': None, 'snippet': 'Methods section', 'source_ref': '10.1016/j.rinphs.2012.10.001', 'confidence': 0.7}, {'field_name': 'endpoint', 'modality': 'figure', 'locator': 'Results section', 'page': None, 'bbox': None, 'snippet': 'Figure X shows the diffusion profile of the drug.', 'source_ref': '10.1016/j.rinphs.2012.10.001', 'confidence': 0.8}, {'field_name': 'formulation', 'modality': 'table', 'locator': 'table_text', 'page': None, 'bbox': None, 'snippet': 'Table 1 outlines the formulation details used in the experiments.', 'source_ref': '10.1016/j.rinphs.2012.10.001', 'confidence': 0.7}]",Focus on the keratin membrane and its impact on drug diffusion.,"{'paper_type': 'primary_experiment', 'mentions_ibuprofen': 'no', 'mentions_diffusion_cell': 'yes', 'franz_confirmed': 'yes', 'where_diffusion_cell': 'Methods section', 'where_franz': 'Methods section', 'study_type': 'IVPT', 'barrier_category': 'skin', 'barrier_name_raw': 'human epidermis', 'endpoint_found': 'yes', 'endpoint_time_found': 'uncertain', 'where_endpoint': 'Results section', 'endpoint_carrier': 'figure', 'endpoint_carrier_snippet': 'Figure X shows the diffusion profile of the drug.', 'formulation_carrier': 'table_text', 'formulation_carrier_snippet': 'Table 1 outlines the formulation details used in the experiments.', 'endpoint_likely_in_supp': 'no', 'formulation_table_missing': 'no', 'notes': 'Focus on the keratin membrane and its impact on drug diffusion.', 'router_source_backend': 'pdf_local', 'router_source_ref': 'papers\\pdf\\10.1016_j.rinphs.2012.10.001__cde6758302.pdf', 'router_source_diagnostics': ['blocked:html_remote:captcha'], 'router_heuristic_signals': {}}"
paper_a417a812a8fa,10.1016/j.scitotenv.2023.169863,"Occurrence and fate of CECs (OMPs, ARGs and pathogens) during decentralised treatment of black water and grey water.",unresolved,0.0,unknown,unknown,[],missing_structured_and_pdf_router_source,"{'title': 'Occurrence and fate of CECs (OMPs, ARGs and pathogens) during decentralised treatment of black water and grey water.', 'router_source_backend': 'missing', 'router_source_ref': '', 'router_source_diagnostics': []}"
paper_0656564e784f,10.1016/j.watres.2006.01.038,Nanofiltration for the separation of pharmaceuticals from nutrients in source-separated urine.,unresolved,0.0,unknown,unknown,[],missing_structured_and_pdf_router_source,"{'title': 'Nanofiltration for the separation of pharmaceuticals from nutrients in source-separated urine.', 'router_source_backend': 'missing', 'router_source_ref': '', 'router_source_diagnostics': []}"
paper_fb685e06f9fe,10.1016/j.xphs.2018.10.054,Comparison of the Effect of Bioadhesive Polymers on Stability and Drug Release Kinetics of Biocompatible Hydrogels for Topical Application of Ibuprofen.,unresolved,0.0,unknown,unknown,[],missing_structured_and_pdf_router_source,"{'title': 'Comparison of the Effect of Bioadhesive Polymers on Stability and Drug Release Kinetics of Biocompatible Hydrogels for Topical Application of Ibuprofen.', 'router_source_backend': 'missing', 'router_source_ref': '', 'router_source_diagnostics': []}"
paper_0f55d90b5670,10.1016/j.xphs.2025.103796,Novel surfactant-based elastic vesicular system as a promising approach for the topical delivery of Ibuprofen for enhanced wound healing.,unresolved,0.0,unknown,unknown,[],missing_structured_and_pdf_router_source,"{'title': 'Novel surfactant-based elastic vesicular system as a promising approach for the topical delivery of Ibuprofen for enhanced wound healing.', 'router_source_backend': 'missing', 'router_source_ref': '', 'router_source_diagnostics': []}"
paper_7f382c45ab85,10.1016/j.xphs.2025.103837,Validating Otto: a Franz diffusion cell autosampler to automate in vitro permeation studies.,unresolved,0.0,unknown,unknown,[],missing_structured_and_pdf_router_source,"{'title': 'Validating Otto: a Franz diffusion cell autosampler to automate in vitro permeation studies.', 'router_source_backend': 'missing', 'router_source_ref': '', 'router_source_diagnostics': []}"
paper_87a0dfd2232e,10.1016/s0002-9343(84)80028-5,Promotion of vascular patency in dermal burns with ibuprofen.,unresolved,0.0,unknown,unknown,[],missing_structured_and_pdf_router_source,"{'title': 'Promotion of vascular patency in dermal burns with ibuprofen.', 'router_source_backend': 'missing', 'router_source_ref': '', 'router_source_diagnostics': []}"
paper_c18c29e9bab6,10.1016/s0006-3495(03)74603-7,"Lateral diffusion rates of lipid, water, and a hydrophobic drug in a multilamellar liposome.",unresolved,0.0,unknown,unknown,[],,"{'paper_type': 'uncertain', 'mentions_ibuprofen': 'no', 'mentions_diffusion_cell': 'no', 'franz_confirmed': 'no', 'where_diffusion_cell': '', 'where_franz': '', 'study_type': 'uncertain', 'barrier_category': 'uncertain', 'barrier_name_raw': '', 'endpoint_found': 'no', 'endpoint_time_found': 'no', 'where_endpoint': '', 'endpoint_carrier': 'unknown', 'endpoint_carrier_snippet': '', 'formulation_carrier': 'unknown', 'formulation_carrier_snippet': '', 'endpoint_likely_in_supp': 'uncertain', 'formulation_table_missing': 'uncertain', 'notes': '', 'router_source_backend': 'pdf_local', 'router_source_ref': 'papers\\pdf\\10.1016_s0006-3495_03_74603-7__336244aa13.pdf', 'router_source_diagnostics': ['blocked:html_remote:captcha'], 'router_heuristic_signals': {'table_hits': 0, 'figure_hits': 0, 'endpoint_hits': 0, 'formulation_hits': 0}}"
paper_f997539c28ba,10.1016/s0021-9673(99)00995-4,Determination by high-performance liquid chromatography of ketoprofen in vitro in rat skin permeation samples.,unresolved,0.0,unknown,unknown,[],missing_structured_and_pdf_router_source,"{'title': 'Determination by high-performance liquid chromatography of ketoprofen in vitro in rat skin permeation samples.', 'router_source_backend': 'missing', 'router_source_ref': '', 'router_source_diagnostics': []}"
paper_5b6a63b3c55d,10.1016/s0022-3549(15)00172-0,Investigation of the Efficacy of Transdermal Penetration Enhancers Through the Use of Human Skin and a Skin Mimic Artificial Membrane.,unresolved,0.0,unknown,unknown,[],missing_structured_and_pdf_router_source,"{'title': 'Investigation of the Efficacy of Transdermal Penetration Enhancers Through the Use of Human Skin and a Skin Mimic Artificial Membrane.', 'router_source_backend': 'missing', 'router_source_ref': '', 'router_source_diagnostics': []}"
paper_cfbf927e61be,10.1016/s0090-6980(00)00089-7,Topical application of a selective cyclooxygenase inhibitor suppresses UVB mediated cutaneous inflammation.,unresolved,0.0,unknown,unknown,[],missing_structured_and_pdf_router_source,"{'title': 'Topical application of a selective cyclooxygenase inhibitor suppresses UVB mediated cutaneous inflammation.', 'router_source_backend': 'missing', 'router_source_ref': '', 'router_source_diagnostics': []}"
paper_f295c867735c,10.1016/s0168-3659(00)00230-3,"Rheological, mechanical and membrane penetration properties of novel dual drug systems for percutaneous delivery.",unresolved,0.0,unknown,unknown,[],missing_structured_and_pdf_router_source,"{'title': 'Rheological, mechanical and membrane penetration properties of novel dual drug systems for percutaneous delivery.', 'router_source_backend': 'missing', 'router_source_ref': '', 'router_source_diagnostics': []}"
paper_c97903f097e0,10.1016/s0168-3659(97)00153-3,"Transdermal delivery from eutectic systems: enhanced permeation of a model drug, ibuprofen.",unresolved,0.0,unknown,unknown,[],missing_structured_and_pdf_router_source,"{'title': 'Transdermal delivery from eutectic systems: enhanced permeation of a model drug, ibuprofen.', 'router_source_backend': 'missing', 'router_source_ref': '', 'router_source_diagnostics': []}"
paper_fab15b13f62d,10.1016/s0168-3659(98)00080-7,Ibuprofen release kinetics from controlled-release tablets granulated with aqueous polymeric dispersion of ethylcellulose II: influence of several parameters and coexcipients.,unresolved,0.0,unknown,unknown,[],missing_structured_and_pdf_router_source,"{'title': 'Ibuprofen release kinetics from controlled-release tablets granulated with aqueous polymeric dispersion of ethylcellulose II: influence of several parameters and coexcipients.', 'router_source_backend': 'missing', 'router_source_ref': '', 'router_source_diagnostics': []}"
paper_14da2c5a2845,10.1016/s0304-3959(02)00322-6,Spinal nerve injury activates prostaglandin synthesis in the spinal cord that contributes to early maintenance of tactile allodynia.,unresolved,0.0,unknown,unknown,[],missing_structured_and_pdf_router_source,"{'title': 'Spinal nerve injury activates prostaglandin synthesis in the spinal cord that contributes to early maintenance of tactile allodynia.', 'router_source_backend': 'missing', 'router_source_ref': '', 'router_source_diagnostics': []}"
paper_3b0d4af30b29,10.1016/s0378-5173(00)00346-x,Membrane penetration enhancement of ibuprofen using supersaturation.,unresolved,0.0,unknown,unknown,[],missing_structured_and_pdf_router_source,"{'title': 'Membrane penetration enhancement of ibuprofen using supersaturation.', 'router_source_backend': 'missing', 'router_source_ref': '', 'router_source_diagnostics': []}"
paper_1cca23a206fc,10.1016/s0378-5173(00)00402-6,"pH, pK(a) and dermal delivery.",unresolved,0.0,unknown,unknown,[],missing_structured_and_pdf_router_source,"{'title': 'pH, pK(a) and dermal delivery.', 'router_source_backend': 'missing', 'router_source_ref': '', 'router_source_diagnostics': []}"
paper_e8fc6fc224c0,10.1016/s0378-5173(00)00559-7,Enhancing effect of polyoxyethylene alkyl ethers on the skin permeation of ibuprofen.,unresolved,0.0,unknown,unknown,[],missing_structured_and_pdf_router_source,"{'title': 'Enhancing effect of polyoxyethylene alkyl ethers on the skin permeation of ibuprofen.', 'router_source_backend': 'missing', 'router_source_ref': '', 'router_source_diagnostics': []}"
paper_40fe3bee67de,10.1016/s0378-5173(00)00603-7,Penetration enhancement of ibuprofen from supersaturated solutions through human skin.,unresolved,0.0,unknown,unknown,[],missing_structured_and_pdf_router_source,"{'title': 'Penetration enhancement of ibuprofen from supersaturated solutions through human skin.', 'router_source_backend': 'missing', 'router_source_ref': '', 'router_source_diagnostics': []}"
paper_1a1018f78d2e,10.1016/s0378-5173(01)00758-x,An in vitro investigation into the effect of glycosaminoglycans on the skin partitioning and deposition of NSAIDs.,unresolved,0.0,unknown,unknown,[],missing_structured_and_pdf_router_source,"{'title': 'An in vitro investigation into the effect of glycosaminoglycans on the skin partitioning and deposition of NSAIDs.', 'router_source_backend': 'missing', 'router_source_ref': '', 'router_source_diagnostics': []}"
paper_d3e80ed36aef,10.1016/s0378-5173(03)00297-7,The in vitro delivery of NSAIDs across skin was in proportion to the delivery of essential fatty acids in the vehicle--evidence that solutes permeate skin associated with their solvation cages?,unresolved,0.0,unknown,unknown,[],missing_structured_and_pdf_router_source,"{'title': 'The in vitro delivery of NSAIDs across skin was in proportion to the delivery of essential fatty acids in the vehicle--evidence that solutes permeate skin associated with their solvation cages?', 'router_source_backend': 'missing', 'router_source_ref': '', 'router_source_diagnostics': []}"
paper_c60195f01956,10.1016/s0378-5173(03)00382-x,Post-iontophoresis transport of ibuprofen lysine across rabbit ear skin.,unresolved,0.0,unknown,unknown,[],missing_structured_and_pdf_router_source,"{'title': 'Post-iontophoresis transport of ibuprofen lysine across rabbit ear skin.', 'router_source_backend': 'missing', 'router_source_ref': '', 'router_source_diagnostics': []}"
paper_1f5aa8d1c633,10.1016/s0883-9441(86)80012-0,Reduction of polymorphonuclear leukocyte accumulations by inhibition of cyclooxygenase and thromboxane syntase in the rabbit.,unresolved,0.0,unknown,unknown,[],missing_structured_and_pdf_router_source,"{'title': 'Reduction of polymorphonuclear leukocyte accumulations by inhibition of cyclooxygenase and thromboxane syntase in the rabbit.', 'router_source_backend': 'missing', 'router_source_ref': '', 'router_source_diagnostics': []}"
paper_cc1bce1cf65e,10.1016/s0939-6411(98)00023-x,Transformation of a liposomal dispersion containing ibuprofen lysinate and phospholipids into mixed micelles - physico-chemical characterization and influence on drug permeation through excised human stratum corneum.,unresolved,0.0,unknown,unknown,[],missing_structured_and_pdf_router_source,"{'title': 'Transformation of a liposomal dispersion containing ibuprofen lysinate and phospholipids into mixed micelles - physico-chemical characterization and influence on drug permeation through excised human stratum corneum.', 'router_source_backend': 'missing', 'router_source_ref': '', 'router_source_diagnostics': []}"
paper_443054768964,10.1016/s0939-6411(98)00028-9,Comparative investigations to evaluate the use of organotypic cultures of transformed and native dermal and epidermal cells for permeation studies.,unresolved,0.0,unknown,unknown,[],missing_structured_and_pdf_router_source,"{'title': 'Comparative investigations to evaluate the use of organotypic cultures of transformed and native dermal and epidermal cells for permeation studies.', 'router_source_backend': 'missing', 'router_source_ref': '', 'router_source_diagnostics': []}"
paper_26f4de3de153,10.1021/ac9811930,Enhanced Microdialysis Extraction Efficiency of Ibuprofen in Vitro by Facilitated Transport with β-Cyclodextrin.,unresolved,0.0,unknown,unknown,[],missing_structured_and_pdf_router_source,"{'title': 'Enhanced Microdialysis Extraction Efficiency of Ibuprofen in Vitro by Facilitated Transport with β-Cyclodextrin.', 'router_source_backend': 'missing', 'router_source_ref': '', 'router_source_diagnostics': []}"
paper_8213cbbee979,10.1021/acs.est.0c06803,Effect of Water pH on the Uptake of Acidic (Ibuprofen) and Basic (Propranolol) Drugs in a Fish Gill Cell Culture Model.,unresolved,0.0,unknown,unknown,[],missing_structured_and_pdf_router_source,"{'title': 'Effect of Water pH on the Uptake of Acidic (Ibuprofen) and Basic (Propranolol) Drugs in a Fish Gill Cell Culture Model.', 'router_source_backend': 'missing', 'router_source_ref': '', 'router_source_diagnostics': []}"
paper_fdd794763c2b,10.1021/acs.inorgchem.0c03550,Anchoring Drugs to a Zinc(II) Coordination Polymer Network: Exploiting Structural Rationale toward the Design of Metallogels for Drug-Delivery Applications.,unresolved,0.0,unknown,unknown,[],missing_structured_and_pdf_router_source,"{'title': 'Anchoring Drugs to a Zinc(II) Coordination Polymer Network: Exploiting Structural Rationale toward the Design of Metallogels for Drug-Delivery Applications.', 'router_source_backend': 'missing', 'router_source_ref': '', 'router_source_diagnostics': []}"
paper_a68fe35d8f88,10.1021/acs.jpcb.4c00929,Pluronic P123/DMSO Lyotropic Liquid Crystal for Incorporating Bioactive Substances for Topical Application.,unresolved,0.0,unknown,unknown,[],missing_structured_and_pdf_router_source,"{'title': 'Pluronic P123/DMSO Lyotropic Liquid Crystal for Incorporating Bioactive Substances for Topical Application.', 'router_source_backend': 'missing', 'router_source_ref': '', 'router_source_diagnostics': []}"
paper_e8a69f60c5e3,10.1021/acs.langmuir.2c01148,New Insights into High-Performance Nanocomposite Membranes with Threefold-Imprinted Layers for Selective Recognition and Separation.,unresolved,0.0,unknown,unknown,[],missing_structured_and_pdf_router_source,"{'title': 'New Insights into High-Performance Nanocomposite Membranes with Threefold-Imprinted Layers for Selective Recognition and Separation.', 'router_source_backend': 'missing', 'router_source_ref': '', 'router_source_diagnostics': []}"
paper_57371a22bd0a,10.1021/acs.langmuir.2c02497,pH-Responsive Metal-Organic Framework Thin Film for Drug Delivery.,unresolved,0.0,unknown,unknown,[],No relevant evidence extractable from the document.,"{'paper_type': 'other', 'mentions_ibuprofen': 'no', 'mentions_diffusion_cell': 'no', 'franz_confirmed': 'no', 'where_diffusion_cell': '', 'where_franz': '', 'study_type': 'uncertain', 'barrier_category': 'uncertain', 'barrier_name_raw': '', 'endpoint_found': 'no', 'endpoint_time_found': 'no', 'where_endpoint': '', 'endpoint_carrier': 'unknown', 'endpoint_carrier_snippet': '', 'formulation_carrier': 'unknown', 'formulation_carrier_snippet': '', 'endpoint_likely_in_supp': 'uncertain', 'formulation_table_missing': 'uncertain', 'notes': 'No relevant evidence extractable from the document.', 'router_source_backend': 'pdf_local', 'router_source_ref': 'papers\\pdf\\10.1021_acs.langmuir.2c02497__63d31876fc.pdf', 'router_source_diagnostics': ['blocked:html_remote:captcha'], 'router_heuristic_signals': {'table_hits': 0, 'figure_hits': 0, 'endpoint_hits': 0, 'formulation_hits': 0}}"
paper_693ab859bc2c,10.1021/acs.langmuir.3c02748,Multifunctional Deep Eutectic Solvent-Based Microemulsion for Transdermal Delivery of Artemisinin.,unresolved,0.0,unknown,unknown,[],missing_structured_and_pdf_router_source,"{'title': 'Multifunctional Deep Eutectic Solvent-Based Microemulsion for Transdermal Delivery of Artemisinin.', 'router_source_backend': 'missing', 'router_source_ref': '', 'router_source_diagnostics': []}"
paper_2810c372d939,10.1021/acs.langmuir.9b01028,Microcavity-Supported Lipid Bilayers; Evaluation of Drug-Lipid Membrane Interactions by Electrochemical Impedance and Fluorescence Correlation Spectroscopy.,unresolved,0.0,unknown,unknown,[],missing_structured_and_pdf_router_source,"{'title': 'Microcavity-Supported Lipid Bilayers; Evaluation of Drug-Lipid Membrane Interactions by Electrochemical Impedance and Fluorescence Correlation Spectroscopy.', 'router_source_backend': 'missing', 'router_source_ref': '', 'router_source_diagnostics': []}"
paper_ab30082c93b2,10.1021/acs.molpharmaceut.0c00515,Poly(caprolactone)-Based Coatings on 3D-Printed Biodegradable Implants: A Novel Strategy to Prolong Delivery of Hydrophilic Drugs.,unresolved,0.2,unknown,unknown,"[{'field_name': 'device', 'modality': 'text', 'locator': 'unknown', 'page': None, 'bbox': None, 'snippet': 'unknown', 'source_ref': '10.1021/acs.molpharmaceut.0c00515', 'confidence': 0.7}, {'field_name': 'endpoint', 'modality': 'metadata', 'locator': 'unknown', 'page': None, 'bbox': None, 'snippet': 'unknown', 'source_ref': '10.1021/acs.molpharmaceut.0c00515', 'confidence': 0.8}, {'field_name': 'formulation', 'modality': 'metadata', 'locator': 'unknown', 'page': None, 'bbox': None, 'snippet': 'unknown', 'source_ref': '10.1021/acs.molpharmaceut.0c00515', 'confidence': 0.7}]",The document does not seem to discuss ibuprofen or diffusion cells based on the provided content.,"{'paper_type': 'other', 'mentions_ibuprofen': 'no', 'mentions_diffusion_cell': 'no', 'franz_confirmed': 'no', 'where_diffusion_cell': 'unknown', 'where_franz': 'unknown', 'study_type': 'uncertain', 'barrier_category': 'uncertain', 'barrier_name_raw': 'unknown', 'endpoint_found': 'no', 'endpoint_time_found': 'no', 'where_endpoint': 'unknown', 'endpoint_carrier': 'unknown', 'endpoint_carrier_snippet': 'unknown', 'formulation_carrier': 'unknown', 'formulation_carrier_snippet': 'unknown', 'endpoint_likely_in_supp': 'no', 'formulation_table_missing': 'uncertain', 'notes': 'The document does not seem to discuss ibuprofen or diffusion cells based on the provided content.', 'router_source_backend': 'pdf_local', 'router_source_ref': 'papers\\pdf\\10.1021_acs.molpharmaceut.0c00515__6ba78701dd.pdf', 'router_source_diagnostics': ['blocked:html_remote:captcha'], 'router_heuristic_signals': {'table_hits': 0, 'figure_hits': 0, 'endpoint_hits': 0, 'formulation_hits': 0}}"
paper_4cd65bde6fb4,10.1021/acs.molpharmaceut.0c00720,Controlling Supramolecular Structures of Drugs by Light.,figure,0.81,figure,narrative,"[{'field_name': 'device', 'modality': 'text', 'locator': 'Section on Permeability of ion-pairs through membranes', 'page': None, 'bbox': None, 'snippet': 'Section on Permeability of ion-pairs through membranes', 'source_ref': '10.1021/acs.molpharmaceut.0c00720', 'confidence': 0.7}, {'field_name': 'endpoint', 'modality': 'figure', 'locator': 'Section on Permeability of ion-pairs through membranes', 'page': None, 'bbox': None, 'snippet': 'Figure 4 shows permeability results for the P+-Ibuprofen ion-pairs through membranes.', 'source_ref': '10.1021/acs.molpharmaceut.0c00720', 'confidence': 0.8}, {'field_name': 'formulation', 'modality': 'text', 'locator': 'narrative', 'page': None, 'bbox': None, 'snippet': 'The paper discusses the synthesis of Ibuprofen ion-pairs within the context of light-responsive systems.', 'source_ref': '10.1021/acs.molpharmaceut.0c00720', 'confidence': 0.7}]","The study emphasizes light control of drug behavior, particularly regarding the ion-pairing of Ibuprofen.","{'paper_type': 'primary_experiment', 'mentions_ibuprofen': 'yes', 'mentions_diffusion_cell': 'yes', 'franz_confirmed': 'yes', 'where_diffusion_cell': 'Section on Permeability of ion-pairs through membranes', 'where_franz': 'Section on Permeability of ion-pairs through membranes', 'study_type': 'IVPT', 'barrier_category': 'skin', 'barrier_name_raw': 'Strat-M® membranes', 'endpoint_found': 'yes', 'endpoint_time_found': 'yes', 'where_endpoint': 'Section on Permeability of ion-pairs through membranes', 'endpoint_carrier': 'figure', 'endpoint_carrier_snippet': 'Figure 4 shows permeability results for the P+-Ibuprofen ion-pairs through membranes.', 'formulation_carrier': 'narrative', 'formulation_carrier_snippet': 'The paper discusses the synthesis of Ibuprofen ion-pairs within the context of light-responsive systems.', 'endpoint_likely_in_supp': 'no', 'formulation_table_missing': 'no', 'notes': 'The study emphasizes light control of drug behavior, particularly regarding the ion-pairing of Ibuprofen.', 'router_source_backend': 'pdf_local', 'router_source_ref': 'papers\\pdf\\10.1021_acs.molpharmaceut.0c00720__d814df522c.pdf', 'router_source_diagnostics': [], 'router_heuristic_signals': {}}"
paper_320ca28dae93,10.1021/acs.molpharmaceut.1c00988,Elucidating the Impact of Surfactants on the Performance of Dissolving Microneedle Array Patches.,mixed,0.81,table_text,narrative,"[{'field_name': 'device', 'modality': 'text', 'locator': 'MATERIALS AND METHODS section', 'page': None, 'bbox': None, 'snippet': 'MATERIALS AND METHODS section', 'source_ref': '10.1021/acs.molpharmaceut.1c00988', 'confidence': 0.7}, {'field_name': 'endpoint', 'modality': 'table', 'locator': 'RESULTS section', 'page': None, 'bbox': None, 'snippet': 'Refer to Table 2 for details on endpoint measurements.', 'source_ref': '10.1021/acs.molpharmaceut.1c00988', 'confidence': 0.8}, {'field_name': 'formulation', 'modality': 'text', 'locator': 'narrative', 'page': None, 'bbox': None, 'snippet': 'Formulations were described in the METHODS section.', 'source_ref': '10.1021/acs.molpharmaceut.1c00988', 'confidence': 0.7}]",The study explores the performance of microneedle patches; refers to diffusion but ambiguous about Franz cell.,"{'paper_type': 'primary_experiment', 'mentions_ibuprofen': 'no', 'mentions_diffusion_cell': 'yes', 'franz_confirmed': 'uncertain', 'where_diffusion_cell': 'MATERIALS AND METHODS section', 'where_franz': 'MATERIALS AND METHODS section', 'study_type': 'IVPT', 'barrier_category': 'skin', 'barrier_name_raw': 'microneedles', 'endpoint_found': 'yes', 'endpoint_time_found': 'uncertain', 'where_endpoint': 'RESULTS section', 'endpoint_carrier': 'table_text', 'endpoint_carrier_snippet': 'Refer to Table 2 for details on endpoint measurements.', 'formulation_carrier': 'narrative', 'formulation_carrier_snippet': 'Formulations were described in the METHODS section.', 'endpoint_likely_in_supp': 'no', 'formulation_table_missing': 'no', 'notes': 'The study explores the performance of microneedle patches; refers to diffusion but ambiguous about Franz cell.', 'router_source_backend': 'pdf_local', 'router_source_ref': 'papers\\pdf\\10.1021_acs.molpharmaceut.1c00988__204ff0121a.pdf', 'router_source_diagnostics': ['blocked:html_remote:captcha'], 'router_heuristic_signals': {}}"
paper_36136cbbf214,10.1021/acs.molpharmaceut.5b00807,Hydrogel-Forming Microneedle Arrays Made from Light-Responsive Materials for On-Demand Transdermal Drug Delivery.,unresolved,0.0,unknown,unknown,[],missing_structured_and_pdf_router_source,"{'title': 'Hydrogel-Forming Microneedle Arrays Made from Light-Responsive Materials for On-Demand Transdermal Drug Delivery.', 'router_source_backend': 'missing', 'router_source_ref': '', 'router_source_diagnostics': []}"
paper_f904fae1c55a,10.1021/acs.molpharmaceut.6b00530,Inflammation Caused by Nanosized Delivery Systems: Is There a Benefit?,unresolved,0.0,unknown,unknown,[],missing_structured_and_pdf_router_source,"{'title': 'Inflammation Caused by Nanosized Delivery Systems: Is There a Benefit?', 'router_source_backend': 'missing', 'router_source_ref': '', 'router_source_diagnostics': []}"
paper_1829b9333048,10.1021/acs.molpharmaceut.8b01027,Monitoring Drug Crystallization in Percutaneous Penetration Using Localized Nanothermal Analysis and Photothermal Microspectroscopy.,unresolved,0.0,unknown,unknown,[],missing_structured_and_pdf_router_source,"{'title': 'Monitoring Drug Crystallization in Percutaneous Penetration Using Localized Nanothermal Analysis and Photothermal Microspectroscopy.', 'router_source_backend': 'missing', 'router_source_ref': '', 'router_source_diagnostics': []}"
