paper_id,doi,title,route,route_confidence,endpoint_carrier,formulation_carrier,anchor_evidence,notes,raw_labels
paper_11e623a37e87,nan,Subcellular actions of non-steroidal anti-inflammatory drugs : lysosome and prostaglandin studies,unresolved,0.0,unknown,unknown,[],missing_structured_and_pdf_router_source,"{'title': 'Subcellular actions of non-steroidal anti-inflammatory drugs : lysosome and prostaglandin studies', 'router_source_backend': 'missing', 'router_source_ref': '', 'router_source_diagnostics': []}"
paper_3978d47b3a2c,10.1002/(sici)1520-636x(1997)9:3<313::aid-chir19>3.0.co;2-q,Topical administration of racemic ibuprofen.,unresolved,0.0,unknown,unknown,[],missing_structured_and_pdf_router_source,"{'title': 'Topical administration of racemic ibuprofen.', 'router_source_backend': 'missing', 'router_source_ref': '', 'router_source_diagnostics': []}"
paper_6d7ce6948405,10.1002/14651858.cd001177.pub2,Topical agents or dressings for pain in venous leg ulcers.,table,0.69,table_text,table_text,"[{'field_name': 'endpoint', 'modality': 'table', 'locator': 'Results section', 'page': None, 'bbox': None, 'snippet': 'Analysis 2.1. Comparison 2 Ibuprofen foam dressing compared with foam dressing alone, Outcome 1 Number participants experiencing pain relief on the ﬁrst evening of treatment.', 'source_ref': '10.1002/14651858.cd001177.pub2', 'confidence': 0.8}, {'field_name': 'formulation', 'modality': 'table', 'locator': 'table_text', 'page': None, 'bbox': None, 'snippet': 'Analysis 2: Ibuprofen foam dressing compared with...', 'source_ref': '10.1002/14651858.cd001177.pub2', 'confidence': 0.7}]",The paper examines the efficacy of ibuprofen dressings.,"{'paper_type': 'primary_experiment', 'mentions_ibuprofen': 'yes', 'mentions_diffusion_cell': 'no', 'franz_confirmed': 'no', 'where_diffusion_cell': '', 'where_franz': '', 'study_type': 'IVRT', 'barrier_category': 'skin', 'barrier_name_raw': 'venous leg ulcers', 'endpoint_found': 'yes', 'endpoint_time_found': 'yes', 'where_endpoint': 'Results section', 'endpoint_carrier': 'table_text', 'endpoint_carrier_snippet': 'Analysis 2.1. Comparison 2 Ibuprofen foam dressing compared with foam dressing alone, Outcome 1 Number participants experiencing pain relief on the ﬁrst evening of treatment.', 'formulation_carrier': 'table_text', 'formulation_carrier_snippet': 'Analysis 2: Ibuprofen foam dressing compared with...', 'endpoint_likely_in_supp': 'no', 'formulation_table_missing': 'no', 'notes': 'The paper examines the efficacy of ibuprofen dressings.', 'router_source_backend': 'pdf_local', 'router_source_ref': 'papers\\pdf\\10.1002_14651858.cd001177.pub2__f1d6f61f65.pdf', 'router_source_diagnostics': [], 'router_heuristic_signals': {}}"
paper_92afc39ccd63,10.1002/14651858.cd001177.pub3,Topical agents or dressings for pain in venous leg ulcers.,unresolved,0.0,unknown,unknown,[],Document does not provide evidence related to ibuprofen or diffusion cells.,"{'paper_type': 'other', 'mentions_ibuprofen': 'no', 'mentions_diffusion_cell': 'no', 'franz_confirmed': 'no', 'where_diffusion_cell': '', 'where_franz': '', 'study_type': 'uncertain', 'barrier_category': 'uncertain', 'barrier_name_raw': '', 'endpoint_found': 'no', 'endpoint_time_found': 'no', 'where_endpoint': '', 'endpoint_carrier': 'unknown', 'endpoint_carrier_snippet': '', 'formulation_carrier': 'unknown', 'formulation_carrier_snippet': '', 'endpoint_likely_in_supp': 'no', 'formulation_table_missing': 'no', 'notes': 'Document does not provide evidence related to ibuprofen or diffusion cells.', 'router_source_backend': 'pdf_local', 'router_source_ref': 'papers\\pdf\\10.1002_14651858.cd001177.pub3__a6c5e430fc.pdf', 'router_source_diagnostics': ['blocked:html_remote:captcha'], 'router_heuristic_signals': {'table_hits': 0, 'figure_hits': 0, 'endpoint_hits': 0, 'formulation_hits': 0}}"
paper_244198a8d171,10.1002/adhm.201600591,Magnetically Controlled Drug Release System through Magnetomechanical Actuation.,unresolved,0.0,unknown,unknown,[],missing_structured_and_pdf_router_source,"{'title': 'Magnetically Controlled Drug Release System through Magnetomechanical Actuation.', 'router_source_backend': 'missing', 'router_source_ref': '', 'router_source_diagnostics': []}"
paper_b0c15dc016b9,10.1002/advs.202510976,Nanogel Integrated Zwitterionic Injectable Hydrogel with Sequential Drug-Releasing Capability for the Programmable Repair of Spinal Cord Injury.,unresolved,0.0,unknown,unknown,[],,"{'paper_type': 'other', 'mentions_ibuprofen': 'no', 'mentions_diffusion_cell': 'no', 'franz_confirmed': 'no', 'where_diffusion_cell': '', 'where_franz': '', 'study_type': 'uncertain', 'barrier_category': 'uncertain', 'barrier_name_raw': '', 'endpoint_found': 'no', 'endpoint_time_found': 'no', 'where_endpoint': '', 'endpoint_carrier': 'unknown', 'endpoint_carrier_snippet': '', 'formulation_carrier': 'unknown', 'formulation_carrier_snippet': '', 'endpoint_likely_in_supp': 'no', 'formulation_table_missing': 'uncertain', 'notes': '', 'router_source_backend': 'pdf_local', 'router_source_ref': 'papers\\pdf\\10.1002_advs.202510976__9e81eb0534.pdf', 'router_source_diagnostics': ['blocked:html_remote:captcha'], 'router_heuristic_signals': {'table_hits': 0, 'figure_hits': 0, 'endpoint_hits': 0, 'formulation_hits': 0}}"
paper_e35b9fb3e6b5,10.1002/ams2.457,A rare case of Reye's syndrome induced by influenza A virus with use of ibuprofen in an adult.,unresolved,0.0,unknown,unknown,[],missing_structured_and_pdf_router_source:blocked:html_remote:captcha,"{'title': ""A rare case of Reye's syndrome induced by influenza A virus with use of ibuprofen in an adult."", 'router_source_backend': 'missing', 'router_source_ref': '', 'router_source_diagnostics': ['blocked:html_remote:captcha']}"
paper_fd72d2eca67a,10.1002/ardp.201300279,Synthesis and evaluation of 2-(2-arylmorpholino)ethyl esters of ibuprofen hydrochlorides as COX-2 and serotonin reuptake inhibitors.,unresolved,0.0,unknown,unknown,[],missing_structured_and_pdf_router_source,"{'title': 'Synthesis and evaluation of 2-(2-arylmorpholino)ethyl esters of ibuprofen hydrochlorides as COX-2 and serotonin reuptake inhibitors.', 'router_source_backend': 'missing', 'router_source_ref': '', 'router_source_diagnostics': []}"
paper_5bf9e3e37e6c,10.1002/bdd.631,Skin disposition of menthol after its application in the presence of drug substances.,unresolved,0.0,unknown,unknown,[],missing_structured_and_pdf_router_source,"{'title': 'Skin disposition of menthol after its application in the presence of drug substances.', 'router_source_backend': 'missing', 'router_source_ref': '', 'router_source_diagnostics': []}"
paper_69ea1a42d71b,10.1002/bmc.1365,Enantiomeric separation of 2-arylpropionic acid nonsteroidal anti-inflammatory drugs by HPLC with hydroxypropyl-beta-cyclodextrin as chiral mobile phase additive.,unresolved,0.0,unknown,unknown,[],missing_structured_and_pdf_router_source,"{'title': 'Enantiomeric separation of 2-arylpropionic acid nonsteroidal anti-inflammatory drugs by HPLC with hydroxypropyl-beta-cyclodextrin as chiral mobile phase additive.', 'router_source_backend': 'missing', 'router_source_ref': '', 'router_source_diagnostics': []}"
paper_58f3f695a704,10.1002/chem.201600105,Supramolecular Gels by Design: Towards the Development of Topical Gels for Self-Delivery Application.,unresolved,0.0,unknown,unknown,[],missing_structured_and_pdf_router_source,"{'title': 'Supramolecular Gels by Design: Towards the Development of Topical Gels for Self-Delivery Application.', 'router_source_backend': 'missing', 'router_source_ref': '', 'router_source_diagnostics': []}"
paper_46aa27000d85,10.1002/cpdd.297,Analgesic Efficacy of a New Immediate-Release/Extended-Release Formulation of Ibuprofen: Results From Single- and Multiple-Dose Postsurgical Dental Pain Studies.,unresolved,0.0,unknown,unknown,[],,"{'paper_type': 'uncertain', 'mentions_ibuprofen': 'yes', 'mentions_diffusion_cell': 'no', 'franz_confirmed': 'no', 'where_diffusion_cell': '', 'where_franz': '', 'study_type': 'uncertain', 'barrier_category': 'uncertain', 'barrier_name_raw': '', 'endpoint_found': 'uncertain', 'endpoint_time_found': 'uncertain', 'where_endpoint': '', 'endpoint_carrier': 'unknown', 'endpoint_carrier_snippet': '', 'formulation_carrier': 'unknown', 'formulation_carrier_snippet': '', 'endpoint_likely_in_supp': 'uncertain', 'formulation_table_missing': 'uncertain', 'notes': '', 'router_source_backend': 'pdf_local', 'router_source_ref': 'papers\\pdf\\10.1002_cpdd.297__8614015a51.pdf', 'router_source_diagnostics': ['blocked:html_remote:captcha'], 'router_heuristic_signals': {'table_hits': 0, 'figure_hits': 0, 'endpoint_hits': 0, 'formulation_hits': 0}}"
paper_742b04792407,10.1002/elsc.201800046,Rosmarinic acid-loaded electrospun nanofibers: In vitro release kinetic study and bioactivity assessment.,unresolved,0.0,unknown,unknown,[],missing_structured_and_pdf_router_source:blocked:html_remote:captcha,"{'title': 'Rosmarinic acid-loaded electrospun nanofibers: In vitro release kinetic study and bioactivity assessment.', 'router_source_backend': 'missing', 'router_source_ref': '', 'router_source_diagnostics': ['blocked:html_remote:captcha']}"
paper_89ec992d2cac,10.1002/etc.4302,Effects of skin region and relative lipophilicity on percutaneous absorption in the toad Rhinella marina.,table,0.81,table_text,unknown,"[{'field_name': 'device', 'modality': 'text', 'locator': 'uncertain', 'page': None, 'bbox': None, 'snippet': 'uncertain', 'source_ref': '10.1002/etc.4302', 'confidence': 0.7}, {'field_name': 'endpoint', 'modality': 'table', 'locator': 'table', 'page': None, 'bbox': None, 'snippet': 'Table details percutaneous absorption rates for different lipophilicity conditions.', 'source_ref': '10.1002/etc.4302', 'confidence': 0.8}, {'field_name': 'formulation', 'modality': 'metadata', 'locator': 'unknown', 'page': None, 'bbox': None, 'snippet': 'none', 'source_ref': '10.1002/etc.4302', 'confidence': 0.7}]",Focuses on toad skin absorption; ibuprofen not mentioned.,"{'paper_type': 'primary_experiment', 'mentions_ibuprofen': 'no', 'mentions_diffusion_cell': 'no', 'franz_confirmed': 'no', 'where_diffusion_cell': 'uncertain', 'where_franz': 'uncertain', 'study_type': 'IVPT', 'barrier_category': 'skin', 'barrier_name_raw': 'toad skin', 'endpoint_found': 'yes', 'endpoint_time_found': 'uncertain', 'where_endpoint': 'table', 'endpoint_carrier': 'table_text', 'endpoint_carrier_snippet': 'Table details percutaneous absorption rates for different lipophilicity conditions.', 'formulation_carrier': 'unknown', 'formulation_carrier_snippet': 'none', 'endpoint_likely_in_supp': 'no', 'formulation_table_missing': 'no', 'notes': 'Focuses on toad skin absorption; ibuprofen not mentioned.', 'router_source_backend': 'pdf_local', 'router_source_ref': 'papers\\pdf\\10.1002_etc.4302__6928b548af.pdf', 'router_source_diagnostics': [], 'router_heuristic_signals': {}}"
paper_79890f9d9026,10.1002/jbm.a.34095,Polyaspartamide-polylactide electrospun scaffolds for potential topical release of Ibuprofen.,unresolved,0.0,unknown,unknown,[],missing_structured_and_pdf_router_source,"{'title': 'Polyaspartamide-polylactide electrospun scaffolds for potential topical release of Ibuprofen.', 'router_source_backend': 'missing', 'router_source_ref': '', 'router_source_diagnostics': []}"
paper_df3972501fd6,10.1002/jbm.a.34292,Modeling of drug release from biodegradable triple-layered microparticles.,unresolved,0.0,unknown,unknown,[],missing_structured_and_pdf_router_source,"{'title': 'Modeling of drug release from biodegradable triple-layered microparticles.', 'router_source_backend': 'missing', 'router_source_ref': '', 'router_source_diagnostics': []}"
paper_1e2fb1658151,10.1002/jmr.3089,"Synthesis, molecular dynamics simulation, and evaluation of biological activity of novel flurbiprofen and ibuprofen-like compounds.",unresolved,0.0,unknown,unknown,[],missing_structured_and_pdf_router_source,"{'title': 'Synthesis, molecular dynamics simulation, and evaluation of biological activity of novel flurbiprofen and ibuprofen-like compounds.', 'router_source_backend': 'missing', 'router_source_ref': '', 'router_source_diagnostics': []}"
paper_78ec4fb95c70,10.1002/jps.20623,Penetration of crystalline powder particles into excised human skin membranes and model gels from a supersonic powder injector.,unresolved,0.0,unknown,unknown,[],missing_structured_and_pdf_router_source,"{'title': 'Penetration of crystalline powder particles into excised human skin membranes and model gels from a supersonic powder injector.', 'router_source_backend': 'missing', 'router_source_ref': '', 'router_source_diagnostics': []}"
paper_e23ccfcf23e7,10.1002/jps.23548,"Influence of physicochemical properties on the in vitro skin permeation of the enantiomers, racemate, and eutectics of ibuprofen for enhanced transdermal drug delivery.",unresolved,0.0,unknown,unknown,[],missing_structured_and_pdf_router_source,"{'title': 'Influence of physicochemical properties on the in vitro skin permeation of the enantiomers, racemate, and eutectics of ibuprofen for enhanced transdermal drug delivery.', 'router_source_backend': 'missing', 'router_source_ref': '', 'router_source_diagnostics': []}"
paper_0ea81ef2fdf2,10.1002/jps.24052,Numerical modelling of transdermal delivery from matrix systems: parametric study and experimental validation with silicone matrices.,unresolved,0.0,unknown,unknown,[],missing_structured_and_pdf_router_source,"{'title': 'Numerical modelling of transdermal delivery from matrix systems: parametric study and experimental validation with silicone matrices.', 'router_source_backend': 'missing', 'router_source_ref': '', 'router_source_diagnostics': []}"
paper_18f9f1c31ac6,10.1002/jps.24556,Investigation of pH Influence on Skin Permeation Behavior of Weak Acids Using Nonsteroidal Anti-Inflammatory Drugs.,unresolved,0.0,unknown,unknown,[],missing_structured_and_pdf_router_source,"{'title': 'Investigation of pH Influence on Skin Permeation Behavior of Weak Acids Using Nonsteroidal Anti-Inflammatory Drugs.', 'router_source_backend': 'missing', 'router_source_ref': '', 'router_source_diagnostics': []}"
paper_561abc239285,10.1002/jps.2600841208,Transdermal delivery of drugs with differing lipophilicities using azone analogs as dermal penetration enhancers.,unresolved,0.0,unknown,unknown,[],missing_structured_and_pdf_router_source,"{'title': 'Transdermal delivery of drugs with differing lipophilicities using azone analogs as dermal penetration enhancers.', 'router_source_backend': 'missing', 'router_source_ref': '', 'router_source_diagnostics': []}"
paper_d264824515e7,10.1002/mabi.201900412,Stimuli Responsive Scaffolds Based on Carboxymethyl Starch and Poly(2-Dimethylaminoethyl Methacrylate) for Anti-Inflammatory Drug Delivery.,unresolved,0.0,unknown,unknown,[],missing_structured_and_pdf_router_source,"{'title': 'Stimuli Responsive Scaffolds Based on Carboxymethyl Starch and Poly(2-Dimethylaminoethyl Methacrylate) for Anti-Inflammatory Drug Delivery.', 'router_source_backend': 'missing', 'router_source_ref': '', 'router_source_diagnostics': []}"
paper_f259de4127b5,10.1002/mrc.1329,Multi-dimensional pulsed field gradient magic angle spinning NMR experiments on membranes.,unresolved,0.0,unknown,unknown,[],missing_structured_and_pdf_router_source,"{'title': 'Multi-dimensional pulsed field gradient magic angle spinning NMR experiments on membranes.', 'router_source_backend': 'missing', 'router_source_ref': '', 'router_source_diagnostics': []}"
paper_24932e7765c5,10.1002/open.202400206,New Ibuprofen Cystamine Salts With Improved Solubility and Anti-Inflammatory Effect.,unresolved,0.0,unknown,unknown,[],Additional document content needed for specific extraction details.,"{'paper_type': 'uncertain', 'mentions_ibuprofen': 'yes', 'mentions_diffusion_cell': 'no', 'franz_confirmed': 'no', 'where_diffusion_cell': '', 'where_franz': '', 'study_type': 'uncertain', 'barrier_category': 'uncertain', 'barrier_name_raw': '', 'endpoint_found': 'uncertain', 'endpoint_time_found': 'uncertain', 'where_endpoint': '', 'endpoint_carrier': 'unknown', 'endpoint_carrier_snippet': '', 'formulation_carrier': 'unknown', 'formulation_carrier_snippet': '', 'endpoint_likely_in_supp': 'no', 'formulation_table_missing': 'uncertain', 'notes': 'Additional document content needed for specific extraction details.', 'router_source_backend': 'pdf_local', 'router_source_ref': 'papers\\pdf\\10.1002_open.202400206__efc74ebbd7.pdf', 'router_source_diagnostics': ['blocked:html_remote:captcha'], 'router_heuristic_signals': {'table_hits': 0, 'figure_hits': 0, 'endpoint_hits': 0, 'formulation_hits': 0}}"
paper_18833a391396,10.1002/open.202500038,Ibuprofen-Functionalized Alkyl α-hydroxy Methacrylate-Based Polymers.,unresolved,0.0,unknown,unknown,[],,"{'paper_type': 'uncertain', 'mentions_ibuprofen': 'yes', 'mentions_diffusion_cell': 'no', 'franz_confirmed': 'no', 'where_diffusion_cell': '', 'where_franz': '', 'study_type': 'uncertain', 'barrier_category': 'uncertain', 'barrier_name_raw': '', 'endpoint_found': 'uncertain', 'endpoint_time_found': 'uncertain', 'where_endpoint': '', 'endpoint_carrier': 'unknown', 'endpoint_carrier_snippet': '', 'formulation_carrier': 'unknown', 'formulation_carrier_snippet': '', 'endpoint_likely_in_supp': 'uncertain', 'formulation_table_missing': 'uncertain', 'notes': '', 'router_source_backend': 'pdf_local', 'router_source_ref': 'papers\\pdf\\10.1002_open.202500038__ca478fccf0.pdf', 'router_source_diagnostics': ['blocked:html_remote:captcha'], 'router_heuristic_signals': {'table_hits': 0, 'figure_hits': 0, 'endpoint_hits': 0, 'formulation_hits': 0}}"
paper_0c17fa562b4d,10.1002/ptr.5080,Suppression of lipopolysaccharide-stimulated cytokine/chemokine production in skin cells by sandalwood oils and purified α-santalol and β-santalol.,unresolved,0.0,unknown,unknown,[],missing_structured_and_pdf_router_source,"{'title': 'Suppression of lipopolysaccharide-stimulated cytokine/chemokine production in skin cells by sandalwood oils and purified α-santalol and β-santalol.', 'router_source_backend': 'missing', 'router_source_ref': '', 'router_source_diagnostics': []}"
paper_1f3c544b574c,10.1007/978-1-4939-0363-4_7,Microneedle-iontophoresis combinations for enhanced transdermal drug delivery.,unresolved,0.0,unknown,unknown,[],,"{'paper_type': 'review', 'mentions_ibuprofen': 'no', 'mentions_diffusion_cell': 'no', 'franz_confirmed': 'no', 'where_diffusion_cell': '', 'where_franz': '', 'study_type': 'uncertain', 'barrier_category': 'uncertain', 'barrier_name_raw': '', 'endpoint_found': 'no', 'endpoint_time_found': 'no', 'where_endpoint': '', 'endpoint_carrier': 'unknown', 'endpoint_carrier_snippet': '', 'formulation_carrier': 'unknown', 'formulation_carrier_snippet': '', 'endpoint_likely_in_supp': 'uncertain', 'formulation_table_missing': 'uncertain', 'notes': '', 'router_source_backend': 'pdf_local', 'router_source_ref': 'papers\\pdf\\10.1007_978-1-4939-0363-4_7__6fa5f5aae3.pdf', 'router_source_diagnostics': [], 'router_heuristic_signals': {'table_hits': 1, 'figure_hits': 0, 'endpoint_hits': 0, 'formulation_hits': 2}}"
paper_fbb92ac818a0,10.1007/s000110050474,"The analgesic NSAID lornoxicam inhibits cyclooxygenase (COX)-1/-2, inducible nitric oxide synthase (iNOS), and the formation of interleukin (IL)-6 in vitro.",unresolved,0.0,unknown,unknown,[],missing_structured_and_pdf_router_source,"{'title': 'The analgesic NSAID lornoxicam inhibits cyclooxygenase (COX)-1/-2, inducible nitric oxide synthase (iNOS), and the formation of interleukin (IL)-6 in vitro.', 'router_source_backend': 'missing', 'router_source_ref': '', 'router_source_diagnostics': []}"
paper_921c326a6663,10.1007/s000110300009,CD40 ligation triggers COX-2 expression in endothelial cells: evidence that CD40-mediated IL-6 synthesis is COX-2-dependent.,unresolved,0.0,unknown,unknown,[],missing_structured_and_pdf_router_source,"{'title': 'CD40 ligation triggers COX-2 expression in endothelial cells: evidence that CD40-mediated IL-6 synthesis is COX-2-dependent.', 'router_source_backend': 'missing', 'router_source_ref': '', 'router_source_diagnostics': []}"
paper_4afdb849a51d,10.1007/s00216-005-3296-z,Ultrafiltration behavior of selected pharmaceuticals on natural and synthetic membranes in the presence of humic-rich hydrocolloids.,unresolved,0.0,unknown,unknown,[],missing_structured_and_pdf_router_source,"{'title': 'Ultrafiltration behavior of selected pharmaceuticals on natural and synthetic membranes in the presence of humic-rich hydrocolloids.', 'router_source_backend': 'missing', 'router_source_ref': '', 'router_source_diagnostics': []}"
paper_9e71019773b2,10.1007/s00216-006-0883-6,Analysis of pharmaceuticals in wastewater and removal using a membrane bioreactor.,unresolved,0.0,unknown,unknown,[],No relevant information on ibuprofen or dermal formulations found.,"{'paper_type': 'uncertain', 'mentions_ibuprofen': 'no', 'mentions_diffusion_cell': 'no', 'franz_confirmed': 'no', 'where_diffusion_cell': '', 'where_franz': '', 'study_type': 'uncertain', 'barrier_category': 'uncertain', 'barrier_name_raw': '', 'endpoint_found': 'no', 'endpoint_time_found': 'no', 'where_endpoint': '', 'endpoint_carrier': 'unknown', 'endpoint_carrier_snippet': '', 'formulation_carrier': 'unknown', 'formulation_carrier_snippet': '', 'endpoint_likely_in_supp': 'no', 'formulation_table_missing': 'uncertain', 'notes': 'No relevant information on ibuprofen or dermal formulations found.', 'router_source_backend': 'pdf_local', 'router_source_ref': 'papers\\pdf\\10.1007_s00216-006-0883-6__aa2e45ad70.pdf', 'router_source_diagnostics': ['blocked:html_remote:captcha'], 'router_heuristic_signals': {'table_hits': 0, 'figure_hits': 0, 'endpoint_hits': 0, 'formulation_hits': 0}}"
paper_583d7d25201d,10.1007/s00232-002-1032-6,Effect of ibuprofen and rofecoxib transport parameters in the frog corneal epithelium.,unresolved,0.0,unknown,unknown,[],missing_structured_and_pdf_router_source,"{'title': 'Effect of ibuprofen and rofecoxib transport parameters in the frog corneal epithelium.', 'router_source_backend': 'missing', 'router_source_ref': '', 'router_source_diagnostics': []}"
paper_314ad560b37c,10.1007/s00253-023-12677-z,Analyzing microbial communities and their biodegradation of multiple pharmaceuticals in membrane bioreactors.,figure,0.69,figure,narrative,"[{'field_name': 'endpoint', 'modality': 'figure', 'locator': 'PAGE 6', 'page': 6, 'bbox': None, 'snippet': 'Efficiency of microbial communities to remove pharmaceuticals in MBR1 and MBR2 from week 7 to week 10 of cultivation.', 'source_ref': '10.1007/s00253-023-12677-z', 'confidence': 0.8}, {'field_name': 'formulation', 'modality': 'text', 'locator': 'narrative', 'page': None, 'bbox': None, 'snippet': 'The pharmaceuticals used in this study were ibuprofen, diclofenac, enalapril, caffeine, atenolol and paracetamol and were all dissolved in the influent of MBR1 and MBR2.', 'source_ref': '10.1007/s00253-023-12677-z', 'confidence': 0.7}]",Study shows significant degradation of ibuprofen by microbial communities in membrane bioreactors.,"{'paper_type': 'primary_experiment', 'mentions_ibuprofen': 'yes', 'mentions_diffusion_cell': 'no', 'franz_confirmed': 'no', 'where_diffusion_cell': '', 'where_franz': '', 'study_type': 'IVRT', 'barrier_category': 'uncertain', 'barrier_name_raw': '', 'endpoint_found': 'yes', 'endpoint_time_found': 'yes', 'where_endpoint': 'PAGE 6', 'endpoint_carrier': 'figure', 'endpoint_carrier_snippet': 'Efficiency of microbial communities to remove pharmaceuticals in MBR1 and MBR2 from week 7 to week 10 of cultivation.', 'formulation_carrier': 'narrative', 'formulation_carrier_snippet': 'The pharmaceuticals used in this study were ibuprofen, diclofenac, enalapril, caffeine, atenolol and paracetamol and were all dissolved in the influent of MBR1 and MBR2.', 'endpoint_likely_in_supp': 'no', 'formulation_table_missing': 'no', 'notes': 'Study shows significant degradation of ibuprofen by microbial communities in membrane bioreactors.', 'router_source_backend': 'pdf_local', 'router_source_ref': 'papers\\pdf\\10.1007_s00253-023-12677-z__1200500844.pdf', 'router_source_diagnostics': ['blocked:html_remote:captcha'], 'router_heuristic_signals': {}}"
paper_6102b6abddb2,10.1007/s00405-021-06875-6,Chronic rhinosinusitis in cystic fibrosis: a review of therapeutic options.,unresolved,0.0,unknown,unknown,[],,"{'paper_type': 'review', 'mentions_ibuprofen': 'no', 'mentions_diffusion_cell': 'no', 'franz_confirmed': 'no', 'where_diffusion_cell': '', 'where_franz': '', 'study_type': 'uncertain', 'barrier_category': 'uncertain', 'barrier_name_raw': '', 'endpoint_found': 'no', 'endpoint_time_found': 'no', 'where_endpoint': '', 'endpoint_carrier': 'unknown', 'endpoint_carrier_snippet': '', 'formulation_carrier': 'unknown', 'formulation_carrier_snippet': '', 'endpoint_likely_in_supp': 'no', 'formulation_table_missing': 'no', 'notes': '', 'router_source_backend': 'pdf_local', 'router_source_ref': 'papers\\pdf\\10.1007_s00405-021-06875-6__36cc0414bf.pdf', 'router_source_diagnostics': ['blocked:html_remote:captcha'], 'router_heuristic_signals': {'table_hits': 0, 'figure_hits': 0, 'endpoint_hits': 0, 'formulation_hits': 0}}"
