paper_id,doi,title,route,route_confidence,endpoint_carrier,formulation_carrier,anchor_evidence,notes,raw_labels
paper_801c3bb02123,10.22037/ijpr.2019.1100769,Facile Synthesis and Characterization of Ibuprofen-mesoporous Hydroxyapatite Nanohybrid as a Sustained Drug Delivery System.,unresolved,0.0,unknown,unknown,[],"The paper is about the synthesis and characterization of ibuprofen nanohybrid, but details regarding experimental methods or evidence extraction are not provided in the visible portion.","{'paper_type': 'uncertain', 'mentions_ibuprofen': 'yes', 'mentions_diffusion_cell': 'no', 'franz_confirmed': 'no', 'where_diffusion_cell': '', 'where_franz': '', 'study_type': 'uncertain', 'barrier_category': 'uncertain', 'barrier_name_raw': '', 'endpoint_found': 'uncertain', 'endpoint_time_found': 'uncertain', 'where_endpoint': '', 'endpoint_carrier': 'unknown', 'endpoint_carrier_snippet': '', 'formulation_carrier': 'unknown', 'formulation_carrier_snippet': '', 'endpoint_likely_in_supp': 'uncertain', 'formulation_table_missing': 'uncertain', 'notes': 'The paper is about the synthesis and characterization of ibuprofen nanohybrid, but details regarding experimental methods or evidence extraction are not provided in the visible portion.', 'router_source_backend': 'pdf_local', 'router_source_ref': 'papers\\pdf\\10.22037_ijpr.2019.1100769__7ab51b8a1c.pdf', 'router_source_diagnostics': ['blocked:html_remote:captcha'], 'router_heuristic_signals': {'table_hits': 0, 'figure_hits': 0, 'endpoint_hits': 0, 'formulation_hits': 0}}"
paper_d40fecc1d71c,10.22037/ijpr.2020.112887.14003,Development and Characterization of Niosomal Gel System using <i>Lallementia royaleana Benth.</i> mucilage for the treatment of Rheumatoid Arthritis.,unresolved,0.2,unknown,unknown,"[{'field_name': 'device', 'modality': 'text', 'locator': 'uncertain', 'page': None, 'bbox': None, 'snippet': 'uncertain', 'source_ref': '10.22037/ijpr.2020.112887.14003', 'confidence': 0.7}, {'field_name': 'endpoint', 'modality': 'metadata', 'locator': 'uncertain', 'page': None, 'bbox': None, 'snippet': 'uncertain', 'source_ref': '10.22037/ijpr.2020.112887.14003', 'confidence': 0.8}]","The document content provided does not contain specific evidence on ibuprofen, diffusion cells, or related endpoints.","{'paper_type': 'review', 'mentions_ibuprofen': 'no', 'mentions_diffusion_cell': 'no', 'franz_confirmed': 'no', 'where_diffusion_cell': 'uncertain', 'where_franz': 'uncertain', 'study_type': 'uncertain', 'barrier_category': 'uncertain', 'barrier_name_raw': 'uncertain', 'endpoint_found': 'no', 'endpoint_time_found': 'no', 'where_endpoint': 'uncertain', 'endpoint_carrier': 'unknown', 'endpoint_carrier_snippet': '', 'formulation_carrier': 'unknown', 'formulation_carrier_snippet': '', 'endpoint_likely_in_supp': 'no', 'formulation_table_missing': 'no', 'notes': 'The document content provided does not contain specific evidence on ibuprofen, diffusion cells, or related endpoints.', 'router_source_backend': 'pdf_local', 'router_source_ref': 'papers\\pdf\\10.22037_ijpr.2020.112887.14003__d027ba353e.pdf', 'router_source_diagnostics': ['blocked:html_remote:captcha'], 'router_heuristic_signals': {'table_hits': 0, 'figure_hits': 0, 'endpoint_hits': 0, 'formulation_hits': 0}}"
paper_ff5f6f9370a0,10.2337/db25-0106,Hypothalamic Prostaglandins Facilitate Recovery From Severe Hypoglycemia but Exacerbate Recurrent Hypoglycemia in Mice.,unresolved,0.0,unknown,unknown,[],Insufficient information in the document to determine extraction details.,"{'paper_type': 'uncertain', 'mentions_ibuprofen': 'no', 'mentions_diffusion_cell': 'no', 'franz_confirmed': 'no', 'where_diffusion_cell': '', 'where_franz': '', 'study_type': 'uncertain', 'barrier_category': 'uncertain', 'barrier_name_raw': '', 'endpoint_found': 'no', 'endpoint_time_found': 'no', 'where_endpoint': '', 'endpoint_carrier': 'unknown', 'endpoint_carrier_snippet': '', 'formulation_carrier': 'unknown', 'formulation_carrier_snippet': '', 'endpoint_likely_in_supp': 'uncertain', 'formulation_table_missing': 'uncertain', 'notes': 'Insufficient information in the document to determine extraction details.', 'router_source_backend': 'pdf_local', 'router_source_ref': 'papers\\pdf\\10.2337_db25-0106__1f96cbce48.pdf', 'router_source_diagnostics': ['blocked:html_remote:captcha'], 'router_heuristic_signals': {'table_hits': 0, 'figure_hits': 0, 'endpoint_hits': 0, 'formulation_hits': 0}}"
paper_183c78d24024,10.3109/02652048.2015.1028495,Mass transport model through the skin by microencapsulation system.,unresolved,0.0,unknown,unknown,[],missing_structured_and_pdf_router_source,"{'title': 'Mass transport model through the skin by microencapsulation system.', 'router_source_backend': 'missing', 'router_source_ref': '', 'router_source_diagnostics': []}"
paper_7f07515730fe,10.3109/03639041003695071,Physicochemical studies of binary eutectic of ibuprofen and ketoprofen for enhanced transdermal drug delivery.,unresolved,0.0,unknown,unknown,[],missing_structured_and_pdf_router_source,"{'title': 'Physicochemical studies of binary eutectic of ibuprofen and ketoprofen for enhanced transdermal drug delivery.', 'router_source_backend': 'missing', 'router_source_ref': '', 'router_source_diagnostics': []}"
paper_b730088c71ee,10.3109/03639045.2011.653363,A comparative study of vitamin E TPGS/HPMC supersaturated system and other solubilizer/polymer combinations to enhance the permeability of a poorly soluble drug through the skin.,unresolved,0.0,unknown,unknown,[],missing_structured_and_pdf_router_source,"{'title': 'A comparative study of vitamin E TPGS/HPMC supersaturated system and other solubilizer/polymer combinations to enhance the permeability of a poorly soluble drug through the skin.', 'router_source_backend': 'missing', 'router_source_ref': '', 'router_source_diagnostics': []}"
paper_ce25f0ff5437,10.3109/03639045.2015.1107095,Effect of borneol on the transdermal permeation of drugs with differing lipophilicity and molecular organization of stratum corneum lipids.,unresolved,0.0,unknown,unknown,[],missing_structured_and_pdf_router_source,"{'title': 'Effect of borneol on the transdermal permeation of drugs with differing lipophilicity and molecular organization of stratum corneum lipids.', 'router_source_backend': 'missing', 'router_source_ref': '', 'router_source_diagnostics': []}"
paper_752460399665,10.3109/08982100903014994,Span and Tween neutral and pH-sensitive vesicles: characterization and in vitro skin permeation.,unresolved,0.0,unknown,unknown,[],missing_structured_and_pdf_router_source,"{'title': 'Span and Tween neutral and pH-sensitive vesicles: characterization and in vitro skin permeation.', 'router_source_backend': 'missing', 'router_source_ref': '', 'router_source_diagnostics': []}"
paper_4344128a5b90,10.3109/10717544.2013.873837,Nonionic surfactant-based vesicular system for transdermal drug delivery.,unresolved,0.0,unknown,unknown,[],missing_structured_and_pdf_router_source,"{'title': 'Nonionic surfactant-based vesicular system for transdermal drug delivery.', 'router_source_backend': 'missing', 'router_source_ref': '', 'router_source_diagnostics': []}"
paper_837b9f34dbe4,10.3109/10837450.2010.513987,Transdermal permeation of novel n-acetyl-glucosamine/NSAIDs mutual prodrugs.,unresolved,0.0,unknown,unknown,[],missing_structured_and_pdf_router_source,"{'title': 'Transdermal permeation of novel n-acetyl-glucosamine/NSAIDs mutual prodrugs.', 'router_source_backend': 'missing', 'router_source_ref': '', 'router_source_diagnostics': []}"
paper_01a7568de553,10.3109/10837450.2013.860548,Quality by design approach to prepare oleoyl alginate derivative and its use in transdermal delivery.,unresolved,0.0,unknown,unknown,[],missing_structured_and_pdf_router_source,"{'title': 'Quality by design approach to prepare oleoyl alginate derivative and its use in transdermal delivery.', 'router_source_backend': 'missing', 'router_source_ref': '', 'router_source_diagnostics': []}"
paper_d9ee953557df,10.3389/fbioe.2020.00708,Thermosensitive Micellar Hydrogels as Vehicles to Deliver Drugs With Different Wettability.,unresolved,0.0,unknown,unknown,[],No extractable evidence found in the text provided.,"{'paper_type': 'uncertain', 'mentions_ibuprofen': 'no', 'mentions_diffusion_cell': 'no', 'franz_confirmed': 'no', 'where_diffusion_cell': '', 'where_franz': '', 'study_type': 'uncertain', 'barrier_category': 'uncertain', 'barrier_name_raw': '', 'endpoint_found': 'no', 'endpoint_time_found': 'no', 'where_endpoint': '', 'endpoint_carrier': 'unknown', 'endpoint_carrier_snippet': '', 'formulation_carrier': 'unknown', 'formulation_carrier_snippet': '', 'endpoint_likely_in_supp': 'no', 'formulation_table_missing': 'no', 'notes': 'No extractable evidence found in the text provided.', 'router_source_backend': 'pdf_local', 'router_source_ref': 'papers\\pdf\\10.3389_fbioe.2020.00708__37713f8569.pdf', 'router_source_diagnostics': ['blocked:html_remote:captcha'], 'router_heuristic_signals': {'table_hits': 0, 'figure_hits': 0, 'endpoint_hits': 0, 'formulation_hits': 0}}"
paper_f03f8905410c,10.3389/fchem.2021.767923,Green Fabrication and Release Mechanisms of pH-Sensitive Chitosan-Ibuprofen Aerogels for Controlled Transdermal Delivery of Ibuprofen.,figure,0.81,figure,narrative,"[{'field_name': 'device', 'modality': 'text', 'locator': 'Section 2.8', 'page': None, 'bbox': None, 'snippet': 'Section 2.8', 'source_ref': '10.3389/fchem.2021.767923', 'confidence': 0.7}, {'field_name': 'endpoint', 'modality': 'figure', 'locator': 'Figure 7C', 'page': None, 'bbox': None, 'snippet': 'the cumulative release amounts of ibuprofen permeated through porcine skin at different pHs of PBS solution were increased slowly in 72 h', 'source_ref': '10.3389/fchem.2021.767923', 'confidence': 0.8}, {'field_name': 'formulation', 'modality': 'text', 'locator': 'narrative', 'page': None, 'bbox': None, 'snippet': 'Chitosan–ibuprofen aerogels were prepared using a simple method...', 'source_ref': '10.3389/fchem.2021.767923', 'confidence': 0.7}]",Study evaluates chitosan-ibuprofen aerogels for transdermal delivery.,"{'paper_type': 'primary_experiment', 'mentions_ibuprofen': 'yes', 'mentions_diffusion_cell': 'yes', 'franz_confirmed': 'yes', 'where_diffusion_cell': 'Section 2.8', 'where_franz': 'Section 2.8', 'study_type': 'IVPT', 'barrier_category': 'skin', 'barrier_name_raw': 'pig skin', 'endpoint_found': 'yes', 'endpoint_time_found': 'yes', 'where_endpoint': 'Figure 7C', 'endpoint_carrier': 'figure', 'endpoint_carrier_snippet': 'the cumulative release amounts of ibuprofen permeated through porcine skin at different pHs of PBS solution were increased slowly in 72 h', 'formulation_carrier': 'narrative', 'formulation_carrier_snippet': 'Chitosan–ibuprofen aerogels were prepared using a simple method...', 'endpoint_likely_in_supp': 'no', 'formulation_table_missing': 'no', 'notes': 'Study evaluates chitosan-ibuprofen aerogels for transdermal delivery.', 'router_source_backend': 'pdf_local', 'router_source_ref': 'papers\\pdf\\10.3389_fchem.2021.767923__210f2ad6ad.pdf', 'router_source_diagnostics': ['blocked:html_remote:captcha'], 'router_heuristic_signals': {}}"
paper_fb74094c5234,10.3389/fchem.2024.1369542,"Investigation of the synthesis, gelation potential, and drug-loading capacities of two novel amides.",unresolved,0.2,unknown,unknown,"[{'field_name': 'device', 'modality': 'text', 'locator': 'unknown', 'page': None, 'bbox': None, 'snippet': 'unknown', 'source_ref': '10.3389/fchem.2024.1369542', 'confidence': 0.7}, {'field_name': 'endpoint', 'modality': 'metadata', 'locator': 'unknown', 'page': None, 'bbox': None, 'snippet': 'unknown', 'source_ref': '10.3389/fchem.2024.1369542', 'confidence': 0.8}, {'field_name': 'formulation', 'modality': 'metadata', 'locator': 'unknown', 'page': None, 'bbox': None, 'snippet': 'unknown', 'source_ref': '10.3389/fchem.2024.1369542', 'confidence': 0.7}]",No extractable evidence for analysis related to ibuprofen.,"{'paper_type': 'uncertain', 'mentions_ibuprofen': 'no', 'mentions_diffusion_cell': 'no', 'franz_confirmed': 'no', 'where_diffusion_cell': 'unknown', 'where_franz': 'unknown', 'study_type': 'uncertain', 'barrier_category': 'uncertain', 'barrier_name_raw': 'unknown', 'endpoint_found': 'no', 'endpoint_time_found': 'no', 'where_endpoint': 'unknown', 'endpoint_carrier': 'unknown', 'endpoint_carrier_snippet': 'unknown', 'formulation_carrier': 'unknown', 'formulation_carrier_snippet': 'unknown', 'endpoint_likely_in_supp': 'no', 'formulation_table_missing': 'uncertain', 'notes': 'No extractable evidence for analysis related to ibuprofen.', 'router_source_backend': 'pdf_local', 'router_source_ref': 'papers\\pdf\\10.3389_fchem.2024.1369542__c616ea706a.pdf', 'router_source_diagnostics': ['blocked:html_remote:captcha'], 'router_heuristic_signals': {'table_hits': 0, 'figure_hits': 0, 'endpoint_hits': 0, 'formulation_hits': 0}}"
paper_052bd99fa67b,10.3389/fendo.2026.1728199,Efficacy and safety of Dysmenorrhea Patch acupoint application in women with primary dysmenorrhea: a randomized double-blind controlled trial.,unresolved,0.0,unknown,unknown,[],Insufficient information provided to determine specific evidence extraction routes.,"{'paper_type': 'uncertain', 'mentions_ibuprofen': 'no', 'mentions_diffusion_cell': 'no', 'franz_confirmed': 'no', 'where_diffusion_cell': '', 'where_franz': '', 'study_type': 'uncertain', 'barrier_category': 'uncertain', 'barrier_name_raw': '', 'endpoint_found': 'no', 'endpoint_time_found': 'no', 'where_endpoint': '', 'endpoint_carrier': 'unknown', 'endpoint_carrier_snippet': '', 'formulation_carrier': 'unknown', 'formulation_carrier_snippet': '', 'endpoint_likely_in_supp': 'no', 'formulation_table_missing': 'yes', 'notes': 'Insufficient information provided to determine specific evidence extraction routes.', 'router_source_backend': 'pdf_local', 'router_source_ref': 'papers\\pdf\\10.3389_fendo.2026.1728199__0289e0e317.pdf', 'router_source_diagnostics': ['blocked:html_remote:captcha'], 'router_heuristic_signals': {'table_hits': 0, 'figure_hits': 0, 'endpoint_hits': 0, 'formulation_hits': 0}}"
paper_d3e3b20e276b,10.3389/fphar.2024.1355283,Hyaluronic acid-ibuprofen conjugation: a novel ototherapeutic approach protecting inner ear cells from inflammation-mediated damage.,figure,0.81,figure,unknown,"[{'field_name': 'device', 'modality': 'text', 'locator': 'unknown', 'page': None, 'bbox': None, 'snippet': 'unknown', 'source_ref': '10.3389/fphar.2024.1355283', 'confidence': 0.7}, {'field_name': 'endpoint', 'modality': 'figure', 'locator': 'Section 3: Results and Discussion', 'page': None, 'bbox': None, 'snippet': 'Figure 3 shows cytokine release alterations by I-HA treatment in macrophages.', 'source_ref': '10.3389/fphar.2024.1355283', 'confidence': 0.8}, {'field_name': 'formulation', 'modality': 'metadata', 'locator': 'unknown', 'page': None, 'bbox': None, 'snippet': 'unknown', 'source_ref': '10.3389/fphar.2024.1355283', 'confidence': 0.7}]",This paper explores the efficacy of an ibuprofen-HA conjugate for treating cochlear inflammation in vitro.,"{'paper_type': 'primary_experiment', 'mentions_ibuprofen': 'yes', 'mentions_diffusion_cell': 'yes', 'franz_confirmed': 'no', 'where_diffusion_cell': 'assessed in tympanic and round window membrane tissue permeation models', 'where_franz': 'unknown', 'study_type': 'IVPT', 'barrier_category': 'both', 'barrier_name_raw': 'tympanic membrane and round window membrane', 'endpoint_found': 'yes', 'endpoint_time_found': 'uncertain', 'where_endpoint': 'Section 3: Results and Discussion', 'endpoint_carrier': 'figure', 'endpoint_carrier_snippet': 'Figure 3 shows cytokine release alterations by I-HA treatment in macrophages.', 'formulation_carrier': 'unknown', 'formulation_carrier_snippet': 'unknown', 'endpoint_likely_in_supp': 'no', 'formulation_table_missing': 'no', 'notes': 'This paper explores the efficacy of an ibuprofen-HA conjugate for treating cochlear inflammation in vitro.', 'router_source_backend': 'pdf_local', 'router_source_ref': 'papers\\pdf\\10.3389_fphar.2024.1355283__481e1260de.pdf', 'router_source_diagnostics': ['blocked:html_remote:captcha'], 'router_heuristic_signals': {}}"
paper_8e4e3d8dfab3,10.3389/fphar.2024.1488722,A sulfonimide derivative of bezafibrate as a dual inhibitor of cyclooxygenase-2 and PPARα.,unresolved,0.0,unknown,unknown,[],,"{'paper_type': 'uncertain', 'mentions_ibuprofen': 'no', 'mentions_diffusion_cell': 'no', 'franz_confirmed': 'no', 'where_diffusion_cell': '', 'where_franz': '', 'study_type': 'uncertain', 'barrier_category': 'uncertain', 'barrier_name_raw': '', 'endpoint_found': 'no', 'endpoint_time_found': 'no', 'where_endpoint': '', 'endpoint_carrier': 'unknown', 'endpoint_carrier_snippet': '', 'formulation_carrier': 'unknown', 'formulation_carrier_snippet': '', 'endpoint_likely_in_supp': 'no', 'formulation_table_missing': 'uncertain', 'notes': '', 'router_source_backend': 'pdf_local', 'router_source_ref': 'papers\\pdf\\10.3389_fphar.2024.1488722__33d480f38a.pdf', 'router_source_diagnostics': ['blocked:html_remote:captcha'], 'router_heuristic_signals': {'table_hits': 0, 'figure_hits': 0, 'endpoint_hits': 0, 'formulation_hits': 0}}"
paper_2504736aaaae,10.3389/fphys.2016.00263,Inflammatory Role of ROS-Sensitive AMP-Activated Protein Kinase in the Hypersensitivity of Lung Vagal C Fibers Induced by Intermittent Hypoxia in Rats.,figure,0.5700000000000001,figure,unknown,"[{'field_name': 'endpoint', 'modality': 'figure', 'locator': 'Figure 4', 'page': None, 'bbox': None, 'snippet': 'The mean peak responses to capsaicin (Figure 4A), phenylbiguanide (Figure 4B), and α,β-methylene-ATP (Figure 4C) among IH rats were all significantly greater than those among the RA rats.', 'source_ref': '10.3389/fphys.2016.00263', 'confidence': 0.8}]","The study investigates the effect of intermittent hypoxia on airway hypersensitivity in rats, with specific mention of ibuprofen as an inhibitor.","{'paper_type': 'primary_experiment', 'mentions_ibuprofen': 'yes', 'mentions_diffusion_cell': 'no', 'franz_confirmed': 'no', 'where_diffusion_cell': '', 'where_franz': '', 'study_type': 'uncertain', 'barrier_category': 'uncertain', 'barrier_name_raw': '', 'endpoint_found': 'yes', 'endpoint_time_found': 'uncertain', 'where_endpoint': 'Figure 4', 'endpoint_carrier': 'figure', 'endpoint_carrier_snippet': 'The mean peak responses to capsaicin (Figure 4A), phenylbiguanide (Figure 4B), and α,β-methylene-ATP (Figure 4C) among IH rats were all significantly greater than those among the RA rats.', 'formulation_carrier': 'unknown', 'formulation_carrier_snippet': '', 'endpoint_likely_in_supp': 'no', 'formulation_table_missing': 'uncertain', 'notes': 'The study investigates the effect of intermittent hypoxia on airway hypersensitivity in rats, with specific mention of ibuprofen as an inhibitor.', 'router_source_backend': 'pdf_local', 'router_source_ref': 'papers\\pdf\\10.3389_fphys.2016.00263__ba834bfcf5.pdf', 'router_source_diagnostics': ['blocked:html_remote:captcha'], 'router_heuristic_signals': {}}"
paper_b6bca2ab5d54,10.3390/antibiotics10070805,In Vitro Microbiological and Drug Release of Silver/Ibuprofen Loaded Wound Dressing Designed for the Treatment of Chronically Infected Painful Wounds.,unresolved,0.2,unknown,unknown,"[{'field_name': 'device', 'modality': 'text', 'locator': 'unknown', 'page': None, 'bbox': None, 'snippet': 'unknown', 'source_ref': '10.3390/antibiotics10070805', 'confidence': 0.7}, {'field_name': 'endpoint', 'modality': 'metadata', 'locator': 'unknown', 'page': None, 'bbox': None, 'snippet': 'unknown', 'source_ref': '10.3390/antibiotics10070805', 'confidence': 0.8}, {'field_name': 'formulation', 'modality': 'metadata', 'locator': 'unknown', 'page': None, 'bbox': None, 'snippet': 'unknown', 'source_ref': '10.3390/antibiotics10070805', 'confidence': 0.7}]",The document primarily contains navigation content and does not provide specific scientific data or results.,"{'paper_type': 'other', 'mentions_ibuprofen': 'yes', 'mentions_diffusion_cell': 'no', 'franz_confirmed': 'no', 'where_diffusion_cell': 'unknown', 'where_franz': 'unknown', 'study_type': 'uncertain', 'barrier_category': 'uncertain', 'barrier_name_raw': 'unknown', 'endpoint_found': 'uncertain', 'endpoint_time_found': 'uncertain', 'where_endpoint': 'unknown', 'endpoint_carrier': 'unknown', 'endpoint_carrier_snippet': 'unknown', 'formulation_carrier': 'unknown', 'formulation_carrier_snippet': 'unknown', 'endpoint_likely_in_supp': 'no', 'formulation_table_missing': 'uncertain', 'notes': 'The document primarily contains navigation content and does not provide specific scientific data or results.', 'router_source_backend': 'pdf_local', 'router_source_ref': 'papers\\pdf\\10.3390_antibiotics10070805__5f290abd04.pdf', 'router_source_diagnostics': ['blocked:html_remote:captcha'], 'router_heuristic_signals': {'table_hits': 0, 'figure_hits': 0, 'endpoint_hits': 0, 'formulation_hits': 0}}"
paper_df431f7d847f,10.3390/antiox12020337,Shedding Light on the Hidden Benefit of <i>Porphyridium cruentum</i> Culture.,unresolved,0.2,unknown,unknown,"[{'field_name': 'device', 'modality': 'text', 'locator': 'unknown', 'page': None, 'bbox': None, 'snippet': 'unknown', 'source_ref': '10.3390/antiox12020337', 'confidence': 0.7}, {'field_name': 'endpoint', 'modality': 'metadata', 'locator': 'unknown', 'page': None, 'bbox': None, 'snippet': 'unknown', 'source_ref': '10.3390/antiox12020337', 'confidence': 0.8}, {'field_name': 'formulation', 'modality': 'metadata', 'locator': 'unknown', 'page': None, 'bbox': None, 'snippet': 'unknown', 'source_ref': '10.3390/antiox12020337', 'confidence': 0.7}]","Content appears to be about a different topic, not related to ibuprofen.","{'paper_type': 'uncertain', 'mentions_ibuprofen': 'no', 'mentions_diffusion_cell': 'no', 'franz_confirmed': 'no', 'where_diffusion_cell': 'unknown', 'where_franz': 'unknown', 'study_type': 'uncertain', 'barrier_category': 'uncertain', 'barrier_name_raw': 'unknown', 'endpoint_found': 'no', 'endpoint_time_found': 'no', 'where_endpoint': 'unknown', 'endpoint_carrier': 'unknown', 'endpoint_carrier_snippet': 'unknown', 'formulation_carrier': 'unknown', 'formulation_carrier_snippet': 'unknown', 'endpoint_likely_in_supp': 'uncertain', 'formulation_table_missing': 'no', 'notes': 'Content appears to be about a different topic, not related to ibuprofen.', 'router_source_backend': 'pdf_local', 'router_source_ref': 'papers\\pdf\\10.3390_antiox12020337__234616d8ed.pdf', 'router_source_diagnostics': ['blocked:html_remote:captcha'], 'router_heuristic_signals': {'table_hits': 0, 'figure_hits': 0, 'endpoint_hits': 0, 'formulation_hits': 0}}"
paper_ddca5dfd8a2a,10.3390/bioengineering13010092,Synthesis and Characterization of Ibuprofen-TiO<sub>2</sub> Functionalized PCL Biomembranes as Candidate Materials for Wound Dressing Applications.,unresolved,0.2,unknown,unknown,"[{'field_name': 'device', 'modality': 'text', 'locator': 'uncertain', 'page': None, 'bbox': None, 'snippet': 'uncertain', 'source_ref': '10.3390/bioengineering13010092', 'confidence': 0.7}, {'field_name': 'endpoint', 'modality': 'metadata', 'locator': 'uncertain', 'page': None, 'bbox': None, 'snippet': 'unknown', 'source_ref': '10.3390/bioengineering13010092', 'confidence': 0.8}, {'field_name': 'formulation', 'modality': 'metadata', 'locator': 'unknown', 'page': None, 'bbox': None, 'snippet': 'unknown', 'source_ref': '10.3390/bioengineering13010092', 'confidence': 0.7}]","Extract valuable evidence from the text related to ibuprofen and its application in dermal formulations, focusing on synthesis and characterization.","{'paper_type': 'other', 'mentions_ibuprofen': 'yes', 'mentions_diffusion_cell': 'no', 'franz_confirmed': 'no', 'where_diffusion_cell': 'uncertain', 'where_franz': 'uncertain', 'study_type': 'uncertain', 'barrier_category': 'uncertain', 'barrier_name_raw': 'uncertain', 'endpoint_found': 'uncertain', 'endpoint_time_found': 'uncertain', 'where_endpoint': 'uncertain', 'endpoint_carrier': 'unknown', 'endpoint_carrier_snippet': 'unknown', 'formulation_carrier': 'unknown', 'formulation_carrier_snippet': 'unknown', 'endpoint_likely_in_supp': 'uncertain', 'formulation_table_missing': 'uncertain', 'notes': 'Extract valuable evidence from the text related to ibuprofen and its application in dermal formulations, focusing on synthesis and characterization.', 'router_source_backend': 'pdf_local', 'router_source_ref': 'papers\\pdf\\10.3390_bioengineering13010092__4b585369e3.pdf', 'router_source_diagnostics': ['blocked:html_remote:captcha'], 'router_heuristic_signals': {'table_hits': 0, 'figure_hits': 0, 'endpoint_hits': 0, 'formulation_hits': 0}}"
