paper_id,doi,title,route,route_confidence,endpoint_carrier,formulation_carrier,anchor_evidence,notes,raw_labels
paper_37598504bae5,10.1111/j.1398-9995.2011.02684.x,Response to a selective COX-2 inhibitor in patients with urticaria/angioedema induced by nonsteroidal anti-inflammatory drugs.,unresolved,0.0,unknown,unknown,[],missing_structured_and_pdf_router_source,"{'title': 'Response to a selective COX-2 inhibitor in patients with urticaria/angioedema induced by nonsteroidal anti-inflammatory drugs.', 'router_source_backend': 'missing', 'router_source_ref': '', 'router_source_diagnostics': []}"
paper_a8a8cc73a986,10.1111/j.1472-765x.1995.tb01291.x,Antibacterial activity of the anti-inflammatory compound ibuprofen.,unresolved,0.0,unknown,unknown,[],missing_structured_and_pdf_router_source,"{'title': 'Antibacterial activity of the anti-inflammatory compound ibuprofen.', 'router_source_backend': 'missing', 'router_source_ref': '', 'router_source_diagnostics': []}"
paper_36f8311c4b00,10.1111/j.1476-5381.1995.tb14938.x,Mechanisms of bradykinin-induced contraction of the guinea-pig gallbladder in vitro.,unresolved,0.2,unknown,unknown,"[{'field_name': 'device', 'modality': 'text', 'locator': 'unknown', 'page': None, 'bbox': None, 'snippet': 'unknown', 'source_ref': '10.1111/j.1476-5381.1995.tb14938.x', 'confidence': 0.7}, {'field_name': 'endpoint', 'modality': 'metadata', 'locator': 'unknown', 'page': None, 'bbox': None, 'snippet': 'unknown', 'source_ref': '10.1111/j.1476-5381.1995.tb14938.x', 'confidence': 0.8}, {'field_name': 'formulation', 'modality': 'metadata', 'locator': 'unknown', 'page': None, 'bbox': None, 'snippet': 'unknown', 'source_ref': '10.1111/j.1476-5381.1995.tb14938.x', 'confidence': 0.7}]",No relevant data for extraction related to ibuprofen or diffusion studies.,"{'paper_type': 'other', 'mentions_ibuprofen': 'no', 'mentions_diffusion_cell': 'no', 'franz_confirmed': 'no', 'where_diffusion_cell': 'unknown', 'where_franz': 'unknown', 'study_type': 'uncertain', 'barrier_category': 'uncertain', 'barrier_name_raw': 'unknown', 'endpoint_found': 'no', 'endpoint_time_found': 'no', 'where_endpoint': 'unknown', 'endpoint_carrier': 'unknown', 'endpoint_carrier_snippet': 'unknown', 'formulation_carrier': 'unknown', 'formulation_carrier_snippet': 'unknown', 'endpoint_likely_in_supp': 'no', 'formulation_table_missing': 'no', 'notes': 'No relevant data for extraction related to ibuprofen or diffusion studies.', 'router_source_backend': 'pdf_local', 'router_source_ref': 'papers\\pdf\\10.1111_j.1476-5381.1995.tb14938.x__1a7d2c4806.pdf', 'router_source_diagnostics': ['blocked:html_remote:captcha'], 'router_heuristic_signals': {'table_hits': 0, 'figure_hits': 0, 'endpoint_hits': 0, 'formulation_hits': 0}}"
paper_b6f91928d012,10.1111/j.1476-5381.1996.tb15658.x,Rapid nitric oxide- and prostaglandin-dependent release of calcitonin gene-related peptide (CGRP) triggered by endotoxin in rat mesenteric arterial bed.,unresolved,0.0,unknown,unknown,[],,"{'paper_type': 'uncertain', 'mentions_ibuprofen': 'no', 'mentions_diffusion_cell': 'no', 'franz_confirmed': 'no', 'where_diffusion_cell': '', 'where_franz': '', 'study_type': 'uncertain', 'barrier_category': 'uncertain', 'barrier_name_raw': '', 'endpoint_found': 'no', 'endpoint_time_found': 'no', 'where_endpoint': '', 'endpoint_carrier': 'unknown', 'endpoint_carrier_snippet': '', 'formulation_carrier': 'unknown', 'formulation_carrier_snippet': '', 'endpoint_likely_in_supp': 'no', 'formulation_table_missing': 'uncertain', 'notes': '', 'router_source_backend': 'pdf_local', 'router_source_ref': 'papers\\pdf\\10.1111_j.1476-5381.1996.tb15658.x__c160de855e.pdf', 'router_source_diagnostics': ['blocked:html_remote:captcha'], 'router_heuristic_signals': {'table_hits': 0, 'figure_hits': 0, 'endpoint_hits': 0, 'formulation_hits': 0}}"
paper_b1d6bef6a409,10.1111/j.1742-481x.2007.00308.x,A pilot (real-life) randomised clinical evaluation of a pain-relieving foam dressing: (ibuprofen-foam versus local best practice).,unresolved,0.0,unknown,unknown,[],missing_structured_and_pdf_router_source:blocked:html_remote:captcha,"{'title': 'A pilot (real-life) randomised clinical evaluation of a pain-relieving foam dressing: (ibuprofen-foam versus local best practice).', 'router_source_backend': 'missing', 'router_source_ref': '', 'router_source_diagnostics': ['blocked:html_remote:captcha']}"
paper_c7a4cc7e17d6,10.1111/j.1742-481x.2007.00312.x,"Less pain with Biatain-Ibu: initial findings from a randomised, controlled, double-blind clinical investigation on painful venous leg ulcers.",unresolved,0.0,unknown,unknown,[],Initial findings on a clinical study related to ibuprofen.,"{'paper_type': 'clinical', 'mentions_ibuprofen': 'yes', 'mentions_diffusion_cell': 'no', 'franz_confirmed': 'no', 'where_diffusion_cell': '', 'where_franz': '', 'study_type': 'uncertain', 'barrier_category': 'uncertain', 'barrier_name_raw': '', 'endpoint_found': 'uncertain', 'endpoint_time_found': 'uncertain', 'where_endpoint': '', 'endpoint_carrier': 'unknown', 'endpoint_carrier_snippet': '', 'formulation_carrier': 'unknown', 'formulation_carrier_snippet': '', 'endpoint_likely_in_supp': 'no', 'formulation_table_missing': 'uncertain', 'notes': 'Initial findings on a clinical study related to ibuprofen.', 'router_source_backend': 'pdf_local', 'router_source_ref': 'papers\\pdf\\10.1111_j.1742-481x.2007.00312.x__9aff95be6a.pdf', 'router_source_diagnostics': ['blocked:html_remote:captcha'], 'router_heuristic_signals': {'table_hits': 0, 'figure_hits': 0, 'endpoint_hits': 0, 'formulation_hits': 0}}"
paper_b32454acf5e0,10.1111/j.2042-7158.1985.tb04926.x,"Absorption through human skin of ibuprofen and flurbiprofen; effect of dose variation, deposited drug films, occlusion and the penetration enhancer N-methyl-2-pyrrolidone.",unresolved,0.0,unknown,unknown,[],missing_structured_and_pdf_router_source,"{'title': 'Absorption through human skin of ibuprofen and flurbiprofen; effect of dose variation, deposited drug films, occlusion and the penetration enhancer N-methyl-2-pyrrolidone.', 'router_source_backend': 'missing', 'router_source_ref': '', 'router_source_diagnostics': []}"
paper_5728a1abee10,10.1111/j.2042-7158.2010.01090.x,Solubilisation of drugs within liposomal bilayers: alternatives to cholesterol as a membrane stabilising agent.,unresolved,0.0,unknown,unknown,[],missing_structured_and_pdf_router_source,"{'title': 'Solubilisation of drugs within liposomal bilayers: alternatives to cholesterol as a membrane stabilising agent.', 'router_source_backend': 'missing', 'router_source_ref': '', 'router_source_diagnostics': []}"
paper_532f8a419a9e,10.1124/jpet.104.069484,Intrathecal protease-activated receptor stimulation produces thermal hyperalgesia through spinal cyclooxygenase activity.,unresolved,0.0,unknown,unknown,[],missing_structured_and_pdf_router_source,"{'title': 'Intrathecal protease-activated receptor stimulation produces thermal hyperalgesia through spinal cyclooxygenase activity.', 'router_source_backend': 'missing', 'router_source_ref': '', 'router_source_diagnostics': []}"
paper_b8248b40a8c1,10.1124/jpet.108.145797,Kinetics of cellular retention during Caco-2 permeation experiments: role of lysosomal sequestration and impact on permeability estimates.,unresolved,0.0,unknown,unknown,[],missing_structured_and_pdf_router_source:html_remote:HTTPError,"{'title': 'Kinetics of cellular retention during Caco-2 permeation experiments: role of lysosomal sequestration and impact on permeability estimates.', 'router_source_backend': 'missing', 'router_source_ref': '', 'router_source_diagnostics': ['html_remote:HTTPError']}"
paper_f3fe252ac3fe,10.1128/aac.39.12.2610,"Demonstration of synergy with fluconazole and either ibuprofen, sodium salicylate, or propylparaben against Candida albicans in vitro.",unresolved,0.0,unknown,unknown,[],,"{'paper_type': 'uncertain', 'mentions_ibuprofen': 'yes', 'mentions_diffusion_cell': 'no', 'franz_confirmed': 'no', 'where_diffusion_cell': '', 'where_franz': '', 'study_type': 'uncertain', 'barrier_category': 'uncertain', 'barrier_name_raw': '', 'endpoint_found': 'uncertain', 'endpoint_time_found': 'uncertain', 'where_endpoint': '', 'endpoint_carrier': 'unknown', 'endpoint_carrier_snippet': '', 'formulation_carrier': 'unknown', 'formulation_carrier_snippet': '', 'endpoint_likely_in_supp': 'uncertain', 'formulation_table_missing': 'uncertain', 'notes': '', 'router_source_backend': 'pdf_local', 'router_source_ref': 'papers\\pdf\\10.1128_aac.39.12.2610__2d4e9a46fd.pdf', 'router_source_diagnostics': ['blocked:html_remote:captcha'], 'router_heuristic_signals': {'table_hits': 0, 'figure_hits': 0, 'endpoint_hits': 0, 'formulation_hits': 0}}"
paper_5c4c70848128,10.1128/aac.39.12.2615,"Use of decimal assay for additivity to demonstrate synergy in pair combinations of econazole, nikkomycin Z, and ibuprofen against Candida albicans in vitro.",unresolved,0.0,unknown,unknown,[],The provided text does not contain structured data or extractable evidence related to ibuprofen or any specific formulations.,"{'paper_type': 'other', 'mentions_ibuprofen': 'yes', 'mentions_diffusion_cell': 'no', 'franz_confirmed': 'no', 'where_diffusion_cell': '', 'where_franz': '', 'study_type': 'uncertain', 'barrier_category': 'uncertain', 'barrier_name_raw': '', 'endpoint_found': 'no', 'endpoint_time_found': 'no', 'where_endpoint': '', 'endpoint_carrier': 'unknown', 'endpoint_carrier_snippet': '', 'formulation_carrier': 'unknown', 'formulation_carrier_snippet': '', 'endpoint_likely_in_supp': 'no', 'formulation_table_missing': 'uncertain', 'notes': 'The provided text does not contain structured data or extractable evidence related to ibuprofen or any specific formulations.', 'router_source_backend': 'pdf_local', 'router_source_ref': 'papers\\pdf\\10.1128_aac.39.12.2615__4a05fdc1ea.pdf', 'router_source_diagnostics': ['blocked:html_remote:captcha'], 'router_heuristic_signals': {'table_hits': 0, 'figure_hits': 0, 'endpoint_hits': 0, 'formulation_hits': 0}}"
paper_34659ff1ae7a,10.1128/iai.67.10.5076-5082.1999,Pseudomonas aeruginosa quorum-sensing signal molecule N-(3-oxododecanoyl)-L-homoserine lactone inhibits expression of P2Y receptors in cystic fibrosis tracheal gland cells.,unresolved,0.0,unknown,unknown,[],missing_structured_and_pdf_router_source:html_remote:HTTPError,"{'title': 'Pseudomonas aeruginosa quorum-sensing signal molecule N-(3-oxododecanoyl)-L-homoserine lactone inhibits expression of P2Y receptors in cystic fibrosis tracheal gland cells.', 'router_source_backend': 'missing', 'router_source_ref': '', 'router_source_diagnostics': ['html_remote:HTTPError']}"
paper_451c75edf732,10.1136/bmjopen-2011-000076,Non-steroidal anti-inflammatory drug (NSAID) related inhibition of aldosterone glucuronidation and arterial dysfunction in patients with rheumatoid arthritis: a cross-sectional clinical study.,unresolved,0.2,unknown,unknown,"[{'field_name': 'device', 'modality': 'text', 'locator': 'unknown', 'page': None, 'bbox': None, 'snippet': 'unknown', 'source_ref': '10.1136/bmjopen-2011-000076', 'confidence': 0.7}, {'field_name': 'endpoint', 'modality': 'metadata', 'locator': 'unknown', 'page': None, 'bbox': None, 'snippet': 'unknown', 'source_ref': '10.1136/bmjopen-2011-000076', 'confidence': 0.8}, {'field_name': 'formulation', 'modality': 'metadata', 'locator': 'unknown', 'page': None, 'bbox': None, 'snippet': 'unknown', 'source_ref': '10.1136/bmjopen-2011-000076', 'confidence': 0.7}]","Paper focuses on NSAID effects, not specifically on ibuprofen formulations.","{'paper_type': 'clinical', 'mentions_ibuprofen': 'no', 'mentions_diffusion_cell': 'no', 'franz_confirmed': 'no', 'where_diffusion_cell': 'unknown', 'where_franz': 'unknown', 'study_type': 'uncertain', 'barrier_category': 'uncertain', 'barrier_name_raw': 'unknown', 'endpoint_found': 'uncertain', 'endpoint_time_found': 'uncertain', 'where_endpoint': 'unknown', 'endpoint_carrier': 'unknown', 'endpoint_carrier_snippet': 'unknown', 'formulation_carrier': 'unknown', 'formulation_carrier_snippet': 'unknown', 'endpoint_likely_in_supp': 'no', 'formulation_table_missing': 'uncertain', 'notes': 'Paper focuses on NSAID effects, not specifically on ibuprofen formulations.', 'router_source_backend': 'pdf_local', 'router_source_ref': 'papers\\pdf\\10.1136_bmjopen-2011-000076__7fdc9eb4cf.pdf', 'router_source_diagnostics': ['blocked:html_remote:captcha'], 'router_heuristic_signals': {'table_hits': 0, 'figure_hits': 0, 'endpoint_hits': 0, 'formulation_hits': 0}}"
paper_96af5f187f65,10.1136/bmjopen-2025-113162,Study of topical anaesthetic for paediatric laser procedures (STAPLE): a protocol for a feasibility and pilot randomised controlled trial.,unresolved,0.0,unknown,unknown,[],The document does not provide any extractable evidence relevant to ibuprofen formulations.,"{'paper_type': 'uncertain', 'mentions_ibuprofen': 'no', 'mentions_diffusion_cell': 'no', 'franz_confirmed': 'no', 'where_diffusion_cell': '', 'where_franz': '', 'study_type': 'uncertain', 'barrier_category': 'uncertain', 'barrier_name_raw': '', 'endpoint_found': 'no', 'endpoint_time_found': 'no', 'where_endpoint': '', 'endpoint_carrier': 'unknown', 'endpoint_carrier_snippet': '', 'formulation_carrier': 'unknown', 'formulation_carrier_snippet': '', 'endpoint_likely_in_supp': 'uncertain', 'formulation_table_missing': 'no', 'notes': 'The document does not provide any extractable evidence relevant to ibuprofen formulations.', 'router_source_backend': 'pdf_local', 'router_source_ref': 'papers\\pdf\\10.1136_bmjopen-2025-113162__d0695cc0d3.pdf', 'router_source_diagnostics': ['blocked:html_remote:captcha'], 'router_heuristic_signals': {'table_hits': 0, 'figure_hits': 0, 'endpoint_hits': 0, 'formulation_hits': 0}}"
paper_e1d9b250e91e,10.1152/ajpgi.00298.2014,SCFA transport in rat duodenum.,unresolved,0.0,unknown,unknown,[],missing_structured_and_pdf_router_source:blocked:html_remote:captcha,"{'title': 'SCFA transport in rat duodenum.', 'router_source_backend': 'missing', 'router_source_ref': '', 'router_source_diagnostics': ['blocked:html_remote:captcha']}"
paper_78530353a8d5,10.1152/ajplung.00132.2011,Chronic hypoxia-induced acid-sensitive ion channel expression in chemoafferent neurons contributes to chemoreceptor hypersensitivity.,unresolved,0.0,unknown,unknown,[],missing_structured_and_pdf_router_source:blocked:html_remote:captcha,"{'title': 'Chronic hypoxia-induced acid-sensitive ion channel expression in chemoafferent neurons contributes to chemoreceptor hypersensitivity.', 'router_source_backend': 'missing', 'router_source_ref': '', 'router_source_diagnostics': ['blocked:html_remote:captcha']}"
paper_6412a6a4ef9e,10.1155/2012/505842,"A synoviocyte model for osteoarthritis and rheumatoid arthritis: response to Ibuprofen, betamethasone, and ginger extract-a cross-sectional in vitro study.",unresolved,0.2,unknown,unknown,"[{'field_name': 'device', 'modality': 'text', 'locator': 'unknown', 'page': None, 'bbox': None, 'snippet': 'unknown', 'source_ref': '10.1155/2012/505842', 'confidence': 0.7}, {'field_name': 'endpoint', 'modality': 'metadata', 'locator': 'unknown', 'page': None, 'bbox': None, 'snippet': 'unknown', 'source_ref': '10.1155/2012/505842', 'confidence': 0.8}, {'field_name': 'formulation', 'modality': 'metadata', 'locator': 'unknown', 'page': None, 'bbox': None, 'snippet': 'unknown', 'source_ref': '10.1155/2012/505842', 'confidence': 0.7}]","The study mentions ibuprofen but lacks specific details on diffusion cells, endpoints, or formulations.","{'paper_type': 'primary_experiment', 'mentions_ibuprofen': 'yes', 'mentions_diffusion_cell': 'no', 'franz_confirmed': 'no', 'where_diffusion_cell': 'unknown', 'where_franz': 'unknown', 'study_type': 'uncertain', 'barrier_category': 'uncertain', 'barrier_name_raw': 'unknown', 'endpoint_found': 'no', 'endpoint_time_found': 'no', 'where_endpoint': 'unknown', 'endpoint_carrier': 'unknown', 'endpoint_carrier_snippet': 'unknown', 'formulation_carrier': 'unknown', 'formulation_carrier_snippet': 'unknown', 'endpoint_likely_in_supp': 'uncertain', 'formulation_table_missing': 'uncertain', 'notes': 'The study mentions ibuprofen but lacks specific details on diffusion cells, endpoints, or formulations.', 'router_source_backend': 'pdf_local', 'router_source_ref': 'papers\\pdf\\10.1155_2012_505842__b13c1be23d.pdf', 'router_source_diagnostics': ['blocked:html_remote:captcha'], 'router_heuristic_signals': {'table_hits': 0, 'figure_hits': 0, 'endpoint_hits': 0, 'formulation_hits': 0}}"
paper_228442044048,10.1155/2013/781289,Observation on pain release by long-round needle therapy in knee osteoarthritis related with meridian-sinews theory.,unresolved,0.0,unknown,unknown,[],missing_structured_and_pdf_router_source:blocked:html_remote:captcha,"{'title': 'Observation on pain release by long-round needle therapy in knee osteoarthritis related with meridian-sinews theory.', 'router_source_backend': 'missing', 'router_source_ref': '', 'router_source_diagnostics': ['blocked:html_remote:captcha']}"
paper_9b42388c1069,10.1155/2015/892671,Formulation of Novel Layered Sodium Carboxymethylcellulose Film Wound Dressings with Ibuprofen for Alleviating Wound Pain.,unresolved,0.2,unknown,unknown,"[{'field_name': 'device', 'modality': 'text', 'locator': 'unknown', 'page': None, 'bbox': None, 'snippet': 'unknown', 'source_ref': '10.1155/2015/892671', 'confidence': 0.7}, {'field_name': 'endpoint', 'modality': 'metadata', 'locator': 'unknown', 'page': None, 'bbox': None, 'snippet': 'unknown', 'source_ref': '10.1155/2015/892671', 'confidence': 0.8}, {'field_name': 'formulation', 'modality': 'metadata', 'locator': 'unknown', 'page': None, 'bbox': None, 'snippet': 'unknown', 'source_ref': '10.1155/2015/892671', 'confidence': 0.7}]",Unable to extract detailed information due to limited available text.,"{'paper_type': 'uncertain', 'mentions_ibuprofen': 'yes', 'mentions_diffusion_cell': 'no', 'franz_confirmed': 'no', 'where_diffusion_cell': 'unknown', 'where_franz': 'unknown', 'study_type': 'uncertain', 'barrier_category': 'uncertain', 'barrier_name_raw': 'unknown', 'endpoint_found': 'uncertain', 'endpoint_time_found': 'uncertain', 'where_endpoint': 'unknown', 'endpoint_carrier': 'unknown', 'endpoint_carrier_snippet': 'unknown', 'formulation_carrier': 'unknown', 'formulation_carrier_snippet': 'unknown', 'endpoint_likely_in_supp': 'uncertain', 'formulation_table_missing': 'uncertain', 'notes': 'Unable to extract detailed information due to limited available text.', 'router_source_backend': 'pdf_local', 'router_source_ref': 'papers\\pdf\\10.1155_2015_892671__24c19ba2c6.pdf', 'router_source_diagnostics': ['blocked:html_remote:captcha'], 'router_heuristic_signals': {'table_hits': 0, 'figure_hits': 0, 'endpoint_hits': 0, 'formulation_hits': 0}}"
paper_e4a5821bc88a,10.1155/2020/8672850,"Inflammation, HIV, and Immune Quiescence: Leveraging on Immunomodulatory Products to Reduce HIV Susceptibility.",unresolved,0.0,unknown,unknown,[],missing_structured_and_pdf_router_source:blocked:html_remote:captcha,"{'title': 'Inflammation, HIV, and Immune Quiescence: Leveraging on Immunomodulatory Products to Reduce HIV Susceptibility.', 'router_source_backend': 'missing', 'router_source_ref': '', 'router_source_diagnostics': ['blocked:html_remote:captcha']}"
paper_8f2dbfa00626,10.1155/2022/1020504,The Healing Effects of Piano Practice-Induced Hand Muscle Injury.,unresolved,0.0,unknown,unknown,[],missing_structured_and_pdf_router_source:blocked:html_remote:captcha,"{'title': 'The Healing Effects of Piano Practice-Induced Hand Muscle Injury.', 'router_source_backend': 'missing', 'router_source_ref': '', 'router_source_diagnostics': ['blocked:html_remote:captcha']}"
paper_058ccb52408f,10.1155/2023/5535344,"Extraction, Characterization, and Evaluation of <i>Lepidium sativum</i> Linn. Mucilage as a Mucoadhesive Polymer.",unresolved,0.0,unknown,unknown,[],No relevant data found in the provided text.,"{'paper_type': 'uncertain', 'mentions_ibuprofen': 'no', 'mentions_diffusion_cell': 'no', 'franz_confirmed': 'no', 'where_diffusion_cell': '', 'where_franz': '', 'study_type': 'uncertain', 'barrier_category': 'uncertain', 'barrier_name_raw': '', 'endpoint_found': 'no', 'endpoint_time_found': 'no', 'where_endpoint': '', 'endpoint_carrier': 'unknown', 'endpoint_carrier_snippet': '', 'formulation_carrier': 'unknown', 'formulation_carrier_snippet': '', 'endpoint_likely_in_supp': 'uncertain', 'formulation_table_missing': 'uncertain', 'notes': 'No relevant data found in the provided text.', 'router_source_backend': 'pdf_local', 'router_source_ref': 'papers\\pdf\\10.1155_2023_5535344__25cc46ec42.pdf', 'router_source_diagnostics': ['blocked:html_remote:captcha'], 'router_heuristic_signals': {'table_hits': 0, 'figure_hits': 0, 'endpoint_hits': 0, 'formulation_hits': 0}}"
paper_543a1580a37d,10.1159/000076018,Lateral diffusion of ibuprofen in human skin during permeation studies.,unresolved,0.0,unknown,unknown,[],missing_structured_and_pdf_router_source,"{'title': 'Lateral diffusion of ibuprofen in human skin during permeation studies.', 'router_source_backend': 'missing', 'router_source_ref': '', 'router_source_diagnostics': []}"
paper_de978dfa4371,10.1159/000183922,"Influence of ethanol on the solubility, ionization and permeation characteristics of ibuprofen in silicone and human skin.",unresolved,0.0,unknown,unknown,[],missing_structured_and_pdf_router_source,"{'title': 'Influence of ethanol on the solubility, ionization and permeation characteristics of ibuprofen in silicone and human skin.', 'router_source_backend': 'missing', 'router_source_ref': '', 'router_source_diagnostics': []}"
paper_a147e8c5cba7,10.1159/000231528,Optimisation of cosolvent concentration for topical drug delivery - II: influence of propylene glycol on ibuprofen permeation.,unresolved,0.0,unknown,unknown,[],missing_structured_and_pdf_router_source,"{'title': 'Optimisation of cosolvent concentration for topical drug delivery - II: influence of propylene glycol on ibuprofen permeation.', 'router_source_backend': 'missing', 'router_source_ref': '', 'router_source_diagnostics': []}"
paper_067e8b4e5b8c,10.1159/000315139,Optimisation of cosolvent concentration for topical drug delivery III--influence of lipophilic vehicles on ibuprofen permeation.,unresolved,0.0,unknown,unknown,[],missing_structured_and_pdf_router_source,"{'title': 'Optimisation of cosolvent concentration for topical drug delivery III--influence of lipophilic vehicles on ibuprofen permeation.', 'router_source_backend': 'missing', 'router_source_ref': '', 'router_source_diagnostics': []}"
paper_07b180549ad1,10.1163/156856204322977184,Preparation and characterization of ibuprofen-loaded poly(lactide-co-glycolide)/poly(ethylene glycol)-g-chitosan electrospun membranes.,unresolved,0.0,unknown,unknown,[],missing_structured_and_pdf_router_source,"{'title': 'Preparation and characterization of ibuprofen-loaded poly(lactide-co-glycolide)/poly(ethylene glycol)-g-chitosan electrospun membranes.', 'router_source_backend': 'missing', 'router_source_ref': '', 'router_source_diagnostics': []}"
paper_94f61bbb67e3,10.1165/ajrcmb.25.2.4211,Antibacterial activity of apical surface fluid from the human airway cell line Calu-3: pharmacologic alteration by corticosteroids and beta(2)-agonists.,unresolved,0.0,unknown,unknown,[],missing_structured_and_pdf_router_source,"{'title': 'Antibacterial activity of apical surface fluid from the human airway cell line Calu-3: pharmacologic alteration by corticosteroids and beta(2)-agonists.', 'router_source_backend': 'missing', 'router_source_ref': '', 'router_source_diagnostics': []}"
paper_7896b1cb107a,10.1166/jnn.2013.7157,Electrospinning of ibuprofen-loaded composite nanofibers for improving the performances of transdermal patches.,unresolved,0.0,unknown,unknown,[],missing_structured_and_pdf_router_source,"{'title': 'Electrospinning of ibuprofen-loaded composite nanofibers for improving the performances of transdermal patches.', 'router_source_backend': 'missing', 'router_source_ref': '', 'router_source_diagnostics': []}"
paper_28be43d7b80d,10.1166/jnn.2018.15182,"Scaffolds Based on Collagen, Hyaluronan and Sericin with Potential Applications as Controlled Drug Delivery System.",unresolved,0.0,unknown,unknown,[],missing_structured_and_pdf_router_source,"{'title': 'Scaffolds Based on Collagen, Hyaluronan and Sericin with Potential Applications as Controlled Drug Delivery System.', 'router_source_backend': 'missing', 'router_source_ref': '', 'router_source_diagnostics': []}"
paper_c76316fa34aa,10.1177/22808000211005383,Ibuprofen-loaded biocompatible latex membrane for drug release: Characterization and molecular modeling.,unresolved,0.0,unknown,unknown,[],missing_structured_and_pdf_router_source,"{'title': 'Ibuprofen-loaded biocompatible latex membrane for drug release: Characterization and molecular modeling.', 'router_source_backend': 'missing', 'router_source_ref': '', 'router_source_diagnostics': []}"
