paper_id,doi,title,route,route_confidence,endpoint_carrier,formulation_carrier,anchor_evidence,notes,raw_labels
paper_a465689474fc,10.1111/bph.12670,Neutrophil migration towards C5a and CXCL8 is prevented by non-steroidal anti-inflammatory drugs via inhibition of different pathways.,unresolved,0.2,unknown,unknown,"[{'field_name': 'device', 'modality': 'text', 'locator': 'unknown', 'page': None, 'bbox': None, 'snippet': 'unknown', 'source_ref': '10.1111/bph.12670', 'confidence': 0.7}, {'field_name': 'endpoint', 'modality': 'metadata', 'locator': 'unknown', 'page': None, 'bbox': None, 'snippet': 'unknown', 'source_ref': '10.1111/bph.12670', 'confidence': 0.8}, {'field_name': 'formulation', 'modality': 'metadata', 'locator': 'unknown', 'page': None, 'bbox': None, 'snippet': 'unknown', 'source_ref': '10.1111/bph.12670', 'confidence': 0.7}]",No relevant information available from the document.,"{'paper_type': 'other', 'mentions_ibuprofen': 'yes', 'mentions_diffusion_cell': 'no', 'franz_confirmed': 'no', 'where_diffusion_cell': 'unknown', 'where_franz': 'unknown', 'study_type': 'uncertain', 'barrier_category': 'uncertain', 'barrier_name_raw': 'unknown', 'endpoint_found': 'no', 'endpoint_time_found': 'no', 'where_endpoint': 'unknown', 'endpoint_carrier': 'unknown', 'endpoint_carrier_snippet': 'unknown', 'formulation_carrier': 'unknown', 'formulation_carrier_snippet': 'unknown', 'endpoint_likely_in_supp': 'no', 'formulation_table_missing': 'no', 'notes': 'No relevant information available from the document.', 'router_source_backend': 'pdf_local', 'router_source_ref': 'papers\\pdf\\10.1111_bph.12670__c898adac7c.pdf', 'router_source_diagnostics': ['blocked:html_local:captcha', 'blocked:html_remote:captcha'], 'router_heuristic_signals': {'table_hits': 0, 'figure_hits': 0, 'endpoint_hits': 0, 'formulation_hits': 0}}"
paper_0564594b6c9a,10.1111/j.1365-2133.2009.09220.x,Ibuprofen and hydrogel-released ibuprofen in the reduction of inflammation-induced migration in melanoma cells.,unresolved,0.0,unknown,unknown,[],missing_structured_and_pdf_router_source,"{'title': 'Ibuprofen and hydrogel-released ibuprofen in the reduction of inflammation-induced migration in melanoma cells.', 'router_source_backend': 'missing', 'router_source_ref': '', 'router_source_diagnostics': []}"
paper_a8a8cc73a986,10.1111/j.1472-765x.1995.tb01291.x,Antibacterial activity of the anti-inflammatory compound ibuprofen.,unresolved,0.0,unknown,unknown,[],missing_structured_and_pdf_router_source,"{'title': 'Antibacterial activity of the anti-inflammatory compound ibuprofen.', 'router_source_backend': 'missing', 'router_source_ref': '', 'router_source_diagnostics': []}"
paper_6343051e7ec7,10.1111/j.1476-5381.1991.tb09844.x,Excretion of metabolites of prostacyclin and thromboxane by rats with nephrotoxic nephritis: effects of interleukin-1.,unresolved,0.0,unknown,unknown,[],Insufficient information for extraction.,"{'paper_type': 'uncertain', 'mentions_ibuprofen': 'no', 'mentions_diffusion_cell': 'no', 'franz_confirmed': 'no', 'where_diffusion_cell': '', 'where_franz': '', 'study_type': 'uncertain', 'barrier_category': 'uncertain', 'barrier_name_raw': '', 'endpoint_found': 'no', 'endpoint_time_found': 'no', 'where_endpoint': '', 'endpoint_carrier': 'unknown', 'endpoint_carrier_snippet': '', 'formulation_carrier': 'unknown', 'formulation_carrier_snippet': '', 'endpoint_likely_in_supp': 'no', 'formulation_table_missing': 'no', 'notes': 'Insufficient information for extraction.', 'router_source_backend': 'pdf_local', 'router_source_ref': 'papers\\pdf\\10.1111_j.1476-5381.1991.tb09844.x__d9d0a07b3e.pdf', 'router_source_diagnostics': ['blocked:html_local:captcha', 'blocked:html_remote:captcha'], 'router_heuristic_signals': {'table_hits': 0, 'figure_hits': 0, 'endpoint_hits': 0, 'formulation_hits': 0}}"
paper_b6f91928d012,10.1111/j.1476-5381.1996.tb15658.x,Rapid nitric oxide- and prostaglandin-dependent release of calcitonin gene-related peptide (CGRP) triggered by endotoxin in rat mesenteric arterial bed.,unresolved,0.2,unknown,unknown,"[{'field_name': 'device', 'modality': 'text', 'locator': 'unknown', 'page': None, 'bbox': None, 'snippet': 'unknown', 'source_ref': '10.1111/j.1476-5381.1996.tb15658.x', 'confidence': 0.7}, {'field_name': 'endpoint', 'modality': 'metadata', 'locator': 'unknown', 'page': None, 'bbox': None, 'snippet': 'unknown', 'source_ref': '10.1111/j.1476-5381.1996.tb15658.x', 'confidence': 0.8}, {'field_name': 'formulation', 'modality': 'metadata', 'locator': 'unknown', 'page': None, 'bbox': None, 'snippet': 'unknown', 'source_ref': '10.1111/j.1476-5381.1996.tb15658.x', 'confidence': 0.7}]",No extractable evidence related to OA or ibuprofen.,"{'paper_type': 'other', 'mentions_ibuprofen': 'no', 'mentions_diffusion_cell': 'no', 'franz_confirmed': 'no', 'where_diffusion_cell': 'unknown', 'where_franz': 'unknown', 'study_type': 'uncertain', 'barrier_category': 'uncertain', 'barrier_name_raw': 'unknown', 'endpoint_found': 'no', 'endpoint_time_found': 'no', 'where_endpoint': 'unknown', 'endpoint_carrier': 'unknown', 'endpoint_carrier_snippet': 'unknown', 'formulation_carrier': 'unknown', 'formulation_carrier_snippet': 'unknown', 'endpoint_likely_in_supp': 'no', 'formulation_table_missing': 'no', 'notes': 'No extractable evidence related to OA or ibuprofen.', 'router_source_backend': 'pdf_local', 'router_source_ref': 'papers\\pdf\\10.1111_j.1476-5381.1996.tb15658.x__c160de855e.pdf', 'router_source_diagnostics': ['blocked:html_local:captcha', 'blocked:html_remote:captcha'], 'router_heuristic_signals': {'table_hits': 0, 'figure_hits': 0, 'endpoint_hits': 0, 'formulation_hits': 0}}"
paper_f13847b25cdb,10.1111/j.1567-1364.2009.00504.x,Ibuprofen reverts antifungal resistance on Candida albicans showing overexpression of CDR genes.,unresolved,0.0,unknown,unknown,[],missing_structured_and_pdf_router_source,"{'title': 'Ibuprofen reverts antifungal resistance on Candida albicans showing overexpression of CDR genes.', 'router_source_backend': 'missing', 'router_source_ref': '', 'router_source_diagnostics': []}"
paper_b1d6bef6a409,10.1111/j.1742-481x.2007.00308.x,A pilot (real-life) randomised clinical evaluation of a pain-relieving foam dressing: (ibuprofen-foam versus local best practice).,unresolved,0.0,unknown,unknown,[],missing_structured_and_pdf_router_source:blocked:html_local:captcha;blocked:html_remote:captcha,"{'title': 'A pilot (real-life) randomised clinical evaluation of a pain-relieving foam dressing: (ibuprofen-foam versus local best practice).', 'router_source_backend': 'missing', 'router_source_ref': '', 'router_source_diagnostics': ['blocked:html_local:captcha', 'blocked:html_remote:captcha']}"
paper_c7a4cc7e17d6,10.1111/j.1742-481x.2007.00312.x,"Less pain with Biatain-Ibu: initial findings from a randomised, controlled, double-blind clinical investigation on painful venous leg ulcers.",unresolved,0.2,unknown,unknown,"[{'field_name': 'device', 'modality': 'text', 'locator': 'uncertain', 'page': None, 'bbox': None, 'snippet': 'uncertain', 'source_ref': '10.1111/j.1742-481x.2007.00312.x', 'confidence': 0.7}, {'field_name': 'endpoint', 'modality': 'metadata', 'locator': 'uncertain', 'page': None, 'bbox': None, 'snippet': 'unknown', 'source_ref': '10.1111/j.1742-481x.2007.00312.x', 'confidence': 0.8}, {'field_name': 'formulation', 'modality': 'metadata', 'locator': 'unknown', 'page': None, 'bbox': None, 'snippet': 'unknown', 'source_ref': '10.1111/j.1742-481x.2007.00312.x', 'confidence': 0.7}]",The document appears to be primarily focused on clinical investigation findings but lacks specific mention of diffusion cell methodologies or detailed formulations.,"{'paper_type': 'clinical', 'mentions_ibuprofen': 'yes', 'mentions_diffusion_cell': 'no', 'franz_confirmed': 'no', 'where_diffusion_cell': 'uncertain', 'where_franz': 'uncertain', 'study_type': 'uncertain', 'barrier_category': 'uncertain', 'barrier_name_raw': 'uncertain', 'endpoint_found': 'uncertain', 'endpoint_time_found': 'uncertain', 'where_endpoint': 'uncertain', 'endpoint_carrier': 'unknown', 'endpoint_carrier_snippet': 'unknown', 'formulation_carrier': 'unknown', 'formulation_carrier_snippet': 'unknown', 'endpoint_likely_in_supp': 'uncertain', 'formulation_table_missing': 'uncertain', 'notes': 'The document appears to be primarily focused on clinical investigation findings but lacks specific mention of diffusion cell methodologies or detailed formulations.', 'router_source_backend': 'pdf_local', 'router_source_ref': 'papers\\pdf\\10.1111_j.1742-481x.2007.00312.x__9aff95be6a.pdf', 'router_source_diagnostics': ['blocked:html_local:captcha', 'blocked:html_remote:captcha'], 'router_heuristic_signals': {'table_hits': 0, 'figure_hits': 0, 'endpoint_hits': 0, 'formulation_hits': 0}}"
paper_b32454acf5e0,10.1111/j.2042-7158.1985.tb04926.x,"Absorption through human skin of ibuprofen and flurbiprofen; effect of dose variation, deposited drug films, occlusion and the penetration enhancer N-methyl-2-pyrrolidone.",unresolved,0.0,unknown,unknown,[],missing_structured_and_pdf_router_source,"{'title': 'Absorption through human skin of ibuprofen and flurbiprofen; effect of dose variation, deposited drug films, occlusion and the penetration enhancer N-methyl-2-pyrrolidone.', 'router_source_backend': 'missing', 'router_source_ref': '', 'router_source_diagnostics': []}"
paper_5728a1abee10,10.1111/j.2042-7158.2010.01090.x,Solubilisation of drugs within liposomal bilayers: alternatives to cholesterol as a membrane stabilising agent.,unresolved,0.0,unknown,unknown,[],missing_structured_and_pdf_router_source,"{'title': 'Solubilisation of drugs within liposomal bilayers: alternatives to cholesterol as a membrane stabilising agent.', 'router_source_backend': 'missing', 'router_source_ref': '', 'router_source_diagnostics': []}"
paper_c614a40d430f,10.1123/ijspp.2016-0382,The Impact of Central and Peripheral Cyclooxygenase Enzyme Inhibition on Exercise-Induced Elevations in Core Body Temperature.,mixed,0.69,narrative,table_text,"[{'field_name': 'endpoint', 'modality': 'text', 'locator': 'Results', 'page': None, 'bbox': None, 'snippet': 'A significantly lower peak TC was observed in IBU/APAP (38.8±0.4°C) versus CTRL (39.2±0.5°C)....', 'source_ref': '10.1123/ijspp.2016-0382', 'confidence': 0.8}, {'field_name': 'formulation', 'modality': 'table', 'locator': 'table_text', 'page': None, 'bbox': None, 'snippet': 'Table 1: Baseline characteristics of the subjects as well as their intake of test medications...', 'source_ref': '10.1123/ijspp.2016-0382', 'confidence': 0.7}]",Study investigates the effects of ibuprofen and acetaminophen on core body temperature during exercise.,"{'paper_type': 'primary_experiment', 'mentions_ibuprofen': 'yes', 'mentions_diffusion_cell': 'no', 'franz_confirmed': 'no', 'where_diffusion_cell': '', 'where_franz': '', 'study_type': 'uncertain', 'barrier_category': 'uncertain', 'barrier_name_raw': '', 'endpoint_found': 'yes', 'endpoint_time_found': 'no', 'where_endpoint': 'Results', 'endpoint_carrier': 'narrative', 'endpoint_carrier_snippet': 'A significantly lower peak TC was observed in IBU/APAP (38.8±0.4°C) versus CTRL (39.2±0.5°C)....', 'formulation_carrier': 'table_text', 'formulation_carrier_snippet': 'Table 1: Baseline characteristics of the subjects as well as their intake of test medications...', 'endpoint_likely_in_supp': 'no', 'formulation_table_missing': 'no', 'notes': 'Study investigates the effects of ibuprofen and acetaminophen on core body temperature during exercise.', 'router_source_backend': 'pdf_local', 'router_source_ref': 'papers\\pdf\\10.1123_ijspp.2016-0382__60e1a4e580.pdf', 'router_source_diagnostics': [], 'router_heuristic_signals': {}}"
paper_3c5fa1dd7b41,10.1124/jpet.111.183533,Oxidative stress mediates through apoptosis the anticancer effect of phospho-nonsteroidal anti-inflammatory drugs: implications for the role of oxidative stress in the action of anticancer agents.,unresolved,0.2,unknown,unknown,"[{'field_name': 'device', 'modality': 'text', 'locator': 'unknown', 'page': None, 'bbox': None, 'snippet': 'unknown', 'source_ref': '10.1124/jpet.111.183533', 'confidence': 0.7}, {'field_name': 'endpoint', 'modality': 'metadata', 'locator': 'unknown', 'page': None, 'bbox': None, 'snippet': 'unknown', 'source_ref': '10.1124/jpet.111.183533', 'confidence': 0.8}, {'field_name': 'formulation', 'modality': 'metadata', 'locator': 'unknown', 'page': None, 'bbox': None, 'snippet': 'unknown', 'source_ref': '10.1124/jpet.111.183533', 'confidence': 0.7}]","Lacks specific information about ibuprofen, diffusion cell, and endpoints.","{'paper_type': 'uncertain', 'mentions_ibuprofen': 'no', 'mentions_diffusion_cell': 'no', 'franz_confirmed': 'no', 'where_diffusion_cell': 'unknown', 'where_franz': 'unknown', 'study_type': 'uncertain', 'barrier_category': 'uncertain', 'barrier_name_raw': 'unknown', 'endpoint_found': 'no', 'endpoint_time_found': 'no', 'where_endpoint': 'unknown', 'endpoint_carrier': 'unknown', 'endpoint_carrier_snippet': 'unknown', 'formulation_carrier': 'unknown', 'formulation_carrier_snippet': 'unknown', 'endpoint_likely_in_supp': 'no', 'formulation_table_missing': 'no', 'notes': 'Lacks specific information about ibuprofen, diffusion cell, and endpoints.', 'router_source_backend': 'pdf_local', 'router_source_ref': 'papers\\pdf\\10.1124_jpet.111.183533__23b4d3c1b9.pdf', 'router_source_diagnostics': ['blocked:html_local:captcha', 'blocked:html_remote:captcha'], 'router_heuristic_signals': {'table_hits': 0, 'figure_hits': 0, 'endpoint_hits': 0, 'formulation_hits': 0}}"
paper_5c4c70848128,10.1128/aac.39.12.2615,"Use of decimal assay for additivity to demonstrate synergy in pair combinations of econazole, nikkomycin Z, and ibuprofen against Candida albicans in vitro.",unresolved,0.0,unknown,unknown,[],The document doesn't provide clear extractable evidence relevant to the formulation or diffusion methods.,"{'paper_type': 'uncertain', 'mentions_ibuprofen': 'yes', 'mentions_diffusion_cell': 'no', 'franz_confirmed': 'no', 'where_diffusion_cell': '', 'where_franz': '', 'study_type': 'uncertain', 'barrier_category': 'uncertain', 'barrier_name_raw': '', 'endpoint_found': 'no', 'endpoint_time_found': 'no', 'where_endpoint': '', 'endpoint_carrier': 'unknown', 'endpoint_carrier_snippet': '', 'formulation_carrier': 'unknown', 'formulation_carrier_snippet': '', 'endpoint_likely_in_supp': 'no', 'formulation_table_missing': 'uncertain', 'notes': ""The document doesn't provide clear extractable evidence relevant to the formulation or diffusion methods."", 'router_source_backend': 'pdf_local', 'router_source_ref': 'papers\\pdf\\10.1128_aac.39.12.2615__4a05fdc1ea.pdf', 'router_source_diagnostics': ['blocked:html_local:captcha', 'blocked:html_remote:captcha'], 'router_heuristic_signals': {'table_hits': 0, 'figure_hits': 0, 'endpoint_hits': 0, 'formulation_hits': 0}}"
paper_34659ff1ae7a,10.1128/iai.67.10.5076-5082.1999,Pseudomonas aeruginosa quorum-sensing signal molecule N-(3-oxododecanoyl)-L-homoserine lactone inhibits expression of P2Y receptors in cystic fibrosis tracheal gland cells.,unresolved,0.0,unknown,unknown,[],missing_structured_and_pdf_router_source:html_remote:HTTPError,"{'title': 'Pseudomonas aeruginosa quorum-sensing signal molecule N-(3-oxododecanoyl)-L-homoserine lactone inhibits expression of P2Y receptors in cystic fibrosis tracheal gland cells.', 'router_source_backend': 'missing', 'router_source_ref': '', 'router_source_diagnostics': ['html_remote:HTTPError']}"
paper_451c75edf732,10.1136/bmjopen-2011-000076,Non-steroidal anti-inflammatory drug (NSAID) related inhibition of aldosterone glucuronidation and arterial dysfunction in patients with rheumatoid arthritis: a cross-sectional clinical study.,unresolved,0.0,unknown,unknown,[],Insufficient extractable evidence from provided document text.,"{'paper_type': 'clinical', 'mentions_ibuprofen': 'yes', 'mentions_diffusion_cell': 'no', 'franz_confirmed': 'no', 'where_diffusion_cell': '', 'where_franz': '', 'study_type': 'uncertain', 'barrier_category': 'uncertain', 'barrier_name_raw': '', 'endpoint_found': 'uncertain', 'endpoint_time_found': 'uncertain', 'where_endpoint': '', 'endpoint_carrier': 'unknown', 'endpoint_carrier_snippet': '', 'formulation_carrier': 'unknown', 'formulation_carrier_snippet': '', 'endpoint_likely_in_supp': 'uncertain', 'formulation_table_missing': 'yes', 'notes': 'Insufficient extractable evidence from provided document text.', 'router_source_backend': 'pdf_local', 'router_source_ref': 'papers\\pdf\\10.1136_bmjopen-2011-000076__7fdc9eb4cf.pdf', 'router_source_diagnostics': ['blocked:html_local:captcha', 'blocked:html_remote:captcha'], 'router_heuristic_signals': {'table_hits': 0, 'figure_hits': 0, 'endpoint_hits': 0, 'formulation_hits': 0}}"
paper_96af5f187f65,10.1136/bmjopen-2025-113162,Study of topical anaesthetic for paediatric laser procedures (STAPLE): a protocol for a feasibility and pilot randomised controlled trial.,unresolved,0.0,unknown,unknown,[],Not clear if any relevant evidence regarding ibuprofen is present.,"{'paper_type': 'uncertain', 'mentions_ibuprofen': 'no', 'mentions_diffusion_cell': 'no', 'franz_confirmed': 'no', 'where_diffusion_cell': '', 'where_franz': '', 'study_type': 'uncertain', 'barrier_category': 'uncertain', 'barrier_name_raw': '', 'endpoint_found': 'no', 'endpoint_time_found': 'no', 'where_endpoint': '', 'endpoint_carrier': 'unknown', 'endpoint_carrier_snippet': '', 'formulation_carrier': 'unknown', 'formulation_carrier_snippet': '', 'endpoint_likely_in_supp': 'no', 'formulation_table_missing': 'uncertain', 'notes': 'Not clear if any relevant evidence regarding ibuprofen is present.', 'router_source_backend': 'pdf_local', 'router_source_ref': 'papers\\pdf\\10.1136_bmjopen-2025-113162__d0695cc0d3.pdf', 'router_source_diagnostics': ['blocked:html_local:captcha', 'blocked:html_remote:captcha'], 'router_heuristic_signals': {'table_hits': 0, 'figure_hits': 0, 'endpoint_hits': 0, 'formulation_hits': 0}}"
paper_78530353a8d5,10.1152/ajplung.00132.2011,Chronic hypoxia-induced acid-sensitive ion channel expression in chemoafferent neurons contributes to chemoreceptor hypersensitivity.,unresolved,0.0,unknown,unknown,[],missing_structured_and_pdf_router_source:blocked:html_local:captcha;blocked:html_remote:captcha,"{'title': 'Chronic hypoxia-induced acid-sensitive ion channel expression in chemoafferent neurons contributes to chemoreceptor hypersensitivity.', 'router_source_backend': 'missing', 'router_source_ref': '', 'router_source_diagnostics': ['blocked:html_local:captcha', 'blocked:html_remote:captcha']}"
paper_e4cd80d62070,10.1155/2012/393681,Interleukin-1α Induction in Human Keratinocytes (HaCaT): An In Vitro Model for Chemoprevention in Skin.,unresolved,0.0,unknown,unknown,[],missing_structured_and_pdf_router_source:blocked:html_local:captcha;blocked:html_remote:captcha,"{'title': 'Interleukin-1α Induction in Human Keratinocytes (HaCaT): An In Vitro Model for Chemoprevention in Skin.', 'router_source_backend': 'missing', 'router_source_ref': '', 'router_source_diagnostics': ['blocked:html_local:captcha', 'blocked:html_remote:captcha']}"
paper_6412a6a4ef9e,10.1155/2012/505842,"A synoviocyte model for osteoarthritis and rheumatoid arthritis: response to Ibuprofen, betamethasone, and ginger extract-a cross-sectional in vitro study.",unresolved,0.2,unknown,unknown,"[{'field_name': 'device', 'modality': 'text', 'locator': 'uncertain', 'page': None, 'bbox': None, 'snippet': 'uncertain', 'source_ref': '10.1155/2012/505842', 'confidence': 0.7}, {'field_name': 'endpoint', 'modality': 'metadata', 'locator': 'uncertain', 'page': None, 'bbox': None, 'snippet': 'uncertain', 'source_ref': '10.1155/2012/505842', 'confidence': 0.8}, {'field_name': 'formulation', 'modality': 'metadata', 'locator': 'unknown', 'page': None, 'bbox': None, 'snippet': 'uncertain', 'source_ref': '10.1155/2012/505842', 'confidence': 0.7}]",Insufficient detail available in the provided text.,"{'paper_type': 'primary_experiment', 'mentions_ibuprofen': 'yes', 'mentions_diffusion_cell': 'no', 'franz_confirmed': 'no', 'where_diffusion_cell': 'uncertain', 'where_franz': 'uncertain', 'study_type': 'uncertain', 'barrier_category': 'uncertain', 'barrier_name_raw': 'uncertain', 'endpoint_found': 'uncertain', 'endpoint_time_found': 'uncertain', 'where_endpoint': 'uncertain', 'endpoint_carrier': 'unknown', 'endpoint_carrier_snippet': 'uncertain', 'formulation_carrier': 'unknown', 'formulation_carrier_snippet': 'uncertain', 'endpoint_likely_in_supp': 'uncertain', 'formulation_table_missing': 'uncertain', 'notes': 'Insufficient detail available in the provided text.', 'router_source_backend': 'pdf_local', 'router_source_ref': 'papers\\pdf\\10.1155_2012_505842__b13c1be23d.pdf', 'router_source_diagnostics': ['blocked:html_local:captcha', 'blocked:html_remote:captcha'], 'router_heuristic_signals': {'table_hits': 0, 'figure_hits': 0, 'endpoint_hits': 0, 'formulation_hits': 0}}"
paper_228442044048,10.1155/2013/781289,Observation on pain release by long-round needle therapy in knee osteoarthritis related with meridian-sinews theory.,unresolved,0.0,unknown,unknown,[],missing_structured_and_pdf_router_source:blocked:html_local:captcha;blocked:html_remote:captcha,"{'title': 'Observation on pain release by long-round needle therapy in knee osteoarthritis related with meridian-sinews theory.', 'router_source_backend': 'missing', 'router_source_ref': '', 'router_source_diagnostics': ['blocked:html_local:captcha', 'blocked:html_remote:captcha']}"
paper_9b42388c1069,10.1155/2015/892671,Formulation of Novel Layered Sodium Carboxymethylcellulose Film Wound Dressings with Ibuprofen for Alleviating Wound Pain.,unresolved,0.0,unknown,unknown,[],"Paper discusses layered sodium carboxymethylcellulose film wound dressings with ibuprofen, but no clear endpoints, diffusion cell details, or formulation data are available in the provided text.","{'paper_type': 'other', 'mentions_ibuprofen': 'yes', 'mentions_diffusion_cell': 'no', 'franz_confirmed': 'no', 'where_diffusion_cell': '', 'where_franz': '', 'study_type': 'uncertain', 'barrier_category': 'uncertain', 'barrier_name_raw': '', 'endpoint_found': 'uncertain', 'endpoint_time_found': 'uncertain', 'where_endpoint': '', 'endpoint_carrier': 'unknown', 'endpoint_carrier_snippet': '', 'formulation_carrier': 'unknown', 'formulation_carrier_snippet': '', 'endpoint_likely_in_supp': 'uncertain', 'formulation_table_missing': 'uncertain', 'notes': 'Paper discusses layered sodium carboxymethylcellulose film wound dressings with ibuprofen, but no clear endpoints, diffusion cell details, or formulation data are available in the provided text.', 'router_source_backend': 'pdf_local', 'router_source_ref': 'papers\\pdf\\10.1155_2015_892671__24c19ba2c6.pdf', 'router_source_diagnostics': ['blocked:html_local:captcha', 'blocked:html_remote:captcha'], 'router_heuristic_signals': {'table_hits': 0, 'figure_hits': 0, 'endpoint_hits': 0, 'formulation_hits': 0}}"
paper_e4a5821bc88a,10.1155/2020/8672850,"Inflammation, HIV, and Immune Quiescence: Leveraging on Immunomodulatory Products to Reduce HIV Susceptibility.",unresolved,0.0,unknown,unknown,[],missing_structured_and_pdf_router_source:blocked:html_local:captcha;blocked:html_remote:captcha,"{'title': 'Inflammation, HIV, and Immune Quiescence: Leveraging on Immunomodulatory Products to Reduce HIV Susceptibility.', 'router_source_backend': 'missing', 'router_source_ref': '', 'router_source_diagnostics': ['blocked:html_local:captcha', 'blocked:html_remote:captcha']}"
paper_a24037db3dff,10.1155/2020/8885338,Repurposing of Drugs for Antibacterial Activities on Selected ESKAPE Bacteria <i>Staphylococcus aureus</i> and <i>Pseudomonas aeruginosa</i>.,unresolved,0.2,unknown,unknown,"[{'field_name': 'device', 'modality': 'text', 'locator': 'unknown', 'page': None, 'bbox': None, 'snippet': 'unknown', 'source_ref': '10.1155/2020/8885338', 'confidence': 0.7}, {'field_name': 'endpoint', 'modality': 'metadata', 'locator': 'unknown', 'page': None, 'bbox': None, 'snippet': 'unknown', 'source_ref': '10.1155/2020/8885338', 'confidence': 0.8}, {'field_name': 'formulation', 'modality': 'metadata', 'locator': 'unknown', 'page': None, 'bbox': None, 'snippet': 'unknown', 'source_ref': '10.1155/2020/8885338', 'confidence': 0.7}]",This paper appears to focus on antibacterial activities and does not mention ibuprofen or related dermal formulations.,"{'paper_type': 'other', 'mentions_ibuprofen': 'no', 'mentions_diffusion_cell': 'no', 'franz_confirmed': 'no', 'where_diffusion_cell': 'unknown', 'where_franz': 'unknown', 'study_type': 'uncertain', 'barrier_category': 'uncertain', 'barrier_name_raw': 'unknown', 'endpoint_found': 'no', 'endpoint_time_found': 'no', 'where_endpoint': 'unknown', 'endpoint_carrier': 'unknown', 'endpoint_carrier_snippet': 'unknown', 'formulation_carrier': 'unknown', 'formulation_carrier_snippet': 'unknown', 'endpoint_likely_in_supp': 'no', 'formulation_table_missing': 'no', 'notes': 'This paper appears to focus on antibacterial activities and does not mention ibuprofen or related dermal formulations.', 'router_source_backend': 'pdf_local', 'router_source_ref': 'papers\\pdf\\10.1155_2020_8885338__d8d2b6ceb8.pdf', 'router_source_diagnostics': ['blocked:html_local:captcha', 'blocked:html_remote:captcha'], 'router_heuristic_signals': {'table_hits': 0, 'figure_hits': 0, 'endpoint_hits': 0, 'formulation_hits': 0}}"
paper_8f2dbfa00626,10.1155/2022/1020504,The Healing Effects of Piano Practice-Induced Hand Muscle Injury.,unresolved,0.0,unknown,unknown,[],missing_structured_and_pdf_router_source:blocked:html_local:captcha;blocked:html_remote:captcha,"{'title': 'The Healing Effects of Piano Practice-Induced Hand Muscle Injury.', 'router_source_backend': 'missing', 'router_source_ref': '', 'router_source_diagnostics': ['blocked:html_local:captcha', 'blocked:html_remote:captcha']}"
