paper_id,doi,title,route,route_confidence,endpoint_carrier,formulation_carrier,anchor_evidence,notes,raw_labels
paper_18ff669a9da4,10.2147/ijn.s34723,Ibuprofen delivered by poly(lactic-co-glycolic acid) (PLGA) nanoparticles to human gastric cancer cells exerts antiproliferative activity at very low concentrations.,unresolved,0.0,unknown,unknown,[],,"{'paper_type': 'uncertain', 'mentions_ibuprofen': 'yes', 'mentions_diffusion_cell': 'no', 'franz_confirmed': 'no', 'where_diffusion_cell': '', 'where_franz': '', 'study_type': 'uncertain', 'barrier_category': 'uncertain', 'barrier_name_raw': '', 'endpoint_found': 'uncertain', 'endpoint_time_found': 'uncertain', 'where_endpoint': '', 'endpoint_carrier': 'unknown', 'endpoint_carrier_snippet': '', 'formulation_carrier': 'unknown', 'formulation_carrier_snippet': '', 'endpoint_likely_in_supp': 'uncertain', 'formulation_table_missing': 'uncertain', 'notes': '', 'router_source_backend': 'pdf_local', 'router_source_ref': 'papers\\pdf\\10.2147_ijn.s34723__d7622c57e9.pdf', 'router_source_diagnostics': ['blocked:html_local:captcha', 'blocked:html_remote:captcha'], 'router_heuristic_signals': {'table_hits': 0, 'figure_hits': 0, 'endpoint_hits': 0, 'formulation_hits': 0}}"
paper_606e9f23a611,10.2147/ijn.s504924,An Injectable Ibuprofen Sustained-Release Composite Hydrogel System Effectively Accelerates Diabetic Wound Healing via Anti-Inflammatory Effects and Angiogenesis.,unresolved,0.0,unknown,unknown,[],,"{'paper_type': 'primary_experiment', 'mentions_ibuprofen': 'yes', 'mentions_diffusion_cell': 'no', 'franz_confirmed': 'no', 'where_diffusion_cell': '', 'where_franz': '', 'study_type': 'uncertain', 'barrier_category': 'uncertain', 'barrier_name_raw': '', 'endpoint_found': 'uncertain', 'endpoint_time_found': 'uncertain', 'where_endpoint': '', 'endpoint_carrier': 'unknown', 'endpoint_carrier_snippet': '', 'formulation_carrier': 'unknown', 'formulation_carrier_snippet': '', 'endpoint_likely_in_supp': 'no', 'formulation_table_missing': 'uncertain', 'notes': '', 'router_source_backend': 'pdf_local', 'router_source_ref': 'papers\\pdf\\10.2147_ijn.s504924__37e9c77cf3.pdf', 'router_source_diagnostics': ['blocked:html_local:captcha', 'blocked:html_remote:captcha'], 'router_heuristic_signals': {'table_hits': 0, 'figure_hits': 0, 'endpoint_hits': 0, 'formulation_hits': 0}}"
paper_45486db2b1c3,10.2147/ijn.s55943,Multifunctional materials for bone cancer treatment.,unresolved,0.0,unknown,unknown,[],No relevant extractable evidence appears in the text provided.,"{'paper_type': 'uncertain', 'mentions_ibuprofen': 'no', 'mentions_diffusion_cell': 'no', 'franz_confirmed': 'no', 'where_diffusion_cell': '', 'where_franz': '', 'study_type': 'uncertain', 'barrier_category': 'uncertain', 'barrier_name_raw': '', 'endpoint_found': 'no', 'endpoint_time_found': 'no', 'where_endpoint': '', 'endpoint_carrier': 'unknown', 'endpoint_carrier_snippet': '', 'formulation_carrier': 'unknown', 'formulation_carrier_snippet': '', 'endpoint_likely_in_supp': 'no', 'formulation_table_missing': 'uncertain', 'notes': 'No relevant extractable evidence appears in the text provided.', 'router_source_backend': 'pdf_local', 'router_source_ref': 'papers\\pdf\\10.2147_ijn.s55943__af3d9037e6.pdf', 'router_source_diagnostics': ['blocked:html_local:captcha', 'blocked:html_remote:captcha'], 'router_heuristic_signals': {'table_hits': 0, 'figure_hits': 0, 'endpoint_hits': 0, 'formulation_hits': 0}}"
paper_7a3820b52172,10.2147/jir.s460161,Role of Inflammation in the Development of COVID-19 to Parkinson's Disease.,unresolved,0.0,unknown,unknown,[],missing_structured_and_pdf_router_source:blocked:html_local:captcha;blocked:html_remote:captcha,"{'title': ""Role of Inflammation in the Development of COVID-19 to Parkinson's Disease."", 'router_source_backend': 'missing', 'router_source_ref': '', 'router_source_diagnostics': ['blocked:html_local:captcha', 'blocked:html_remote:captcha']}"
paper_d4cf5b5b9b1d,10.2147/jpr.s262390,Comparison of Skin Permeation and Putative Anti-Inflammatory Activity of Commercially Available Topical Products Containing Ibuprofen and Diclofenac.,unresolved,0.0,unknown,unknown,[],missing_structured_and_pdf_router_source:blocked:html_local:captcha;blocked:html_remote:captcha,"{'title': 'Comparison of Skin Permeation and Putative Anti-Inflammatory Activity of Commercially Available Topical Products Containing Ibuprofen and Diclofenac.', 'router_source_backend': 'missing', 'router_source_ref': '', 'router_source_diagnostics': ['blocked:html_local:captcha', 'blocked:html_remote:captcha']}"
paper_6aba3c9f02a6,10.2147/jpr.s36916,Effects of NSAIDs and paracetamol (acetaminophen) on protein kinase C epsilon translocation and on substance P synthesis and release in cultured sensory neurons.,unresolved,0.0,unknown,unknown,[],Insufficient information extracted from the document.,"{'paper_type': 'uncertain', 'mentions_ibuprofen': 'no', 'mentions_diffusion_cell': 'no', 'franz_confirmed': 'no', 'where_diffusion_cell': '', 'where_franz': '', 'study_type': 'uncertain', 'barrier_category': 'uncertain', 'barrier_name_raw': '', 'endpoint_found': 'no', 'endpoint_time_found': 'no', 'where_endpoint': '', 'endpoint_carrier': 'unknown', 'endpoint_carrier_snippet': '', 'formulation_carrier': 'unknown', 'formulation_carrier_snippet': '', 'endpoint_likely_in_supp': 'no', 'formulation_table_missing': 'uncertain', 'notes': 'Insufficient information extracted from the document.', 'router_source_backend': 'pdf_local', 'router_source_ref': 'papers\\pdf\\10.2147_jpr.s36916__4d41732ecd.pdf', 'router_source_diagnostics': ['blocked:html_local:captcha', 'blocked:html_remote:captcha'], 'router_heuristic_signals': {'table_hits': 0, 'figure_hits': 0, 'endpoint_hits': 0, 'formulation_hits': 0}}"
paper_0b8b14cc1929,10.2147/jpr.s419927,Acupuncture Relieves Cervical Spondylosis Radiculopathy by Regulating Spinal Microglia Activation Through MAPK Signaling Pathway in Rats.,unresolved,0.0,unknown,unknown,[],missing_structured_and_pdf_router_source:blocked:html_local:captcha;blocked:html_remote:captcha,"{'title': 'Acupuncture Relieves Cervical Spondylosis Radiculopathy by Regulating Spinal Microglia Activation Through MAPK Signaling Pathway in Rats.', 'router_source_backend': 'missing', 'router_source_ref': '', 'router_source_diagnostics': ['blocked:html_local:captcha', 'blocked:html_remote:captcha']}"
paper_65a9b96d9604,10.2147/jpr.s69511,"Postoperative pain management with transdermal fentanyl after forefoot surgery: a randomized, placebo-controlled study.",unresolved,0.2,unknown,unknown,"[{'field_name': 'device', 'modality': 'text', 'locator': 'uncertain', 'page': None, 'bbox': None, 'snippet': 'uncertain', 'source_ref': '10.2147/jpr.s69511', 'confidence': 0.7}, {'field_name': 'endpoint', 'modality': 'metadata', 'locator': 'uncertain', 'page': None, 'bbox': None, 'snippet': 'unknown', 'source_ref': '10.2147/jpr.s69511', 'confidence': 0.8}, {'field_name': 'formulation', 'modality': 'metadata', 'locator': 'unknown', 'page': None, 'bbox': None, 'snippet': 'unknown', 'source_ref': '10.2147/jpr.s69511', 'confidence': 0.7}]",No references to ibuprofen or related formulations are present in the content provided.,"{'paper_type': 'other', 'mentions_ibuprofen': 'no', 'mentions_diffusion_cell': 'no', 'franz_confirmed': 'no', 'where_diffusion_cell': 'uncertain', 'where_franz': 'uncertain', 'study_type': 'uncertain', 'barrier_category': 'uncertain', 'barrier_name_raw': 'uncertain', 'endpoint_found': 'no', 'endpoint_time_found': 'no', 'where_endpoint': 'uncertain', 'endpoint_carrier': 'unknown', 'endpoint_carrier_snippet': 'unknown', 'formulation_carrier': 'unknown', 'formulation_carrier_snippet': 'unknown', 'endpoint_likely_in_supp': 'no', 'formulation_table_missing': 'no', 'notes': 'No references to ibuprofen or related formulations are present in the content provided.', 'router_source_backend': 'pdf_local', 'router_source_ref': 'papers\\pdf\\10.2147_jpr.s69511__7a81bb81bb.pdf', 'router_source_diagnostics': ['blocked:html_local:captcha', 'blocked:html_remote:captcha'], 'router_heuristic_signals': {'table_hits': 0, 'figure_hits': 0, 'endpoint_hits': 0, 'formulation_hits': 0}}"
paper_85c8b41cca98,10.2147/oarrr.s59564,Use of ibuprofen sustained release for treating osteoarthritic pain: findings from 15 general medical practices in Egypt.,unresolved,0.0,unknown,unknown,[],Document primarily contains metadata with no extractable evidence.,"{'paper_type': 'other', 'mentions_ibuprofen': 'yes', 'mentions_diffusion_cell': 'no', 'franz_confirmed': 'no', 'where_diffusion_cell': '', 'where_franz': '', 'study_type': 'uncertain', 'barrier_category': 'uncertain', 'barrier_name_raw': '', 'endpoint_found': 'no', 'endpoint_time_found': 'no', 'where_endpoint': '', 'endpoint_carrier': 'unknown', 'endpoint_carrier_snippet': '', 'formulation_carrier': 'unknown', 'formulation_carrier_snippet': '', 'endpoint_likely_in_supp': 'uncertain', 'formulation_table_missing': 'uncertain', 'notes': 'Document primarily contains metadata with no extractable evidence.', 'router_source_backend': 'pdf_local', 'router_source_ref': 'papers\\pdf\\10.2147_oarrr.s59564__b131ee7506.pdf', 'router_source_diagnostics': ['blocked:html_local:captcha', 'blocked:html_remote:captcha'], 'router_heuristic_signals': {'table_hits': 0, 'figure_hits': 0, 'endpoint_hits': 0, 'formulation_hits': 0}}"
paper_a7327aa84d6a,10.2166/wst.2008.667,Treatment of yellow water by membrane separations and advanced oxidation methods.,unresolved,0.0,unknown,unknown,[],missing_structured_and_pdf_router_source,"{'title': 'Treatment of yellow water by membrane separations and advanced oxidation methods.', 'router_source_backend': 'missing', 'router_source_ref': '', 'router_source_diagnostics': []}"
paper_0c2de027ee7f,10.2166/wst.2011.123,Comparison of PPCPs removal on a parallel-operated MBR and AS system and evaluation of effluent post-treatment on vertical flow reed beds.,unresolved,0.0,unknown,unknown,[],missing_structured_and_pdf_router_source,"{'title': 'Comparison of PPCPs removal on a parallel-operated MBR and AS system and evaluation of effluent post-treatment on vertical flow reed beds.', 'router_source_backend': 'missing', 'router_source_ref': '', 'router_source_diagnostics': []}"
paper_d8004ae520cd,10.2174/1389450111314090015,Niosomes encapsulating Ibuprofen-cyclodextrin complexes: preparation and characterization.,unresolved,0.0,unknown,unknown,[],missing_structured_and_pdf_router_source,"{'title': 'Niosomes encapsulating Ibuprofen-cyclodextrin complexes: preparation and characterization.', 'router_source_backend': 'missing', 'router_source_ref': '', 'router_source_diagnostics': []}"
paper_094a092750ca,10.2174/15672018113109990056,"Influence of drug incorporation, temperature and storage time on the pH, textural and rheological properties of different poloxamer hydrogels.",unresolved,0.0,unknown,unknown,[],missing_structured_and_pdf_router_source,"{'title': 'Influence of drug incorporation, temperature and storage time on the pH, textural and rheological properties of different poloxamer hydrogels.', 'router_source_backend': 'missing', 'router_source_ref': '', 'router_source_diagnostics': []}"
paper_801c3bb02123,10.22037/ijpr.2019.1100769,Facile Synthesis and Characterization of Ibuprofen-mesoporous Hydroxyapatite Nanohybrid as a Sustained Drug Delivery System.,unresolved,0.2,unknown,unknown,"[{'field_name': 'device', 'modality': 'text', 'locator': 'unknown', 'page': None, 'bbox': None, 'snippet': 'unknown', 'source_ref': '10.22037/ijpr.2019.1100769', 'confidence': 0.7}, {'field_name': 'endpoint', 'modality': 'metadata', 'locator': 'unknown', 'page': None, 'bbox': None, 'snippet': 'unknown', 'source_ref': '10.22037/ijpr.2019.1100769', 'confidence': 0.8}, {'field_name': 'formulation', 'modality': 'metadata', 'locator': 'unknown', 'page': None, 'bbox': None, 'snippet': 'unknown', 'source_ref': '10.22037/ijpr.2019.1100769', 'confidence': 0.7}]",Document not fully extracted; no structured evidence from the visible text.,"{'paper_type': 'uncertain', 'mentions_ibuprofen': 'yes', 'mentions_diffusion_cell': 'uncertain', 'franz_confirmed': 'uncertain', 'where_diffusion_cell': 'unknown', 'where_franz': 'unknown', 'study_type': 'uncertain', 'barrier_category': 'uncertain', 'barrier_name_raw': 'unknown', 'endpoint_found': 'uncertain', 'endpoint_time_found': 'uncertain', 'where_endpoint': 'unknown', 'endpoint_carrier': 'unknown', 'endpoint_carrier_snippet': 'unknown', 'formulation_carrier': 'unknown', 'formulation_carrier_snippet': 'unknown', 'endpoint_likely_in_supp': 'uncertain', 'formulation_table_missing': 'uncertain', 'notes': 'Document not fully extracted; no structured evidence from the visible text.', 'router_source_backend': 'pdf_local', 'router_source_ref': 'papers\\pdf\\10.22037_ijpr.2019.1100769__7ab51b8a1c.pdf', 'router_source_diagnostics': ['blocked:html_local:captcha', 'blocked:html_remote:captcha'], 'router_heuristic_signals': {'table_hits': 0, 'figure_hits': 0, 'endpoint_hits': 0, 'formulation_hits': 0}}"
paper_d40fecc1d71c,10.22037/ijpr.2020.112887.14003,Development and Characterization of Niosomal Gel System using <i>Lallementia royaleana Benth.</i> mucilage for the treatment of Rheumatoid Arthritis.,unresolved,0.0,unknown,unknown,[],The document contains mostly blank or general information pages with no specific research data visible.,"{'paper_type': 'uncertain', 'mentions_ibuprofen': 'no', 'mentions_diffusion_cell': 'no', 'franz_confirmed': 'no', 'where_diffusion_cell': '', 'where_franz': '', 'study_type': 'uncertain', 'barrier_category': 'uncertain', 'barrier_name_raw': '', 'endpoint_found': 'uncertain', 'endpoint_time_found': 'uncertain', 'where_endpoint': '', 'endpoint_carrier': 'unknown', 'endpoint_carrier_snippet': '', 'formulation_carrier': 'unknown', 'formulation_carrier_snippet': '', 'endpoint_likely_in_supp': 'uncertain', 'formulation_table_missing': 'uncertain', 'notes': 'The document contains mostly blank or general information pages with no specific research data visible.', 'router_source_backend': 'pdf_local', 'router_source_ref': 'papers\\pdf\\10.22037_ijpr.2020.112887.14003__d027ba353e.pdf', 'router_source_diagnostics': ['blocked:html_local:captcha', 'blocked:html_remote:captcha'], 'router_heuristic_signals': {'table_hits': 0, 'figure_hits': 0, 'endpoint_hits': 0, 'formulation_hits': 0}}"
paper_dd3f5c47322d,10.2337/diab.41.5.620,"Ionic, electrical, and secretory effects of inhibitors of arachidonic acid metabolism in mouse pancreatic beta-cells.",unresolved,0.0,unknown,unknown,[],missing_structured_and_pdf_router_source,"{'title': 'Ionic, electrical, and secretory effects of inhibitors of arachidonic acid metabolism in mouse pancreatic beta-cells.', 'router_source_backend': 'missing', 'router_source_ref': '', 'router_source_diagnostics': []}"
paper_183c78d24024,10.3109/02652048.2015.1028495,Mass transport model through the skin by microencapsulation system.,unresolved,0.0,unknown,unknown,[],missing_structured_and_pdf_router_source,"{'title': 'Mass transport model through the skin by microencapsulation system.', 'router_source_backend': 'missing', 'router_source_ref': '', 'router_source_diagnostics': []}"
paper_7f07515730fe,10.3109/03639041003695071,Physicochemical studies of binary eutectic of ibuprofen and ketoprofen for enhanced transdermal drug delivery.,unresolved,0.0,unknown,unknown,[],missing_structured_and_pdf_router_source,"{'title': 'Physicochemical studies of binary eutectic of ibuprofen and ketoprofen for enhanced transdermal drug delivery.', 'router_source_backend': 'missing', 'router_source_ref': '', 'router_source_diagnostics': []}"
paper_b730088c71ee,10.3109/03639045.2011.653363,A comparative study of vitamin E TPGS/HPMC supersaturated system and other solubilizer/polymer combinations to enhance the permeability of a poorly soluble drug through the skin.,unresolved,0.0,unknown,unknown,[],missing_structured_and_pdf_router_source,"{'title': 'A comparative study of vitamin E TPGS/HPMC supersaturated system and other solubilizer/polymer combinations to enhance the permeability of a poorly soluble drug through the skin.', 'router_source_backend': 'missing', 'router_source_ref': '', 'router_source_diagnostics': []}"
paper_ce25f0ff5437,10.3109/03639045.2015.1107095,Effect of borneol on the transdermal permeation of drugs with differing lipophilicity and molecular organization of stratum corneum lipids.,unresolved,0.0,unknown,unknown,[],missing_structured_and_pdf_router_source,"{'title': 'Effect of borneol on the transdermal permeation of drugs with differing lipophilicity and molecular organization of stratum corneum lipids.', 'router_source_backend': 'missing', 'router_source_ref': '', 'router_source_diagnostics': []}"
paper_752460399665,10.3109/08982100903014994,Span and Tween neutral and pH-sensitive vesicles: characterization and in vitro skin permeation.,unresolved,0.0,unknown,unknown,[],missing_structured_and_pdf_router_source,"{'title': 'Span and Tween neutral and pH-sensitive vesicles: characterization and in vitro skin permeation.', 'router_source_backend': 'missing', 'router_source_ref': '', 'router_source_diagnostics': []}"
paper_cf80a4c575da,10.3109/10428194.2010.486877,Statin and non-steroidal anti-inflammatory drug use in relation to clinical outcome among patients with Rai stage 0 chronic lymphocytic leukemia.,unresolved,0.0,unknown,unknown,[],missing_structured_and_pdf_router_source:blocked:html_local:captcha;blocked:html_remote:captcha,"{'title': 'Statin and non-steroidal anti-inflammatory drug use in relation to clinical outcome among patients with Rai stage 0 chronic lymphocytic leukemia.', 'router_source_backend': 'missing', 'router_source_ref': '', 'router_source_diagnostics': ['blocked:html_local:captcha', 'blocked:html_remote:captcha']}"
paper_4344128a5b90,10.3109/10717544.2013.873837,Nonionic surfactant-based vesicular system for transdermal drug delivery.,unresolved,0.0,unknown,unknown,[],missing_structured_and_pdf_router_source,"{'title': 'Nonionic surfactant-based vesicular system for transdermal drug delivery.', 'router_source_backend': 'missing', 'router_source_ref': '', 'router_source_diagnostics': []}"
paper_837b9f34dbe4,10.3109/10837450.2010.513987,Transdermal permeation of novel n-acetyl-glucosamine/NSAIDs mutual prodrugs.,unresolved,0.0,unknown,unknown,[],missing_structured_and_pdf_router_source,"{'title': 'Transdermal permeation of novel n-acetyl-glucosamine/NSAIDs mutual prodrugs.', 'router_source_backend': 'missing', 'router_source_ref': '', 'router_source_diagnostics': []}"
paper_01a7568de553,10.3109/10837450.2013.860548,Quality by design approach to prepare oleoyl alginate derivative and its use in transdermal delivery.,unresolved,0.0,unknown,unknown,[],missing_structured_and_pdf_router_source,"{'title': 'Quality by design approach to prepare oleoyl alginate derivative and its use in transdermal delivery.', 'router_source_backend': 'missing', 'router_source_ref': '', 'router_source_diagnostics': []}"
paper_d9ee953557df,10.3389/fbioe.2020.00708,Thermosensitive Micellar Hydrogels as Vehicles to Deliver Drugs With Different Wettability.,unresolved,0.0,unknown,unknown,[],Content does not provide clear evidence for any specific extraction or analysis.,"{'paper_type': 'uncertain', 'mentions_ibuprofen': 'no', 'mentions_diffusion_cell': 'no', 'franz_confirmed': 'no', 'where_diffusion_cell': '', 'where_franz': '', 'study_type': 'uncertain', 'barrier_category': 'uncertain', 'barrier_name_raw': '', 'endpoint_found': 'no', 'endpoint_time_found': 'no', 'where_endpoint': '', 'endpoint_carrier': 'unknown', 'endpoint_carrier_snippet': '', 'formulation_carrier': 'unknown', 'formulation_carrier_snippet': '', 'endpoint_likely_in_supp': 'no', 'formulation_table_missing': 'uncertain', 'notes': 'Content does not provide clear evidence for any specific extraction or analysis.', 'router_source_backend': 'pdf_local', 'router_source_ref': 'papers\\pdf\\10.3389_fbioe.2020.00708__37713f8569.pdf', 'router_source_diagnostics': ['blocked:html_local:captcha', 'blocked:html_remote:captcha'], 'router_heuristic_signals': {'table_hits': 0, 'figure_hits': 0, 'endpoint_hits': 0, 'formulation_hits': 0}}"
paper_f03f8905410c,10.3389/fchem.2021.767923,Green Fabrication and Release Mechanisms of pH-Sensitive Chitosan-Ibuprofen Aerogels for Controlled Transdermal Delivery of Ibuprofen.,figure,0.81,figure,narrative,"[{'field_name': 'device', 'modality': 'text', 'locator': 'Section 2.8 In Vitro Evaluation of Skin Permeation', 'page': None, 'bbox': None, 'snippet': 'Section 2.8 In Vitro Evaluation of Skin Permeation', 'source_ref': '10.3389/fchem.2021.767923', 'confidence': 0.7}, {'field_name': 'endpoint', 'modality': 'figure', 'locator': 'Figure 7C and Table 1', 'page': None, 'bbox': None, 'snippet': 'the cumulative release amounts of ibuprofen permeated through porcine skin at different pHs of PBS solution were increased slowly in 72 h', 'source_ref': '10.3389/fchem.2021.767923', 'confidence': 0.8}, {'field_name': 'formulation', 'modality': 'text', 'locator': 'narrative', 'page': None, 'bbox': None, 'snippet': 'chitosan–ibuprofen aerogels were synthesized by a two-step procedure', 'source_ref': '10.3389/fchem.2021.767923', 'confidence': 0.7}]","The study provides a detailed characterization of transdermal ibuprofen delivery using chitosan-aerogels, including in vitro release mechanisms and swelling behavior.","{'paper_type': 'primary_experiment', 'mentions_ibuprofen': 'yes', 'mentions_diffusion_cell': 'yes', 'franz_confirmed': 'yes', 'where_diffusion_cell': 'Section 2.8 In Vitro Evaluation of Skin Permeation', 'where_franz': 'Section 2.8 In Vitro Evaluation of Skin Permeation', 'study_type': 'IVPT', 'barrier_category': 'skin', 'barrier_name_raw': 'porcine skin', 'endpoint_found': 'yes', 'endpoint_time_found': 'yes', 'where_endpoint': 'Figure 7C and Table 1', 'endpoint_carrier': 'figure', 'endpoint_carrier_snippet': 'the cumulative release amounts of ibuprofen permeated through porcine skin at different pHs of PBS solution were increased slowly in 72 h', 'formulation_carrier': 'narrative', 'formulation_carrier_snippet': 'chitosan–ibuprofen aerogels were synthesized by a two-step procedure', 'endpoint_likely_in_supp': 'no', 'formulation_table_missing': 'no', 'notes': 'The study provides a detailed characterization of transdermal ibuprofen delivery using chitosan-aerogels, including in vitro release mechanisms and swelling behavior.', 'router_source_backend': 'pdf_local', 'router_source_ref': 'papers\\pdf\\10.3389_fchem.2021.767923__210f2ad6ad.pdf', 'router_source_diagnostics': ['blocked:html_local:captcha', 'blocked:html_remote:captcha'], 'router_heuristic_signals': {}}"
paper_fb74094c5234,10.3389/fchem.2024.1369542,"Investigation of the synthesis, gelation potential, and drug-loading capacities of two novel amides.",unresolved,0.0,unknown,unknown,[],,"{'paper_type': 'uncertain', 'mentions_ibuprofen': 'no', 'mentions_diffusion_cell': 'no', 'franz_confirmed': 'no', 'where_diffusion_cell': '', 'where_franz': '', 'study_type': 'uncertain', 'barrier_category': 'uncertain', 'barrier_name_raw': '', 'endpoint_found': 'no', 'endpoint_time_found': 'no', 'where_endpoint': '', 'endpoint_carrier': 'unknown', 'endpoint_carrier_snippet': '', 'formulation_carrier': 'unknown', 'formulation_carrier_snippet': '', 'endpoint_likely_in_supp': 'no', 'formulation_table_missing': 'uncertain', 'notes': '', 'router_source_backend': 'pdf_local', 'router_source_ref': 'papers\\pdf\\10.3389_fchem.2024.1369542__c616ea706a.pdf', 'router_source_diagnostics': ['blocked:html_local:captcha', 'blocked:html_remote:captcha'], 'router_heuristic_signals': {'table_hits': 0, 'figure_hits': 0, 'endpoint_hits': 0, 'formulation_hits': 0}}"
paper_85089b12f9c1,10.3389/fmicb.2023.1275553,Phenotypic and metabolic adaptations of <i>Rhodococcus cerastii</i> strain IEGM 1243 to separate and combined effects of diclofenac and ibuprofen.,unresolved,0.0,unknown,unknown,[],,"{'paper_type': 'uncertain', 'mentions_ibuprofen': 'yes', 'mentions_diffusion_cell': 'no', 'franz_confirmed': 'no', 'where_diffusion_cell': '', 'where_franz': '', 'study_type': 'uncertain', 'barrier_category': 'uncertain', 'barrier_name_raw': '', 'endpoint_found': 'no', 'endpoint_time_found': 'no', 'where_endpoint': '', 'endpoint_carrier': 'unknown', 'endpoint_carrier_snippet': '', 'formulation_carrier': 'unknown', 'formulation_carrier_snippet': '', 'endpoint_likely_in_supp': 'uncertain', 'formulation_table_missing': 'uncertain', 'notes': '', 'router_source_backend': 'pdf_local', 'router_source_ref': 'papers\\pdf\\10.3389_fmicb.2023.1275553__273f66808a.pdf', 'router_source_diagnostics': ['blocked:html_local:captcha', 'blocked:html_remote:captcha'], 'router_heuristic_signals': {'table_hits': 0, 'figure_hits': 0, 'endpoint_hits': 0, 'formulation_hits': 0}}"
